index,published,keyword,domain,language,valid,title,description,url,image,archive,content,quote,de,en,la,added
9275e8dcfccb6ecb9c27f3e9115cedaf,2025-10-12T12:08:38Z,'tidal surge',www.stemlynsblog.org,en,0.1,Cardiac arrest: three quick hits,"St.Emlyn's - Emergency Medicine #FOAMed
Learn more about innovations in Cardiac Arrest management: 3 quick hits to stay prepared and respond effectively in critical situations. @stemlyns #FOAMed
The post Cardiac arrest: three quick hits appeared first on St.E…",https://www.stemlynsblog.org/cardiac-arrest-three-quick-hits/,https://www.stemlynsblog.org/wp-content/uploads/2025/10/Cardiac-Arrest.jpg,,"Cardiac arrest is a hot topic on St Emlyns. We are always looking for ways to improve our care for this critical group of patients. Recently, we have put out full articles on intra-arrest stellate ga… [+5152 chars]",,"Herzstillstand: drei schnelle Treffer. St.Emlyn's – Notfallmedizin #FOAMed
Erfahren Sie mehr über Innovationen im Herzstillstand-Management: 3 schnelle Tipps, um in kritischen Situationen vorbereitet zu bleiben und effektiv zu reagieren. @stemlyns #FOAMed
Der Beitrag Herzstillstand: Drei schnelle Treffer erschienen zuerst auf St.E…","Cardiac arrest: three quick hits. St.Emlyn's - Emergency Medicine #FOAMed
Learn more about innovations in Cardiac Arrest management: 3 quick hits to stay prepared and respond effectively in critical situations. @stemlyns #FOAMed
The post Cardiac arrest: three quick hits appeared first on St.E…","Apprehendere cardiacis: tres hit velox. St.Emlyn's - Subitis Medicine #FOAMed
Plus discere de innovationibus in administratione cardiacis: 3 hits velox ad manendum paratus et efficaciter in rebus dubiis respondendi. @stemlyns #FOAMed
Post comprehensionem cardiaci: tres hit velox apparuit primus in St.E…",2025-10-22 02:46:51+00:00
d0e876002529f6f60f7a6ffea61f7078,2025-10-13T23:18:59Z,'flooding mudslide',deadline.com,en,0.1,"L.A. Rain Prompts Mudslide Evacuation Warnings In Pacific Palisades, Eaton Canyon & Hollywood","In a good news/bad news combo typical of life in Southern California, the first appreciable rain in more than six months will help provide some much-needed moisture before the fall fire season, but also potentially cause mudflows around the burn scars from la…",http://deadline.com/2025/10/l-a-rain-evacuation-warnings-pacific-palisades-hollywood-1236583996/,https://deadline.com/wp-content/uploads/2023/12/GettyImages-1865829755.jpg?w=1024,,"In a good news/bad news combo typical of life in Southern California, the first appreciable rain in more than six months will help provide some much-needed moisture before the fall fire season, but a… [+2092 chars]",,"Regen in L.A. löst Warnungen vor Schlammlawinen in Pacific Palisades, Eaton Canyon und Hollywood aus. In einer Kombination aus guten und schlechten Nachrichten, die für das Leben in Südkalifornien typisch ist, wird der erste nennenswerte Regen seit mehr als sechs Monaten dazu beitragen, vor der Brandsaison im Herbst für die dringend benötigte Feuchtigkeit zu sorgen, aber möglicherweise auch Schlammflüsse um die Brandnarben von La … verursachen.","L.A. Rain Prompts Mudslide Evacuation Warnings In Pacific Palisades, Eaton Canyon & Hollywood. In a good news/bad news combo typical of life in Southern California, the first appreciable rain in more than six months will help provide some much-needed moisture before the fall fire season, but also potentially cause mudflows around the burn scars from la…","L.A. Pluvia Promptus Mudslide Evacuationis Monitiones In Pacific Palisades, Eaton Canyon & Hollywood. In bono nuntio/malo nuntium combo typicam vitae in California Australi, prima pluvia aestimabilis plus quam sex menses adiuvabit multum opus umorem ante lapsum ignis tempore praebebit, sed etiam potentia mudfluxus circa cicatrices ardentes ab la ... causant.",2025-10-22 02:46:51+00:00
7277c3294a866753463dd95c51e41278,2025-10-14T17:12:56Z,'flooding mudslide',nypost.com,en,0.1,California storm triggers evacuation in wildfire-scarred LA neighborhoods over mudslide fears,"A rare October storm arrived in California on Tuesday and threatened to pummel wildfire-scarred Los Angeles neighborhoods with heavy rain, high winds and possible mudslides.",https://nypost.com/2025/10/14/us-news/southern-california-storm-triggers-evacuation-for-la-neighborhoods-scarred-by-wildfires/,https://nypost.com/wp-content/uploads/sites/2/2025/10/newspress-collage-pv552a643-1760460758308.jpg?quality=75&strip=all&1760446438&w=1024,,"LOS ANGELES A rare October storm arrived in California on Tuesday and threatened to pummel wildfire-scarred Los Angeles neighborhoods with heavy rain, high winds and possible mudslides. Some homes we… [+5275 chars]",,"Der Sturm in Kalifornien löst wegen der Angst vor Schlammlawinen Evakuierungen in von Waldbränden verwüsteten Stadtteilen von Los Angeles aus. Ein seltener Oktobersturm traf am Dienstag in Kalifornien ein und drohte, die von Waldbränden gezeichneten Stadtteile von Los Angeles mit heftigen Regenfällen, starkem Wind und möglichen Schlammlawinen zu verwüsten.","California storm triggers evacuation in wildfire-scarred LA neighborhoods over mudslide fears. A rare October storm arrived in California on Tuesday and threatened to pummel wildfire-scarred Los Angeles neighborhoods with heavy rain, high winds and possible mudslides.","California tempestas triggers evacuatio in ignitis cicatricibus LA vicinitatibus per timores limosos. Rara Octobris tempestas in Californiam die Martis venit et minabatur ad Pelidae incendium ignitum cicatricum Los Angeles vicinitatibus gravibus pluvia, ventis altis et possibilibus mudslides.",2025-10-22 02:46:51+00:00
60462219dba55d6ce4d0f3f246b0c6f0,2025-10-15T00:00:00Z,'tidal surge',www.nature.com,en,0.1,Comparative study on sea-level rise in the Yangtze River Estuary and Red River Estuary in the recent 30 years,Scientific Reports - Comparative study on sea-level rise in the Yangtze River Estuary and Red River Estuary in the recent 30 years,https://www.nature.com/articles/s41598-025-02232-3,https://media.springernature.com/m685/springer-static/image/art%3A10.1038%2Fs41598-025-02232-3/MediaObjects/41598_2025_2232_Fig1_HTML.png,,"<li>IPCC. Summary for policymakers. In Climate Change 2021: The Physical Science Basis (eds. Masson-Delmotte, V. et al.) 3949 (Cambridge University Press, 2021).
</li><li>Nicholls, R. J. &amp; Cazen… [+10887 chars]",,Vergleichende Studie zum Meeresspiegelanstieg im Mündungsgebiet des Jangtsekiang und des Roten Flusses in den letzten 30 Jahren. Wissenschaftliche Berichte – Vergleichende Studie zum Anstieg des Meeresspiegels im Mündungsgebiet des Jangtsekiang und des Roten Flusses in den letzten 30 Jahren,Comparative study on sea-level rise in the Yangtze River Estuary and Red River Estuary in the recent 30 years. Scientific Reports - Comparative study on sea-level rise in the Yangtze River Estuary and Red River Estuary in the recent 30 years,Comparativum studium de gradu maritimo ortum in Yangtze River Estuary and Red River Estuary in recent 30 years. Scientific Renuntiationes - Comparativae studium de gradu maris ortum in Yangtze River Estuary et Rubrum flumen Estuary in annis XXX,2025-10-22 02:46:51+00:00
8b5673cd47703ecb289090d8316b1c01,2025-10-15T11:11:41Z,'deluge',joindatacops.com,en,0.1,I analyzed 200 e-commerce sites and found 73% of their traffic is fake,A conversion rate of less than 0.1%. That was the moment I realized something was fundamentally broken with the way we measure success on the internet.,https://joindatacops.com/resources/how-73-of-your-e-commerce-visitors-could-be-fake,https://res.cloudinary.com/dzopme5y0/image/upload/v1760527045/articles/lsfftvgdhaxjv39ykoaw.jpg,,"How 73% of Your E-commerce Visitors Could Be Fake
9 min read
A conversion rate of less than 0.1%. That was the moment I realized something was fundamentally broken with the way we measure success o… [+10266 chars]",,"Ich habe 200 E-Commerce-Websites analysiert und festgestellt, dass 73 % ihres Traffics gefälscht sind. Eine Conversion-Rate von weniger als 0,1 %. In diesem Moment wurde mir klar, dass mit der Art und Weise, wie wir den Erfolg im Internet messen, etwas grundlegend nicht stimmte.",I analyzed 200 e-commerce sites and found 73% of their traffic is fake. A conversion rate of less than 0.1%. That was the moment I realized something was fundamentally broken with the way we measure success on the internet.,"Exposui 200 e-commercium situs et inveni 73% negotiationis eorum fictum est. Conversio certe minus quam 0,1% est. Hoc momentum intellexi aliquid fundamentaliter fractum esse quo modo successum in interrete metimur.",2025-10-22 02:46:51+00:00
1074f92d24b62b6591bdfa9efae70824,2025-10-15T12:00:04Z,'flooding brigade',www.the-sun.com,en,0.1,PUTIN COULD DEPLOY 2 MILLION RESERVISTS...,Putin’s battlefield casualties have soared past the bloody one million milestone,http://www.the-sun.com/news/15348945/putin-two-million-reservists-russia-ukraine/,https://www.the-sun.com/wp-content/uploads/sites/6/2025/10/newspress-collage-jmggnw1d1-1760520976131.jpg?quality=90&strip=all&1760506584&w=1920&h=1080&crop=1,,"RUSSIA is preparing to deploy two million reserve soldiers to fight in the meatgrinder war in Ukraine. 
The Kremlin is planning to change a Russian law that would allow Vladimir Putin to send hundre… [+5169 chars]",,PUTIN KÖNNTE 2 MILLIONEN RESERVISTEN EINSETZEN ... Putins Verluste auf dem Schlachtfeld haben die blutige Grenze von einer Million überschritten,PUTIN COULD DEPLOY 2 MILLION RESERVISTS.... Putin’s battlefield casualties have soared past the bloody one million milestone,PUTIN EXPLORET II DECIES RESERVISTES.... Putin pugnae casus volaverunt praeter cruentum unum decies centena milia lapidem,2025-10-22 02:46:51+00:00
09dd95f27ca5102f51bc2ceea8ab7df3,2025-10-15T15:00:47Z,'tidal surge',beincrypto.com,en,0.1,Record-Breaking Flows Define 2025 ETF Boom | US Crypto News,"What is the biggest crypto news today? Record $1 trillion ETF inflows in 2025 highlight booming crypto, bond, and gold funds.",https://beincrypto.com/record-breaking-flows-etf-boom-us-crypto-news/,https://media.zenfs.com/en/beincrypto_us_662/e1801acac66ca638a746cc2ba3a9545d,,"us crypto news for october 16. Photo by BeInCrypto
Welcome to the US Crypto News Morning Briefingyour essential rundown of the most important developments in crypto for the day ahead.
Grab a coffee… [+5029 chars]",,"Rekordverdächtige Zuflüsse bestimmen den ETF-Boom 2025 | US-Krypto-Nachrichten. Was sind heute die größten Krypto-Neuigkeiten? Rekordzuflüsse von ETFs in Höhe von 1 Billion US-Dollar im Jahr 2025 unterstreichen den Boom von Krypto-, Anleihen- und Goldfonds.","Record-Breaking Flows Define 2025 ETF Boom | US Crypto News. What is the biggest crypto news today? Record $1 trillion ETF inflows in 2025 highlight booming crypto, bond, and gold funds.","Record-Breaking Flows Define 2025 ETF Boom | U. Crypto novae. Quid est maximus Crypto nuntium hodie? Record $1 trillion ETF influit in 2025 in luce crypto, vinculum, et pecunia auri sonans.",2025-10-22 02:46:51+00:00
7aa23e4461422703812788033d9b792e,2025-10-15T19:01:08Z,'tidal surge',cleantechnica.com,en,0.1,Renewables In America Will Continue To Rise Despite The Loss Of Incentives,"Facing a loss of incentives, you might expect the installation of renewables to slow down, but in fact it is picking up speed. 
The post Renewables In America Will Continue To Rise Despite The Loss Of Incentives appeared first on CleanTechnica.",https://cleantechnica.com/2025/10/15/renewables-in-america-will-continue-to-rise-despite-the-loss-of-incentives/,https://cleantechnica.com/wp-content/uploads/2024/05/EDFRenewables_MtSterlingFoxSquirrelSolarProject_Photo_by_Matt_Reese-scaled-e1716402001567.jpg,,"Support CleanTechnica's work through a Substack subscription or on Stripe.
First the good news. Rebecca Elliott, energy reporter for the New York Times, wrote recently that the US will continue to s… [+7688 chars]",,"Erneuerbare Energien werden in Amerika trotz des Verlusts von Anreizen weiter zunehmen. Angesichts des Verlusts von Anreizen könnte man erwarten, dass sich die Installation erneuerbarer Energien verlangsamt, aber tatsächlich nimmt sie Fahrt auf. 
Der Beitrag „Erneuerbare Energien in Amerika werden trotz des Verlusts von Anreizen weiter wachsen“ erschien zuerst auf CleanTechnica.","Renewables In America Will Continue To Rise Despite The Loss Of Incentives. Facing a loss of incentives, you might expect the installation of renewables to slow down, but in fact it is picking up speed. 
The post Renewables In America Will Continue To Rise Despite The Loss Of Incentives appeared first on CleanTechnica.","Renewables In America perget Surge Quamvis iactura Stimulus. Adversus iacturam stimulorum, fortasse institutionem renovationum ad morandum expectes, re vera celeritas captans est. 
Post Renewables In America perseveret, Quamvis Damnum Stimulus primum apparuit in CleanTechnica.",2025-10-22 02:46:51+00:00
c8ac35583776e2a47e55292dd55a049d,2025-10-15T19:07:26Z,'flooding relief',www.npr.org,en,0.1,The federal government is still shut down. Here's what that means across the country,The federal government is currently shut down. The NPR Network is following the ways the government shutdown is affecting services across the country.,https://www.npr.org/2025/10/15/nx-s1-5575134/government-shutdown,https://npr.brightspotcdn.com/dims3/default/strip/false/crop/4000x2250+0+204/resize/1400/quality/100/format/jpeg/?url=http%3A%2F%2Fnpr-brightspot.s3.amazonaws.com%2F7e%2F6d%2F1530a6114f88b32d6fc1f079fb00%2Fgettyimages-2238643033.jpg,,"The government shutdown has lasted 15 days and counting. 
Republicans and Democrats appear no closer to an agreement to reopen it. The Senate again tried and failed Wednesday to advance a bill to re… [+21621 chars]",,"Die Bundesregierung ist immer noch geschlossen. Hier erfahren Sie, was das im ganzen Land bedeutet. Die Bundesregierung ist derzeit geschlossen. Das NPR-Netzwerk verfolgt, wie sich der Regierungsstillstand auf die Dienste im ganzen Land auswirkt.",The federal government is still shut down. Here's what that means across the country. The federal government is currently shut down. The NPR Network is following the ways the government shutdown is affecting services across the country.,Imperium foederatum adhuc clausum est. Hic id est congue. Imperium foederati hodie occlusum est. NPR Network vias secutus est imperium shutdown officia per regionem afficit.,2025-10-22 02:46:51+00:00
7d5e5338f3c8fb4fb31c1a822605ea02,2025-10-16T04:00:00Z,'flooding military',www.americanthinker.com,en,0.1,Europe in the Rare Earth Trap,"Rare earth elements have become geopolitical dynamite. According to a new analysis by consultancy McKinsey & Company, up to four million jobs in Germany are on the line if top supplier China imposes a permanent export ban.

These critical miner...",https://www.americanthinker.com/articles/2025/10/europe_in_the_rare_earth_trap.html,https://images.americanthinker.com/jm/jmqcxhvjhurqiats9qys_800.jpg,,"Rare earth elements have become geopolitical dynamite. According to a new analysis by consultancy McKinsey &amp; Company, up to four million jobs in Germany are on the line if top supplier China impo… [+5158 chars]",,"Europa in der Falle der Seltenen Erden. Seltene Erden sind zu geopolitischem Sprengstoff geworden. Laut einer neuen Analyse des Beratungsunternehmens McKinsey & Company stehen bis zu vier Millionen Arbeitsplätze in Deutschland auf dem Spiel, wenn der Top-Zulieferer China einen dauerhaften Exportstopp verhängt.

Diese kritischen Bergleute...","Europe in the Rare Earth Trap. Rare earth elements have become geopolitical dynamite. According to a new analysis by consultancy McKinsey & Company, up to four million jobs in Germany are on the line if top supplier China imposes a permanent export ban.

These critical miner...","Europa in Terra Rara Trap. Rara terrae elementa dynamitis geopoliticis facta sunt. Secundum novam analysin a consultu McKinsey & Company, usque ad quattuor miliones jobs in Germania in acie sunt, si suprema elit Sinarum exportandi bannum permanentem imponit.

Haec miner critica...",2025-10-22 02:46:51+00:00
504123967d598e31e079d23319c0e822,2025-10-16T14:50:12Z,'flooding military',apnews.com,en,0.1,Hundreds of Alaskans are being airlifted from coastal villages ravaged by Typhoon Halong,"One of the most significant airlifts in Alaska history was underway Wednesday to move hundreds of people from coastal villages ravaged by high surf and strong winds from the remnants of Typhoon Halong last weekend, officials said.",https://apnews.com/article/alaska-typhoon-halong-flood-b95379dc3b4700d620abd92f70240c5e,https://nypost.com/wp-content/uploads/sites/2/2025/10/newspress-collage-wtssuxb11-1760622806734.jpg?quality=75&strip=all&1760608450&w=1024,,"JUNEAU, Alaska (AP) One of the most significant airlifts in Alaska history was underway Wednesday to move hundreds of people from coastal villages ravaged by high surf and strong winds from the remna… [+4742 chars]",,"Hunderte Einwohner Alaskas werden aus Küstendörfern geflogen, die vom Taifun Halong verwüstet wurden. Eine der bedeutendsten Lufttransporte in der Geschichte Alaskas war am Mittwoch im Gange, um Hunderte Menschen aus Küstendörfern zu transportieren, die am vergangenen Wochenende von hoher Brandung und starken Winden durch die Überreste des Taifuns Halong verwüstet worden waren, sagten Beamte.","Hundreds of Alaskans are being airlifted from coastal villages ravaged by Typhoon Halong. One of the most significant airlifts in Alaska history was underway Wednesday to move hundreds of people from coastal villages ravaged by high surf and strong winds from the remnants of Typhoon Halong last weekend, officials said.","Centum Alascanorum e pagis maritimis a Typhon Halong depopulati sunt. Una e maximis airlifts in historia Alaska erat comparata Mercurii, ut centum homines ex castellis maritimis depopularentur, salo magno et valido ventorum reliquiarum Typhoon Halong proximae volutpat ministri dixit.",2025-10-22 02:46:51+00:00
945ba3bb93536205168b208a1db89b3b,2025-10-16T14:55:04Z,'deluge',phys.org,en,0.1,Why India's monsoon is becoming more extreme—even though overall rainfall has hardly increased,"Across India, torrential rains over the past few months have swallowed an entire village in the Himalayas, flooded Punjab's farmlands and brought Kolkata to a standstill. This all happened in a monsoon season in which total rainfall was technically only 8% ab…",https://phys.org/news/2025-10-india-monsoon-extreme-rainfall.html,https://scx2.b-cdn.net/gfx/news/2025/why-indias-monsoon-is.jpg,,"Across India, torrential rains over the past few months have swallowed an entire village in the Himalayas, flooded Punjab's farmlands and brought Kolkata to a standstill. This all happened in a monso… [+4460 chars]",,"Warum der Monsun in Indien immer extremer wird – obwohl die Niederschläge insgesamt kaum zugenommen haben. In ganz Indien haben heftige Regenfälle in den letzten Monaten ein ganzes Dorf im Himalaya verschluckt, das Ackerland des Punjab überschwemmt und Kalkutta zum Stillstand gebracht. Dies alles geschah in einer Monsunzeit, in der die Gesamtniederschlagsmenge technisch gesehen nur 8 % betrug …","Why India's monsoon is becoming more extreme—even though overall rainfall has hardly increased. Across India, torrential rains over the past few months have swallowed an entire village in the Himalayas, flooded Punjab's farmlands and brought Kolkata to a standstill. This all happened in a monsoon season in which total rainfall was technically only 8% ab…","Quare monsonus Indiae magis extrema fit - quamquam altiore imbre vix aucta est. Trans Indiam imbres torrentes per hos menses integrum pagum in Himalayas deglutiverunt, praedia Punjab inundata et Kolkata haesitantibus attulerunt. Hoc totum accidit in tempore ETESIA, in quo summa pluviarum erat technice tantum 8% ab ...",2025-10-22 02:46:51+00:00
c86120e4cb90d2dfd66d4d0ec2064584,2025-10-16T21:24:40Z,'flooding military',theintercept.com,en,0.1,The Pentagon Is Learning It’s Not So Easy to Sink a Boat,"Videos of U.S. attacks in the Caribbean suggest boats have been obliterated in a single strike. The reality is a lot messier.
The post The Pentagon Is Learning It’s Not So Easy to Sink a Boat appeared first on The Intercept.",https://theintercept.com/2025/10/16/trump-venezuela-boat-strikes/,https://theintercept.com/wp-content/uploads/2025/10/Screenshot-2025-10-16-at-11.14.43-AM-e1760648260776.png?fit=2862%2C1430&w=1200&h=800,,"U.S. military attacks on suspected drug smugglers in the Caribbean have been less effective than portrayed by the Pentagon, the White House, or in videos released on social media by President Donald … [+10435 chars]",,"Das Pentagon lernt, dass es nicht so einfach ist, ein Boot zu versenken. Videos von US-Angriffen in der Karibik deuten darauf hin, dass Boote durch einen einzigen Angriff zerstört wurden. Die Realität ist viel chaotischer.
Der Beitrag „Das Pentagon lernt, dass es nicht so einfach ist, ein Boot zu versenken“ erschien zuerst auf The Intercept.","The Pentagon Is Learning It’s Not So Easy to Sink a Boat. Videos of U.S. attacks in the Caribbean suggest boats have been obliterated in a single strike. The reality is a lot messier.
The post The Pentagon Is Learning It’s Not So Easy to Sink a Boat appeared first on The Intercept.","Pentagoni discit Non est tam Securus demergi cymba. Imagines of US impetus in Caribbean suggerunt navigia uno ictu obliteratas esse. Aliquam sit amet elit est.
Post The Pentagonum discendi non est tam Securus demergi cymba primum apparuit in Intercept.",2025-10-22 02:46:51+00:00
61cdb31dbbcc7ce42502ca25147e8d99,2025-10-17T03:54:53Z,'flooding brigade',freerepublic.com,en,0.1,"[2 years of] Swastika ""palestine""","Nazi themed pro ""palestine"" so-called activism post Oct 7 Islamo Arab Gaza genocidal regime [Hamas] atrocities. Oct 7, 2023+Anne Bayefsky @AnneBayefsky:Palestinian #Nazi progeny appear on the streets of New York City today, as the swastika is flashed at a pro…",https://freerepublic.com/focus/f-bloggers/4346869/posts,,,"Skip to comments.
[2 years of] Swastika ""palestine""Saying it ^
 | 10.16.25
Posted on 10/16/2025 8:54:53 PM PDT by Words Matter 
Nazi themed pro ""palestine"" so-called activism post Oct 7 Islamo Ar… [+105297 chars]",,"[2 Jahre] Hakenkreuz „Palästina“. Nazi-Themen pro „Palästina“ sogenannter Aktivismus nach den Gräueltaten des islamisch-arabischen Gaza-Völkermörderregimes [Hamas] am 7. Oktober. 7. Okt. 2023+Anne Bayefsky @AnneBayefsky:Palästinensische #Nazi-Nachkommen tauchen heute auf den Straßen von New York City auf, als das Hakenkreuz vor einem Profi geblitzt wird…","[2 years of] Swastika ""palestine"". Nazi themed pro ""palestine"" so-called activism post Oct 7 Islamo Arab Gaza genocidal regime [Hamas] atrocities. Oct 7, 2023+Anne Bayefsky @AnneBayefsky:Palestinian #Nazi progeny appear on the streets of New York City today, as the swastika is flashed at a pro…","[II anno Domini] Swastika ""Palaestina"". Nazi lemma pro ""palestina"" activismum sic dictum post Oct 7 Islamo Arabum Gazae regiminis genocidal [Hamas] flagitiorum. Oct 7, 2023+Anne Bayefsky @AnneBayefsky:Palaestinae #Nazi soboles in plateis Novi Eboraci hodie apparent sicut swastika in a pro…",2025-10-22 02:46:51+00:00
bb462b116161340fcfae7982bd458add,2025-10-17T04:00:00Z,'flooding military',www.americanthinker.com,en,0.1,"America is Back: ICE Raids, Crushing Cartels, and Confronting Venezuela","(See also, “US jets buzzing Venezuela and Trump issues CIA lethal cover action order” by Monica Showalter.)

In the shadowy corridors of power, where Democrats have long peddled their illusions of a kinder, gentler America, the truth ha...",https://www.americanthinker.com/articles/2025/10/america_is_back_ice_raids_crushing_cartels_and_confronting_venezuela.html,https://images.americanthinker.com/5y/5yjdjrfvidabpv4itcyv_800.jpg,,"(See also, “US jets buzzing Venezuela and Trump issues CIA lethal cover action order” by Monica Showalter.)
In the shadowy corridors of power, where Democrats have long peddled their illusions of a … [+6563 chars]",,"Amerika ist zurück: ICE-Überfälle, Zerschlagung von Kartellen und Konfrontation mit Venezuela. (Siehe auch „US-Jets fliegen über Venezuela und Trump erlässt CIA-Aktionsbefehl zur tödlichen Tarnung“ von Monica Showalter.)

In den schattigen Korridoren der Macht, in denen die Demokraten seit langem mit ihren Illusionen von einem freundlicheren, sanfteren Amerika hausieren, ist die Wahrheit ...","America is Back: ICE Raids, Crushing Cartels, and Confronting Venezuela. (See also, “US jets buzzing Venezuela and Trump issues CIA lethal cover action order” by Monica Showalter.)

In the shadowy corridors of power, where Democrats have long peddled their illusions of a kinder, gentler America, the truth ha...","Americae Back est: Rationes ICE, cartels comminuens et Venezuela opponens. (Vide etiam, stridore US Venetiola et BUCINUM CIA lethalis actionis ordo exit.

In obscuro corridores potentiae, ubi Democratae diu venditaverunt suas praestigias benigniores, leniores Americae, veritatem ha...",2025-10-22 02:46:51+00:00
