index,url,valid,domain,title,description,image,published,archive,content,quote,language,keyword
https://www.fox7austin.com/news/texas-flooding-how-has-recent-rain-affected-local-lake-creek-levels,https://www.fox7austin.com/news/texas-flooding-how-has-recent-rain-affected-local-lake-creek-levels,0,www.fox7austin.com,"Texas flooding: How has recent rain affected local lake, creek levels?",FOX 7 Austin has taken a look into the local levels at a couple of lakes and creeks since the Fourth of July floods.,https://s.yimg.com/ny/api/res/1.2/IJYa9nZCaGQkyKenpGhxFA--/YXBwaWQ9aGlnaGxhbmRlcjt3PTEyMDA7aD02NzU7Y2Y9d2VicA--/https://media.zenfs.com/en/ktbc_fox_local_articles_950/85cf0af3be33c10d0fe14f7e633b90b5,2025-07-09T03:12:14Z,,"The Brief
<ul><li>Lake Travis has risen by 21 feet after recent rain this past weekend, but is still under the average for this time of year
</li><li>Lake Buchanan is up nearly 10 feet
</li></ul>A… [+1052 chars]",,en,'flooding'
https://abcnews.go.com/International/wireStory/rescuers-search-19-missing-recover-9-bodies-after-123595886,https://abcnews.go.com/International/wireStory/rescuers-search-19-missing-recover-9-bodies-after-123595886,0,abcnews.go.com,Rescuers search for 19 missing and recover 9 bodies after flooding in Nepal,Rescuers are searching for 19 people missing in severe flooding in Nepal that swept away a key bridge connecting the country with China,https://i.abcnewsfe.com/a/0f8e23c4-50c1-489c-b01d-0d72e980f54e/wirestory_013b27f79752be8138763842600450ac_16x9.jpg?w=1600,2025-07-09T04:06:16Z,,"KATHMANDU, Nepal -- Dozens of rescuers searched the banks of a mountain river Wednesday looking for people missing after monsoon floods swept away Nepal's main bridge connecting to the country to Chi… [+1610 chars]",,en,'flooding'
https://www.thestar.com.my/news/world/2025/07/09/flash-flooding-in-new-mexico-resort-town-traps-dozens-in-homes-and-vehicles,https://www.thestar.com.my/news/world/2025/07/09/flash-flooding-in-new-mexico-resort-town-traps-dozens-in-homes-and-vehicles,0,www.thestar.com.my,Flash flooding in New Mexico resort town traps dozens in homes and vehicles,"(Reuters) -Flash flooding triggered by heavy monsoon rains in New Mexico trapped dozens of people in homes and vehicles in and around the mountain resort village of Ruidoso on Tuesday and swept away an entire house, according to a state emergency official sai…",https://apicms.thestar.com.my/uploads/images/2025/07/09/3407402.jpg,2025-07-09T04:22:00Z,,(Reuters) -Flash flooding triggered by heavy monsoon rains in New Mexico trapped dozens of people in homes and vehicles in and around the mountain resort village of Ruidoso on Tuesday and swept away … [+1791 chars],,en,'flooding house'
https://abcnews.go.com/US/wireStory/3-missing-house-swept-flash-flooding-hits-mountain-123593319,https://abcnews.go.com/US/wireStory/3-missing-house-swept-flash-flooding-hits-mountain-123593319,0,abcnews.go.com,"3 missing, house swept away as flash flooding hits mountain village in New Mexico",At least three people are missing in a mountain village that is a popular summer retreat in southern New Mexico after monsoon rains triggered flash flooding so intense an entire house was swept downstream,https://i.abcnewsfe.com/a/c3198601-eb20-49b0-a873-20d1b19294b7/wirestory_189b28910c458a3fdfe7114322c51188_16x9.jpg?w=1600,2025-07-09T05:02:07Z,,"SANTA FE, N.M. -- At least three people were missing in a mountain village in southern New Mexico that is a popular summer retreat after monsoon rains triggered flash flooding Tuesday that was so int… [+4226 chars]",,en,'flooding area'
https://biztoc.com/x/968bc4cb37541875,https://biztoc.com/x/968bc4cb37541875,0,biztoc.com,"Multiple water rescues, home swept away as flash flood emergency declared in New Mexico","New Mexico's flooding rains trapped multiple people and water rescues were underway in the state's south on Tuesday, according to the National Weather Service.
The big picture: The NWS' Albuquerque office reported after declaring a flash flood emergency for t…",https://biztoc.com/cdn/968bc4cb37541875_s.webp,2025-07-09T05:14:06Z,,"New Mexico's flooding rains trapped multiple people and water rescues were underway in the state's south on Tuesday, according to the National Weather Service.The big picture: The NWS' Albuquerque of… [+143 chars]",,en,'flooding'
https://kyweathercenter.com/?p=71813,https://kyweathercenter.com/?p=71813,0,kyweathercenter.com,Pockets of Flash Flooding Possible,"Good Wednesday to one and all. It’s another day with showers and storms impacting parts of the Commonwealth. While not everyone sees rain, those who do can pick up on enough to cause some local flash flooding issues. There’s a lot of moisture available for sh…",,2025-07-09T05:28:08Z,,"Good Wednesday to one and all. It’s another day with showers and storms impacting parts of the Commonwealth. While not everyone sees rain, those who do can pick up on enough to cause some local flash… [+1439 chars]",,en,'flooding storm'
https://www.thejournal.ie/new-mexico-flooding-6757360-Jul2025/,https://www.thejournal.ie/new-mexico-flooding-6757360-Jul2025/,0,www.thejournal.ie,Three people missing in New Mexico in the US after flash flooding,Water rose more than 20ft and breached banks of the Rio Ruidoso river overnight.,https://img2.thejournal.ie/article/6757360/river/?height=400&version=6757376,2025-07-09T05:55:37Z,,"AT LEAST THREE people are missing in New Mexico in the US after flash flooding overnight.
Emergency crews carried out at least 85 swift water rescues in the Ruidoso area, including of people who wer… [+1436 chars]",,en,'flooding area'
https://nypost.com/2025/07/09/us-news/texas-flooding-camp-mystic-emergency-plan-approved-by-inspectors-days-before-disaster/,https://nypost.com/2025/07/09/us-news/texas-flooding-camp-mystic-emergency-plan-approved-by-inspectors-days-before-disaster/,0,nypost.com,Camp Mystic’s disaster plan OK’d by state inspectors 2 days before deadly Texas floods,"Camp Mystic’s emergency plan was approved by Texas inspectors just two days before disaster struck Friday when floods ravaged the grounds, killing 27 campers and counselors, according to a report.…",https://nypost.com/wp-content/uploads/sites/2/2025/07/texas-inspectors-approved-camp-mystic-107858004.jpg?quality=75&strip=all&w=1024,2025-07-09T06:19:35Z,,"Camp Mystics emergency plan was approved by Texas inspectors just two days before disaster struck Friday when floods ravaged the grounds, killing 27 campers and counselors, according to a report.
Th… [+2194 chars]",,en,'flooding death'
https://slashdot.org/firehose.pl?op=view&amp;id=178316590,https://slashdot.org/firehose.pl?op=view&amp;id=178316590,0,slashdot.org,"Texas inspectors approved Camp Mystic’s disaster plan 2 days before deadly flood, records show - AP News","Texas inspectors approved Camp Mystic’s disaster plan 2 days before deadly flood, records showAP News Days after Texas floods, at least 161 people are still missing in one countyBBC Texas governor says 109 dead from floods, at least 161 missingYahoo Texas flo…",,2025-07-09T06:32:35Z,,"Five is a sufficiently close approximation to infinity.
-- Robert Firth
""One, two, five.""
-- Monty Python and the Holy Grail",,en,'floods'
https://www.bbc.com/news/articles/cx2jk51xv65o,https://www.bbc.com/news/articles/cx2jk51xv65o,0,www.bbc.com,At least three dead in New Mexico flash flooding,A man and two children were swept downstream after heavy rain caused the Ruidoso river to rise to an historic level.,https://ichef.bbci.co.uk/news/1024/branded_news/54f2/live/01ea7fc0-5c80-11f0-b5c5-012c5796682d.jpg,2025-07-09T07:21:36Z,,"Tabby Wilson
Watch: Moment house is swept away in New Mexico flash flooding
At least three people are dead in the village of Ruidoso, New Mexico after heavy rain caused flash flooding. 
Up to 8.8c… [+1637 chars]",,en,'flooding rain'
https://abcnews.go.com/US/deadly-new-mexico-flooding-rio-ruidoso/story?id=123599023,https://abcnews.go.com/US/deadly-new-mexico-flooding-rio-ruidoso/story?id=123599023,0,abcnews.go.com,"3 dead, including 2 children, in New Mexico flooding, local authorities say","The Village of Ruidoso said three people died in ""historic"" flash flooding.",https://i.abcnewsfe.com/a/de3e810d-d797-4c7a-9602-ecc877866646/ruidoso-main_1752046103553_hpMain_16x9.jpg?w=1600,2025-07-09T07:42:32Z,,"A man and two children were killed in a record-breaking flash flood that swept through a village in New Mexico on Tuesday, local officials said.
The three were ""swept downstream by the unprecedented… [+1015 chars]",,en,'flooding'
https://timesofindia.indiatimes.com/city/nagpur/nagpur-floods-12-rescued-from-submerged-areas-as-nmc-fire-teams-brave-rising-waters/articleshow/122338073.cms,https://timesofindia.indiatimes.com/city/nagpur/nagpur-floods-12-rescued-from-submerged-areas-as-nmc-fire-teams-brave-rising-waters/articleshow/122338073.cms,0,timesofindia.indiatimes.com,Nagpur floods: 12 rescued from submerged areas as NMC fire teams brave rising waters,"Rescue teams in Nagpur are working tirelessly to evacuate residents stranded by floodwaters in areas like Nav Kanya Nagar and Narsala. The Nagpur Municipal Corporation's Fire and Emergency Services Department, led by Chief Fire Officer Tushar Barahate, has re…","https://static.toiimg.com/thumb/msid-122338139,width-1070,height-580,imgsize-421713,resizemode-75,overlay-toi_sw,pt-32,y_pad-40/photo.jpg",2025-07-09T08:04:41Z,,10 foods that help relieve constipation naturally,,en,'floods'
https://www.independent.ie/world-news/north-america/three-missing-and-house-swept-away-as-flash-flooding-hits-mountain-village-in-new-mexico-us/a1212822578.html,https://www.independent.ie/world-news/north-america/three-missing-and-house-swept-away-as-flash-flooding-hits-mountain-village-in-new-mexico-us/a1212822578.html,0,www.independent.ie,"Three missing and house swept away as flash flooding hits mountain village in New Mexico, US",At least three people were missing in a mountain village in southern New Mexico after monsoon rains triggered flash flooding on Tuesday that was so intense an entire house was swept downstream.,https://focus.independent.ie/thumbor/8dLfSmkfJWUlvKWYRPDuUAFLu80=/0x161:2790x2021/629x0/prod-mh-ireland/34add607-20e0-4639-8441-87b7e5a5cb37/f45a48f5-3b7e-42bd-9a07-751634c43d1d/34add607-20e0-4639-8441-87b7e5a5cb37.jpg,2025-07-09T08:05:56Z,,"No deaths were immediately reported, but three people had been taken to the hospital and were in stable condition
At least three people were missing in a mountain village in southern New Mexico afte… [+348 chars]",,en,'flooding'
https://www.aljazeera.com/gallery/2025/7/9/catastrophic-texas-floods-leave-over-160-missing-death-toll-rises-to-109,https://www.aljazeera.com/gallery/2025/7/9/catastrophic-texas-floods-leave-over-160-missing-death-toll-rises-to-109,0,www.aljazeera.com,"Catastrophic Texas floods leave over 160 missing, death toll rises to 109",Hundreds of rescuers search for people swept away by catastrophic Texas floods that killed at least 100.,https://www.aljazeera.com/wp-content/uploads/2025/07/AFP__20250708__668C9Y7__v2__HighRes__MultipleDeathsFromCatastrophicFloodingInCentral-1752044979.jpg?resize=1920%2C1440,2025-07-09T08:06:50Z,,"More than 160 people remain unaccounted for after devastating floods in Texas, Governor Greg Abbott announced, marking a dramatic increase in the number of missing from a disaster that has already ki… [+1782 chars]",,en,'floods'
https://english.khabarhub.com/2025/09/484611/,https://english.khabarhub.com/2025/09/484611/,0,english.khabarhub.com,"Landslide blocks Myagdi River, authorities urge caution","MYAGDI: A landslide in Dhaulagiri Rural Municipality–4 of Myagdi district has blocked the Myagdi River, creating an artificial lake and raising concerns about potential downstream flooding. According to Vice Chairperson of Dhaulagiri Rural Municipality, Resha…",https://english.khabarhub.com/wp-content/uploads/2025/07/Myagdi-River.jpg,2025-07-09T08:24:17Z,,"MYAGDI: A landslide in Dhaulagiri Rural Municipality4 of Myagdi district has blocked the Myagdi River, creating an artificial lake and raising concerns about potential downstream flooding.
According… [+1432 chars]",,en,'floods'
https://www.hospitalitynet.org/news/4128064.html,https://www.hospitalitynet.org/news/4128064.html,0,www.hospitalitynet.org,"Airbnb.org provides free, emergency housing to people impacted by flooding in central Texas","To support those impacted by recent flooding in central Texas, Airbnb.org—a nonprofit founded by Airbnb to provide emergency housing in times of crisis—is working with nonprofit organization All Hands and Hearts, state and local officials, and local nonprofit…",https://www.hospitalitynet.org/HN-icon.jpg,2025-07-09T08:34:00Z,,"Key Takeaways
<ul><li>Airbnb.org is providing free, emergency housing to people impacted by flooding in central Texas.</li><li>Airbnb.org is working with All Hands and Hearts, state and local offici… [+5244 chars]",,en,'floods'
https://fortune.com/2025/07/09/texas-approved-camp-mystic-disaster-plans-2-days-deadly-flooding-killed/,https://fortune.com/2025/07/09/texas-approved-camp-mystic-disaster-plans-2-days-deadly-flooding-killed/,0,fortune.com,Texas approved Camp Mystic’s disaster plans just 2 days before deadly flooding killed more than 2 dozen people there,The uncertainty about what happened at Mystic comes as local officials have repeatedly dodged questions about who was monitoring the weather and what measures were taken ahead of the flooding.,"https://fortune.com/img-assets/wp-content/uploads/2025/07/AP25186761887279-e1752051028241.jpg?resize=1200,600",2025-07-09T08:52:15Z,,"Texas inspectors signed off on Camp Mystics emergency planning just two days before catastrophic flooding killed more than two dozen people at the all-girls Christian summer camp, most of them childr… [+5602 chars]",,en,'floods'
https://www.thestar.com.my/tech/tech-news/2025/07/09/texas-floods-misinformation-across-political-spectrum-sows-confusion,https://www.thestar.com.my/tech/tech-news/2025/07/09/texas-floods-misinformation-across-political-spectrum-sows-confusion,0,www.thestar.com.my,Texas floods: Misinformation across political spectrum sows confusion,"Following deadly floods in Texas, misinformation from both left- and right-wing users was roiling social media, with liberals baselessly blaming staffing cuts at US weather agencies for flawed warning systems and conservatives ramping up conspiracy theories. …",https://apicms.thestar.com.my/uploads/images/2025/07/09/3407974.JPG,2025-07-09T09:00:00Z,,"WASHINGTON: Following deadly floods in Texas, misinformation from both left- and right-wing users was roiling social media, with liberals baselessly blaming staffing cuts at US weather agencies for f… [+3652 chars]",,en,'flooding area'
https://newrepublic.com/article/197723/trump-press-sec-fury-media-texas-flood-exposes-worst-maga,https://newrepublic.com/article/197723/trump-press-sec-fury-media-texas-flood-exposes-worst-maga,0,newrepublic.com,Trump Press Sec’s Fury at Media over Texas Flood Exposes Worst of MAGA,"At least 109 people have died amid devastating flooding in Texas. Distressingly, 27 deaths occurred at a summer camp for girls, and the toll continues to rise.  This week, White House press secretary Karoline Leavitt angrily lashed out at the news media and D…",https://images.newrepublic.com/f54dab3dd85c0dd0ac16408b8a0c5e43855c57a0.jpeg?w=1200&h=630&crop=faces&fit=crop&fm=jpg,2025-07-09T09:00:00Z,,"At least 109 people have died amid devastating flooding in Texas. Distressingly, 27 deaths occurred at a summer camp for girls, and the toll continues to rise.  This week, White House press secretary… [+741 chars]",,en,'flooding house'
https://abcnews.go.com/US/inspectors-signed-off-camp-mystics-emergency-plans-days/story?id=123601635,https://abcnews.go.com/US/inspectors-signed-off-camp-mystics-emergency-plans-days/story?id=123601635,0,abcnews.go.com,Inspectors signed off on Camp Mystic's emergency plans days before flooding,Camps are required to develop their own emergency plans.,https://i.abcnewsfe.com/a/1506b977-5d10-44e7-bd00-af115e360455/camp-mystic-main_1752056247742_hpMain_16x9.jpg?w=1600,2025-07-09T10:25:28Z,,"Just two days before devastating floods claimed at least 27 lives at Camp Mystic, the Texas Department of State Health Services signed off on the youth camp's emergency plans, according to records ob… [+1340 chars]",,en,'flooding'
https://www.npr.org/2025/07/09/g-s1-76699/up-first-newsletter-texas-floods-gaza-israel-ukraine-russia-federal-layoffs,https://www.npr.org/2025/07/09/g-s1-76699/up-first-newsletter-texas-floods-gaza-israel-ukraine-russia-federal-layoffs,0,www.npr.org,"Over 160 people still missing after Texas floods. And, federal layoffs can now resume","The death toll for the Texas floods tops 100 as the search and rescue efforts continue for over 160 missing people. And, the Supreme Court is allowing Trump to resume mass federal layoffs for now.",https://npr.brightspotcdn.com/dims3/default/strip/false/crop/8256x4644+0+430/resize/1400/quality/100/format/jpeg/?url=http%3A%2F%2Fnpr-brightspot.s3.amazonaws.com%2F48%2F7a%2F7e4487a446b0a7af24370c0f4db8%2Fgettyimages-2223570023.jpg,2025-07-09T10:48:29Z,,"Good morning. You're reading the Up First newsletter. Subscribe here to get it delivered to your inbox, and listen to the Up First podcast for all the news you need to start your day.
Today's top st… [+5671 chars]",,en,'floods'
https://newrepublic.com/article/197728/transcript-trump-press-sec-rages-media-floods-exposing-maga,https://newrepublic.com/article/197728/transcript-trump-press-sec-rages-media-floods-exposing-maga,0,newrepublic.com,"Transcript: Trump Press Sec Rages at Media over Floods, Exposing MAGA","The following is a lightly edited transcript of the July 9 episode of the Daily Blast podcast. Listen to it here.Greg Sargent: This is The Daily Blast from The New Republic, produced and presented by the DSR network. I’m your host, Greg Sargent.As of this rec…",https://images.newrepublic.com/3d3926157396bed3be51181be54c34d14c5b2655.jpeg?w=1200&h=630&crop=faces&fit=crop&fm=jpg,2025-07-09T11:23:07Z,,"The following is a lightly edited transcript of the July 9 episode of the Daily Blast podcast. Listen to it here.
Greg Sargent: This is The Daily Blast from The New Republic, produced and presented … [+3504 chars]",,en,'floods'
https://www.cnn.com/2025/07/09/weather/video/texas-governor-abbott-presser-flood-football-analogy-contd-digvid?cid=external-feeds_iluminar_yahoo,https://www.cnn.com/2025/07/09/weather/video/texas-governor-abbott-presser-flood-football-analogy-contd-digvid?cid=external-feeds_iluminar_yahoo,0,www.cnn.com,Texas governor scolds reporter when asked who to blame for flood response,Texas Gov. Greg Abbott used a football analogy after being asked about the emergency response to the catastrophic flooding that killed more than a 100 people...,https://media.zenfs.com/en/cnn_videos_177/8c92b2eb15ee3ccf4112ecad5ac0356f,2025-07-09T11:53:32Z,,Texas Gov. Greg Abbott used a football analogy after being asked about the emergency response to the catastrophic flooding that killed more than a 100 people in the state.,,en,'flooding'
https://abcnews.go.com/US/rain-flood-camp-mystic-campers-woke-devastation-july/story?id=123601858,https://abcnews.go.com/US/rain-flood-camp-mystic-campers-woke-devastation-july/story?id=123601858,0,abcnews.go.com,"First the rain, then the flood: How Camp Mystic campers woke to devastation on July 4","""And our cabins are high up, and for them to be flooding, it's like, you know, something's wrong,"" Georgia Jones said.",https://i.abcnewsfe.com/a/89e44922-a24a-496f-b472-dd1721e51463/georgia-eloise-jones-abc-jef-250709_1752062361782_hpMain_16x9.jpg?w=1600,2025-07-09T12:26:58Z,,"The thunder and lighting came to Camp Mystic first, but that was normal.
The storm and the driving rain at the Texas camp woke up some of the campers, including Georgia and Eloise Jones, at about 1 … [+1305 chars]",,en,'flooding rain'
https://www.tmz.com/2025/07/09/new-mexico-flood-house-swept-away/,https://www.tmz.com/2025/07/09/new-mexico-flood-house-swept-away/,0,www.tmz.com,Shocking Video Shows New Mexico Home Swept Away in Flash Flood,"A New Mexico town was slammed by historic, deadly flash floods ... with one shocking video showing a home floating away in the rushing water. Heavy rain sparked the record-setting floods in Ruidoso -- a small village about 180 miles away from…",https://imagez.tmz.com/image/ab/16by9/2025/07/09/ab4f849763444d10ab9cd4ab2a5e6415_xl.jpg,2025-07-09T13:06:35Z,,"A New Mexico town was slammed by historic, deadly flash floods ... with one shocking video showing a home floating away in the rushing water.
Heavy rain sparked the record-setting floods in Ruidoso … [+732 chars]",,en,'floods'
https://abcnews.go.com/world-news-tonight-with-david-muirT/video/david-muir-speaks-texas-son-searching-parents-after-123606653,https://abcnews.go.com/world-news-tonight-with-david-muirT/video/david-muir-speaks-texas-son-searching-parents-after-123606653,0,abcnews.go.com,WATCH: David Muir speaks with Texas son still searching for parents after flooding,"Along the banks of the Guadalupe River, David Muir meets with Robert Brake Jr. as he searches for his parents who were washed away by the rapidly rising floods.",https://i.abcnewsfe.com/a/bcbbe74c-7266-4ed5-9ee1-d12a99081527/250709_wnt_social_flooding2_hpMain_9x16.jpg?w=992,2025-07-09T13:28:01Z,,"<ul><li>3 killed as flash flooding hits Southwest
</li><li>Death toll rises to 110 after deadly Texas floods
</li><li>Trump criticizes Putin as US prepares to send more weapons to Ukraine
</li><li… [+4502 chars]",,en,'floods'
https://www.palmbeachpost.com/story/weather/hurricane/2025/07/09/colorado-state-university-updates-its-2025-hurricane-season-forecast/84509205007/,https://www.palmbeachpost.com/story/weather/hurricane/2025/07/09/colorado-state-university-updates-its-2025-hurricane-season-forecast/84509205007/,0,www.palmbeachpost.com,Colorado State University issues updated 2025 hurricane season forecast,Barry and Chantel were short-lived tropical storms their remnants caused killer flooding in Texas and North Carolina.,https://s.yimg.com/ny/api/res/1.2/shmgPNNYMRT6x6Be6i0aKw--/YXBwaWQ9aGlnaGxhbmRlcjt3PTEyMDA7aD04MDA7Y2Y9d2VicA--/https://media.zenfs.com/en/palm_beach_post_natl_articles_437/62083976d905ce29b06aaf6c8b53f0b6,2025-07-09T15:00:44Z,,"A leading hurricane forecast reduced its prediction for the number of named storms and hurricanes this season but still expects above-normal activity.
Colorado State Universitys regular July update … [+3664 chars]",,en,'flooding'
https://www.bostonherald.com/2025/07/09/texas-flooding-fema/,https://www.bostonherald.com/2025/07/09/texas-flooding-fema/,0,www.bostonherald.com,"Texas flooding, and politics around it, underscore the challenges Trump faces in replacing FEMA","Just weeks ago, Trump said he wanted to begin “phasing out” FEMA.",https://www.bostonherald.com/wp-content/uploads/2025/07/Trump_FEMA_51285-1.jpg?w=1024&h=682,2025-07-09T16:20:58Z,,"By GABRIELA AOUN ANGUEIRA
Just weeks ago, President Donald Trump said he wanted to begin phasing out the Federal Emergency Management Agency after this hurricane season to wean off of FEMA and bring… [+6932 chars]",,en,'flooding'
https://www.dailysignal.com/2025/07/09/by-the-grace-of-god-virginia-governors-family-survives-texas-floods/,https://www.dailysignal.com/2025/07/09/by-the-grace-of-god-virginia-governors-family-survives-texas-floods/,0,www.dailysignal.com,‘By the Grace of God’: Virginia Governor’s Family Survives Texas Floods,"Flooding over the Independence Day weekend in Texas’ Hill Country caused devastation throughout the state and even affected the Virginia governor’s family. Gov. Glenn Youngkin... Read More
The post ‘By the Grace of God’: Virginia Governor’s Family Survives Te…",https://www.dailysignal.com/wp-content/uploads/2025/07/250709_SuzanneYoungkin.jpg,2025-07-09T18:06:18Z,,"Flooding over the Independence Day weekend in Texas Hill Country caused devastation throughout the state and even affected the Virginia governors family.
Gov. Glenn Youngkin said Tuesday that his wi… [+1444 chars]",,en,'flooding'
https://www.snopes.com//news/2025/07/09/mexican-president-texas-rescue-teams/,https://www.snopes.com//news/2025/07/09/mexican-president-texas-rescue-teams/,0,www.snopes.com,Did Mexican president send rescue teams to Texas after deadly flooding?,Mexican President Claudia Sheinbaum emphasized that recognition belongs to the volunteers from Ciudad Acuña.,https://mediaproxy.snopes.com/width/1200/https://media.snopes.com/2025/07/mexicans_head_to_polls_for_presidential_election.jpg,2025-07-09T18:17:00Z,,"In early July 2025, a claim began circulating on social media that Mexican President Claudia Sheinbaum sent rescue teams to Texas in response to the deadly floods that struck the state over the Fourt… [+5924 chars]",,en,'flooding'
https://www.snopes.com//fact-check/flooding-texas-blake-shelton-luke-bryan/,https://www.snopes.com//fact-check/flooding-texas-blake-shelton-luke-bryan/,0,www.snopes.com,"Don't be fooled by claims Blake Shelton, Luke Bryan or Gwen Stefani went to Texas to help flood relief efforts","Country music singer Blake Shelton, along with either fellow country star Luke Bryan or Shelton’s wife, the singer Gwen Stefani, travelled to Texas to help in the wake of the July 4, 2025, floods.",https://mediaproxy.snopes.com/width/1200/https://media.snopes.com/2025/07/blake_shelton_gwen_stefani_luke_bryan_texas.png,2025-07-09T18:57:00Z,,"Claim:
Country music singer Blake Shelton, along with either fellow country star Luke Bryan or Sheltons wife, the singer Gwen Stefani, travelled to Texas to help in the wake of the July 4, 2025, flo… [+6293 chars]",,en,'floods'
