index,published,keyword,domain,language,valid,title,description,url,image,archive,content,quote,de,en,la,added
1e40e60fa1417346dee3d28b4983a6e4,2025-10-10T16:57:38Z,'floods',www.livescience.com,en,0.0,Extreme weather caused more than $100 billion in damage by June — smashing US records,"After damaging wildfires in LA, tornadoes and series of floods, the first six months of this year smashed multiple extreme weather records in the U.S., data show — and experts say this trend is likely to continue.",https://www.livescience.com/planet-earth/climate-change/extreme-weather-caused-more-than-usd100-billion-in-damage-by-june-smashing-us-records,https://cdn.mos.cms.futurecdn.net/dtw6DHtdBLcXriBPzWZUEF-1920-80.jpg,,"The first half of 2025 logged the most damaging extreme weather on record in terms of cost, even after accounting for inflation, data shows.
This is partly because of a handful of extraordinary even… [+12427 chars]",,"Extreme Wetterereignisse verursachten bis Juni Schäden in Höhe von mehr als 100 Milliarden US-Dollar – und brachen damit US-Rekorde. Nach verheerenden Waldbränden in L.A., Tornados und einer Reihe von Überschwemmungen wurden in den ersten sechs Monaten dieses Jahres laut Daten mehrere extreme Wetterrekorde in den USA gebrochen – und Experten sagen, dass sich dieser Trend wahrscheinlich fortsetzen wird.","Extreme weather caused more than $100 billion in damage by June — smashing US records. After damaging wildfires in LA, tornadoes and series of floods, the first six months of this year smashed multiple extreme weather records in the U.S., data show — and experts say this trend is likely to continue.","Tempestas extrema plus quam $ 100 miliarda damnorum ab Iunio in - recentium monumentorum comminuit. Post incendia in LA, tornados et diluvia serie deminuta, primi sex menses huius anni multiplices tempestates extremas in US, notitias ostendunt — et periti dicunt hanc trend verisimile esse mansuram.",2025-10-22 02:46:51+00:00
a5270c720a9b802f925419ceebae002d,2025-10-10T17:07:02Z,'flooding area',www.sanluisobispo.com,en,0.0,"‘Significant rain,’ strong winds to sweep SLO County. Here’s when storm starts","There’s a chance of flooding in parts of San Luis Obispo County, the National Weather Service says.",https://www.sanluisobispo.com/news/local/article312448003.html,https://media.zenfs.com/en/san_luis_obispo_tribune_mcclatchy_articles_722/8f389f44a328df799d1d7b61136a9e0a,,"A major storm could bring thunder, strong winds and several inches of rain to San Luis Obispo County in coming days.
A significant rain event is expected to sweep through the Central Coast on Monday… [+5237 chars]",,"„Erheblicher Regen“, starke Winde fegen über SLO County. Hier beginnt der Sturm. Nach Angaben des National Weather Service besteht in Teilen des San Luis Obispo County die Gefahr von Überschwemmungen.","‘Significant rain,’ strong winds to sweep SLO County. Here’s when storm starts. There’s a chance of flooding in parts of San Luis Obispo County, the National Weather Service says.","Item pluviam significantes venti validi ad verrere Comitatum SLO. Hic cum tempestas incipit est. Occasio inundationis in partibus San Luis Obispo Comitatus, Service National Tempestatem dicit.",2025-10-22 02:46:51+00:00
88b343c91397eab52df4104775663c61,2025-10-10T22:28:59Z,'flooding',www.foxweather.com,en,0.0,New Jersey declares state of emergency as Nor’easter poses costal flooding threat,The combination of strong and persistent northeast winds and high astronomical tides will send pounding surf of 12–15-foot waves into the Atlantic coasts from Virginia to New England. But the brunt of the flooding appears focused on the New Jersey and Delawar…,https://www.foxweather.com/weather-news/noreaster-major-coastal-flooding-threat-new-jersey-delaware,https://nypost.com/wp-content/uploads/sites/2/2025/10/runner-wades-flooded-causeway-edward-113214349.jpg?quality=75&strip=all&w=1024,,"A budding and potentially powerful Nor’easter is threatening to bring “major” coastal flooding impacts to parts of the mid-Atlantic Sunday into Monday, prompting New Jersey to already declare a state… [+2379 chars]",,"New Jersey ruft den Ausnahmezustand aus, da in Nor’easter eine Überschwemmungsgefahr an der Küste besteht. Die Kombination aus starken und anhaltenden Nordostwinden und hohen astronomischen Gezeiten wird 12 bis 15 Fuß hohe Wellen an die Atlantikküsten von Virginia bis Neuengland schicken. Aber die Hauptlast der Überschwemmungen scheint sich auf New Jersey und Delawar zu konzentrieren …",New Jersey declares state of emergency as Nor’easter poses costal flooding threat. The combination of strong and persistent northeast winds and high astronomical tides will send pounding surf of 12–15-foot waves into the Atlantic coasts from Virginia to New England. But the brunt of the flooding appears focused on the New Jersey and Delawar…,New Jersey declarat status necessitatis sicut Nor'easter comminationem inundationis costalis ponit. Coniunctio ventorum validorum et pertinax septentrionalium et aestuum astronomicorum altae salo 12-15 pedum tundendo mittet in ora Atlantica ab Virginia in Novam Angliam. Sed impetus inundationis in Nova Jersey et Delawar notavimus.,2025-10-22 02:46:51+00:00
890b43f7a1b5912fc703e0e4356322c1,2025-10-10T22:58:31Z,'flooding damage',www.yahoo.com,en,0.0,"Flooding in central and southeast Mexico kills 22, and damages homes and hospitals","Flooding caused by heavy rains in central and southeastern Mexico has set off landslides, damaged homes and highways, and left at least 22 people dead...",https://www.yahoo.com/news/articles/flooding-central-southeast-mexico-kills-225831220.html,https://s.yimg.com/cv/apiv2/social/images/yahoo_default_logo-1200x1200.png,,"MEXICO CITY (AP) Flooding caused by heavy rains in central and southeastern Mexico has set off landslides, damaged homes and highways, and left at least 22 people dead, authorities said Friday.
One … [+1091 chars]",,"Bei Überschwemmungen in Zentral- und Südostmexiko kommen 22 Menschen ums Leben, Häuser und Krankenhäuser werden beschädigt. Durch heftige Regenfälle in Zentral- und Südostmexiko verursachte Überschwemmungen haben Erdrutsche ausgelöst, Häuser und Autobahnen beschädigt und mindestens 22 Menschen getötet ...","Flooding in central and southeast Mexico kills 22, and damages homes and hospitals. Flooding caused by heavy rains in central and southeastern Mexico has set off landslides, damaged homes and highways, and left at least 22 people dead...","Inundatio in centrali et meridiem Mexico 22 necat et damna domos et hospitalia. Inundatio imbribus in centrali et meridionali et australi Mexico profectus proruit, domos et vias afflixit, et saltem viginti homines mortuos reliquit.",2025-10-22 02:46:51+00:00
99b900f2451ab382685b03c6d4fa25a3,2025-10-10T23:14:50Z,'flooding death',abcnews.go.com,en,0.0,Flooding in central and southeast Mexico kills 22,"Authorities report that heavy rains in central and southeastern Mexico have caused flooding, leading to at least 22 deaths",https://abcnews.go.com/International/wireStory/flooding-central-southeast-mexico-kills-22-damages-homes-126419354,https://s.abcnews.com/images/US/abc_news_default_2000x2000_update_16x9_992.jpg,,"MEXICO CITY -- MEXICO CITY (AP) Flooding caused by heavy rains in central and southeastern Mexico has set off landslides, damaged homes and highways, and left at least 22 people dead, authorities sai… [+1106 chars]",,"Bei Überschwemmungen in Zentral- und Südostmexiko kommen 22 Menschen ums Leben. Behörden berichten, dass heftige Regenfälle in Zentral- und Südostmexiko zu Überschwemmungen geführt haben, die zu mindestens 22 Todesopfern geführt haben","Flooding in central and southeast Mexico kills 22. Authorities report that heavy rains in central and southeastern Mexico have caused flooding, leading to at least 22 deaths","Inundatio in Mexico centrali et meridio-orientali necat 22. Auctores tradunt pluvias in centrali et meridiem orientalem Mexici inundationem fecisse, ducens saltem 22 mortes.",2025-10-22 02:46:51+00:00
a1dafe45793e75df57a1b4edfbdadae4,2025-10-11T02:06:41Z,'flooding death',www.cbsnews.com,en,0.0,"Mexico flooding leaves 22 dead, homes and hospitals damaged","Authorities report that heavy rains in central and southeastern Mexico have caused flooding, leading to at least 22 deaths.",https://www.cbsnews.com/news/flooding-mexico-deaths-damages-homes-hospitals/,https://assets3.cbsnewsstatic.com/hub/i/r/2025/10/11/5634f6a3-7739-4ace-bd2b-3386e05d5b1f/thumbnail/1200x630/33296841480021590bac2a346f3484e1/gettyimages-2240341441.jpg,,"Flooding caused by heavy rains in central and southeastern Mexico has set off landslides, damaged homes and highways, and left at least 22 people dead, authorities said Friday.
One of the hardest hi… [+1222 chars]",,"Bei Überschwemmungen in Mexiko kommen 22 Menschen ums Leben, Häuser und Krankenhäuser werden beschädigt. Behörden berichten, dass heftige Regenfälle in Zentral- und Südostmexiko zu Überschwemmungen geführt haben, bei denen mindestens 22 Menschen ums Leben kamen.","Mexico flooding leaves 22 dead, homes and hospitals damaged. Authorities report that heavy rains in central and southeastern Mexico have caused flooding, leading to at least 22 deaths.","Mexicum inundatio relinquit 22 mortuos, domos et nosocomia laesa. Auctoritates referunt pluvias in centrali et meridionali et australi Mexici inundationem effecisse, ut saltem 22 mortes.",2025-10-22 02:46:51+00:00
3048db240e00ad0cc52eee0dd8b02659,2025-10-11T05:23:58Z,'flooding area',dailycaller.com,en,0.0,New Jersey Declares State Of Emergency As Nor’easter Brings Extreme Weather To East Coast; Evacuations Possible,"A strengthening area of low-pressure is developing into a potentially strong nor'easter and could cause ""major"" coastal flooding Sunday and Monday.",https://dailycaller.com/2025/10/11/new-jersey-state-of-emergency-noreaster-east-coast-weather/,"https://images.dailycaller.com/image/width=1280,height=549,fit=cover,format=webp,f=auto/https://cdn01.dailycaller.com/wp-content/uploads/2025/10/GettyImages-73900775-scaled-e1760159756552.jpg",,"A strengthening area of low-pressure is developing into a potentially strong nor’easter and could cause “major” coastal flooding Sunday and Monday for parts of the mid-Atlantic, which has triggered N… [+2084 chars]",,"New Jersey erklärt den Ausnahmezustand, da Nor’easter extremes Wetter an die Ostküste bringt; Evakuierungen möglich. Ein sich verstärkendes Tiefdruckgebiet entwickelt sich zu einem potenziell starken Nordostgebiet und könnte am Sonntag und Montag zu „großen“ Überschwemmungen an der Küste führen.","New Jersey Declares State Of Emergency As Nor’easter Brings Extreme Weather To East Coast; Evacuations Possible. A strengthening area of low-pressure is developing into a potentially strong nor'easter and could cause ""major"" coastal flooding Sunday and Monday.","New Jersey Declarat Status tumultuarios As Nor'easter brings Extreme Weather To East Coast; Evacuationes Possibiles. Firmatio gravis pressionis area in potentia valida nor'easter evehitur et ""maiorem"" inundationem maritimam dominicae et Lunae causare potuit.",2025-10-22 02:46:51+00:00
74cd7d7d20143c36506e7f9eb723b9f3,2025-10-11T06:38:46Z,'flooding rain',www.aljazeera.com,en,0.0,At least 28 killed in heavy flooding caused by tropical storms in Mexico,The storms have caused devastation nationwide as rains are expected to continue through Sunday.,https://www.aljazeera.com/news/2025/10/11/at-least-28-killed-in-heavy-flooding-caused-by-tropical-storms-in-mexico,https://www.aljazeera.com/wp-content/uploads/2025/10/afp_68e9ea5dc576-1760160349.jpg?resize=1920%2C1440,,"Flooding set off by heavy rainfall in Mexico has left at least 28 people dead and more missing, and has caused landslides, damaged homes and highways, according to local authorities.
Downpours in th… [+3683 chars]",,"Bei schweren Überschwemmungen durch tropische Stürme in Mexiko sind mindestens 28 Menschen ums Leben gekommen. Die Stürme haben landesweit Verwüstungen angerichtet, da mit Regenfällen bis Sonntag gerechnet wird.",At least 28 killed in heavy flooding caused by tropical storms in Mexico. The storms have caused devastation nationwide as rains are expected to continue through Sunday.,Saltem 28 interfecerunt in gravibus inundationibus tropicis in Mexico factis. Procellae vastationes nationum effecerunt sicut pluviae per dominicam duraturam exspectantur.,2025-10-22 02:46:51+00:00
48824531bd0ede6d122c18ee289d56b6,2025-10-11T14:46:23Z,'flooding storm',brobible.com,en,0.0,Las Vegas Floods As Tropical Storm Rains Wreak Havoc On Nevada High School Football Games,"Las Vegas cannot handle the rain. The remnants of a tropical storm smacked Nevada on Friday night and widespread flooding wreaked havoc on local high school football. A majority of games in the region were pushed back due to the weather. Meanwhile, the Strip …",https://brobible.com/sports/article/las-vegas-rain-weather-flooding-high-school-football-storm/,https://brobible.com/wp-content/uploads/2025/10/las-vegas-rain-weather-flooding-high-school-football-storm-delay.jpg,,"iStockphoto
Audio By Carbonatix
Las Vegas cannot handle the rain. The remnants of a tropical storm smacked Nevada on Friday night and widespread flooding wreaked havoc on local high school football… [+1096 chars]",,"Überschwemmungen in Las Vegas, während tropische Sturmregen die Footballspiele der Nevada High School verwüsten. Las Vegas kann mit dem Regen nicht umgehen. Die Überreste eines Tropensturms fegten am Freitagabend über Nevada hinweg und großflächige Überschwemmungen richteten verheerende Schäden im örtlichen High-School-Football an. Ein Großteil der Spiele in der Region wurde wetterbedingt verschoben. Inzwischen ist der Strip …","Las Vegas Floods As Tropical Storm Rains Wreak Havoc On Nevada High School Football Games. Las Vegas cannot handle the rain. The remnants of a tropical storm smacked Nevada on Friday night and widespread flooding wreaked havoc on local high school football. A majority of games in the region were pushed back due to the weather. Meanwhile, the Strip …",Las Vegas Flumina Ut Tropical Pluviae Perdat In Nevada High School vehicula iaculis. Las Vegas non tractamus pluviam. Reliquiae procellae tropicae die Veneris Nevada allexerunt et late inundationes strages in altae scholae loci intulerunt. Plures ludorum in regione ob tempestatem repulsi sunt. Interim exue ...,2025-10-22 02:46:51+00:00
8d49745b4dd49354b0b4a6b0e2fa1f29,2025-10-11T15:12:02Z,'flooding rain',www.fox5ny.com,en,0.0,Nor’easter latest: NYC weekend winds could reach 60 mph; coastal flooding possible,"A powerful Nor’easter spinning off the East Coast is now taking aim at the New York region, bringing a dangerous mix of heavy rain, powerful winds and...",https://www.fox5ny.com/weather/noreaster-latest-nyc-weekend-winds-could-reach-60-mph-coastal-flooding-possible,https://s.yimg.com/ny/api/res/1.2/2YC0tUIeL1v9i_sLoDPF5g--/YXBwaWQ9aGlnaGxhbmRlcjt3PTEyMDA7aD02NzU7Y2Y9d2VicA--/https://media.zenfs.com/en/wnyw_fox_local_articles_540/e8a91a44e01c858fba545433a47853b2,,"The Brief
<ul><li>A strengthening Noreaster is heading north, bringing rain, 5060 mph gusts and coastal flooding to the Tri-State area.
</li><li>The worst impacts arrive late Saturday night through… [+3328 chars]",,"Spätestens in Nor’easter: Der Wind am Wochenende in NYC könnte 60 Meilen pro Stunde erreichen; Küstenüberschwemmungen möglich. Ein starker Nordostwind vor der Ostküste nimmt nun die Region New York ins Visier und bringt eine gefährliche Mischung aus starkem Regen, starken Winden und ... mit sich.","Nor’easter latest: NYC weekend winds could reach 60 mph; coastal flooding possible. A powerful Nor’easter spinning off the East Coast is now taking aim at the New York region, bringing a dangerous mix of heavy rain, powerful winds and...","Nor'easter latest: NYC volutpat ventos attingere 60 mph; inundationem maritimam fieri. Validus Nor'easter Orientis Coast volitans studet nunc regionem Novi Eboraci, periculosam pluviam, ventos validos et periculosos ferens.",2025-10-22 02:46:51+00:00
70fe65ac46e48906a47fd69fe108ab0f,2025-10-11T17:46:20Z,'flooding victims',dpa-international.com,en,0.0,Tiger on the loose in central Mexico after severe flooding,A Bengal tiger has escaped from a zoo amid severe flooding in Mexico. The animal escaped from its cage in the Animalia zoo near the municipality of Xicotepec...,https://dpa-international.com/general-news/urn:newsml:dpa.com:20090101:251011-99-300681/,https://media.zenfs.com/en/dpa_international_526/08b150fe21aa831319a04aaa49aca408,,"A Bengal tiger has escaped from a zoo amid severe flooding in Mexico.
The animal escaped from its cage in the Animalia zoo near the municipality of Xicotepec in the central state of Puebla, said May… [+993 chars]",,Tiger auf freiem Fuß in Zentralmexiko nach schweren Überschwemmungen. Ein Königstiger ist inmitten schwerer Überschwemmungen in Mexiko aus einem Zoo entkommen. Das Tier entkam seinem Käfig im Zoo Animalia nahe der Gemeinde Xicotepec...,Tiger on the loose in central Mexico after severe flooding. A Bengal tiger has escaped from a zoo amid severe flooding in Mexico. The animal escaped from its cage in the Animalia zoo near the municipality of Xicotepec...,Tigris super solutam in Mexico centrali post gravem inundationem. Tigris Bengalica e bestiario inter graves inundationes in Mexico evasit. Animal e cavea in Animalia saepti ferarum prope municipium Xicotepec fugit ...,2025-10-22 02:46:51+00:00
51e84a3453349b762f9ae0b86dd47d32,2025-10-11T18:37:03Z,'flooding area',www.foxweather.com,en,0.0,Flash flooding sweeps away cars in New Mexico as Desert Southwest braces for another round of tropical rain,"Remnant tropical moisture from post-tropical Priscilla soaked areas of the Desert Southwest since Friday, resulting in flash flooding that swallowed cars in ...",https://www.foxweather.com/extreme-weather/flash-flooding-new-mexico-desert-southwest-tropical-rain,https://media.zenfs.com/en/fox_weather_articles_483/fb6ad920a6a315590e592916224121eb,,"SAN JUAN COUNTY, NEW MEXICO Remnant tropical moisture from post-tropical storm Priscilla has soaked areas of the Desert Southwest since Friday, resulting in flash flooding that swallowed at least two… [+1572 chars]",,"Sturzfluten reißen Autos in New Mexico weg, während Desert Southwest sich auf eine weitere Runde tropischen Regens vorbereitet. Restliche tropische Feuchtigkeit aus dem posttropischen Priscilla hat seit Freitag Gebiete im Südwesten der Wüste durchnässt, was zu Sturzfluten führte, die Autos verschluckten ...","Flash flooding sweeps away cars in New Mexico as Desert Southwest braces for another round of tropical rain. Remnant tropical moisture from post-tropical Priscilla soaked areas of the Desert Southwest since Friday, resulting in flash flooding that swallowed cars in ...","Micare inundatio cars in Novo Mexico abrepit ut Desert Africus capreolis aliis circum tropicae pluviae. Reliquiae tropicae humores e locis post-tropicis Priscillae madefactis deserti Africi post Veneris, resultantes in inundatione mico qui cars in ... deglutiverunt.",2025-10-22 02:46:51+00:00
bc8214cf01294ea31cad4f78963ffe8c,2025-10-11T22:16:50Z,'deluge',timesofindia.indiatimes.com,en,0.0,Bengaluru’s tech corridor drowns again after night deluge,"Bengaluru: A six-hour-long downpour on Friday night yet again brought parts of the city to a standstill, flooding long stretches of Sarjapur Road, Hos.",https://timesofindia.indiatimes.com/city/bengaluru/bengalurus-tech-corridor-drowns-again-after-night-deluge/articleshow/124487174.cms,"https://static.toiimg.com/thumb/msid-124487173,width-1070,height-580,imgsize-76986,resizemode-75,overlay-toi_sw,pt-32,y_pad-40/photo.jpg",,"Follow Us On Social Media
Leo Daily Horoscope Today, October 12, 2025: Moon transits in Gemini today, watch out for misunderstandings at workUAE defeats Oman 2-1 in AFC World Cup qualifiers, tops gr… [+1631 chars]",,"Der Technologiekorridor von Bengaluru ist nach einer nächtlichen Überschwemmung erneut überflutet. Bengaluru: Ein sechsstündiger Regenguss brachte am Freitagabend erneut Teile der Stadt zum Stillstand und überschwemmte weite Strecken der Sarjapur Road, Hos.","Bengaluru’s tech corridor drowns again after night deluge. Bengaluru: A six-hour-long downpour on Friday night yet again brought parts of the city to a standstill, flooding long stretches of Sarjapur Road, Hos.","Bengaluru techna corridor post noctem diluvium iterum demergit. Bengaluru: Sex-hora-longa pluvia nocte Veneris partes urbis adhuc adhuc consistit, inundans longa spatia Road Sarjapur, Hos.",2025-10-22 02:46:51+00:00
841dbd537db9cef81866872df355001a,2025-10-11T22:30:30Z,'flooding rain',dpa-international.com,en,0.0,Dozens dead in Mexico after severe flooding; escaped tiger caught,"Heavy rainfall in Mexico caused severe flooding and landslides across several states, leaving at least 37 people dead, authorities said on Saturday. The...",https://dpa-international.com/general-news/urn:newsml:dpa.com:20090101:251011-99-302204/,https://media.zenfs.com/en/dpa_international_526/428edb845c4fc8dfbe2a285fffa28466,,"Heavy rainfall in Mexico caused severe flooding and landslides across several states, leaving at least 37 people dead, authorities said on Saturday.
The Security Ministry said 117 cities and municip… [+2248 chars]",,"Dutzende Tote in Mexiko nach schwerer Überschwemmung; Entflohener Tiger gefangen. Schwere Regenfälle in Mexiko verursachten in mehreren Bundesstaaten schwere Überschwemmungen und Erdrutsche und forderten mindestens 37 Todesopfer, teilten die Behörden am Samstag mit. Der...","Dozens dead in Mexico after severe flooding; escaped tiger caught. Heavy rainfall in Mexico caused severe flooding and landslides across several states, leaving at least 37 people dead, authorities said on Saturday. The...","Mortui justo in Mexico post graves inundationes; fugit tigris captus. Imbres graves in Mexico graves inundationes et prolapsae per plures civitates effecit, cum saltem 37 homines mortuae, auctoritates die Sabbati dixerunt. The...",2025-10-22 02:46:51+00:00
830c5b753a20903ac129c12d17e69a0a,2025-10-12T00:00:00Z,'flooding',www.dw.com,en,0.0,Mexico: Floods and landslides claim dozens of lives,Authorities said the death toll had risen to at least 41 amid severe flooding and landslides in the south east. Thousands of troops have been deployed to help with disaster efforts. Severe flooding and landslides caused by heavy rainfall in southeastern Mexic…,https://www.dw.com/en/mexico-floods-and-landslides-claim-dozens-of-lives/a-74321974,https://static.dw.com/image/74322016_6.jpg,,"Severe flooding and landslides caused by heavy rainfall in southeastern Mexico have left at least 41 people dead, local authorities said
on Saturday.
Mexico's government said in a statement that 15… [+1754 chars]",,"Mexiko: Überschwemmungen und Erdrutsche fordern Dutzende Todesopfer. Die Behörden sagten, die Zahl der Todesopfer sei aufgrund schwerer Überschwemmungen und Erdrutsche im Südosten auf mindestens 41 gestiegen. Tausende Soldaten wurden zur Katastrophenbewältigung eingesetzt. Schwere Überschwemmungen und Erdrutsche durch heftige Regenfälle im Südosten Mexikos…",Mexico: Floods and landslides claim dozens of lives. Authorities said the death toll had risen to at least 41 amid severe flooding and landslides in the south east. Thousands of troops have been deployed to help with disaster efforts. Severe flooding and landslides caused by heavy rainfall in southeastern Mexic…,Mexicum: Flumina et proruit justos vitarum affirmant. Auctoritates dicebant portorium mortis saltem 41 exortum esse inter graves inundationes et proruit in orientem australem. Milia armatorum cum calamitate subsidia paraverunt. Gravi inundatio et proruit ex gravibus pluviis in meridiem Mexic…,2025-10-22 02:46:51+00:00
1649f07197f5ff5379e1a40da643a799,2025-10-12T02:00:18Z,'deluge',news.sankakucomplex.com,en,0.0,Trigun Stargaze Promising Even More Memorable Action,"The recent Trigun reboot anime has achieved a second season despite the wealth of criticism it has received, and a new trailer has unleashed a deluge of action and drama, with some scenes likely to look familiar and sure to have some wondering what will be di…",https://news.sankakucomplex.com/2025/10/12/trigun-stargaze-promising-even-more-memorable-action/,https://news.sankakucomplex.com/wp-content/uploads/2025/10/TrigunStargaze-PV-2025-Omake.gif,,"The recent Trigun reboot anime has achieved a second season despite the wealth of criticism it has received, and a new trailer has unleashed a deluge of action and drama, with some scenes likely to l… [+190 chars]",,"Trigun Stargaze verspricht noch unvergesslichere Action. Der kürzlich erschienene Trigun-Reboot-Anime hat trotz der Fülle an Kritik eine zweite Staffel erreicht, und ein neuer Trailer hat eine Flut an Action und Drama ausgelöst, wobei einige Szenen wahrscheinlich bekannt vorkommen und einige sicherlich fragen, was anders sein wird …","Trigun Stargaze Promising Even More Memorable Action. The recent Trigun reboot anime has achieved a second season despite the wealth of criticism it has received, and a new trailer has unleashed a deluge of action and drama, with some scenes likely to look familiar and sure to have some wondering what will be di…","Trigun Stargaze Promittens Etiam Memorabiliorem Actionem. Recens Trigun reboot animum secundo tempore consecutus est, quamquam opes criticae quas acceperat, et novum trailer inundavit inundationem actionis et dramatis, cum aliquibus argumentis verisimile quaerere familiarem et certum habere aliquid mirationis quid di…",2025-10-22 02:46:51+00:00
