index,url,valid,domain,title,description,image,published,archive,content,quote,language,keyword
https://www.cnn.com/2025/07/05/us/camp-mystic-texas-flooding,https://www.cnn.com/2025/07/05/us/camp-mystic-texas-flooding,0,www.cnn.com,Camp Mystic: What we know about the Texas girls camp where over 20 children are missing,"As first responders continue to rescue people stranded by the torrential flooding that descended on central Texas Friday, dozens of people are facing a parent’s worst nightmare: Their children are missing.","https://media.cnn.com/api/v1/images/stellar/prod/gettyimages-2223018766.jpg?c=16x9&q=w_800,c_fill",2025-07-05T21:12:20Z,,"As first responders continue to rescue people stranded by the torrential flooding that descended on central Texas Friday, dozens of people are facing a parents worst nightmare: Their children are mis… [+10961 chars]",,en,'flooding'
https://www.bbc.com/news/videos/c75r1ddd63po,https://www.bbc.com/news/videos/c75r1ddd63po,0,www.bbc.com,BBC witnesses destruction after house ripped from foundations in Texas floods,"At least 32 people have been killed, including 14 children, officials said, after flash floods hit Kerr County.",https://ichef.bbci.co.uk/news/1024/branded_news/1e52/live/022d3210-59e3-11f0-b5c5-012c5796682d.jpg,2025-07-05T21:32:28Z,,"A house in Kerr County, Texas has been ripped from its foundations after flash flooding swept through the area.
At least 32 people have been killed, including 14 children, officials said, with rescu… [+80 chars]",,en,'floods'
https://consent.yahoo.com/v2/collectConsent?sessionId=1_cc-session_e9c5b231-4d67-487a-b197-d08793c1ed3b,https://consent.yahoo.com/v2/collectConsent?sessionId=1_cc-session_e9c5b231-4d67-487a-b197-d08793c1ed3b,0,consent.yahoo.com,See aftermath at summer camp in Texas where multiple people are still missing after flooding,,,2025-07-05T21:36:34Z,,"If you click 'Accept all', we and our partners, including 237 who are part of the IAB Transparency &amp; Consent Framework, will also store and/or access information on a device (in other words, use … [+714 chars]",,en,'flooding'
https://consent.yahoo.com/v2/collectConsent?sessionId=1_cc-session_ca0473ea-ccd5-45b9-b89d-fca24b6725d8,https://consent.yahoo.com/v2/collectConsent?sessionId=1_cc-session_ca0473ea-ccd5-45b9-b89d-fca24b6725d8,0,consent.yahoo.com,MAGA Congressional Candidate Calls Texas Floods ‘Fake’: It’s ‘Murder’,,,2025-07-05T21:55:09Z,,"If you click 'Accept all', we and our partners, including 237 who are part of the IAB Transparency &amp; Consent Framework, will also store and/or access information on a device (in other words, use … [+714 chars]",,en,'floods'
https://www.tmz.com/2025/07/05/camp-mystic-chaos-storm-photos/,https://www.tmz.com/2025/07/05/camp-mystic-chaos-storm-photos/,0,www.tmz.com,Texas Camp Devastated By Floods Captured in Heartbreaking Photos,"Flash flooding in central Texas have done a number on several camps in the state ... including Camp Mystic, an all-girls getaway where many attendees are still missing -- and new photos show the devastated state of it. See the stunning pictures --…",https://imagez.tmz.com/image/18/16by9/2025/07/05/186b2091e95d4306affb6e83276037d9_xl.jpg,2025-07-05T22:17:10Z,,"Flash flooding in central Texas have done a number on several camps in the state ... including Camp Mystic, an all-girls getaway where many attendees are still missing -- and new photos show the deva… [+960 chars]",,en,'flooding buildings'
https://www.npr.org/2025/07/05/nx-s1-5457759/texas-floods-timeline,https://www.npr.org/2025/07/05/nx-s1-5457759/texas-floods-timeline,0,www.npr.org,Here's a timeline of the catastrophic Texas floods,"NPR has compiled a timeline of when local, state and federal officials posted warnings on social media as well as the timeline of events as presented by local officials.",https://npr.brightspotcdn.com/dims3/default/strip/false/crop/8090x4551+0+373/resize/1400/quality/100/format/jpeg/?url=http%3A%2F%2Fnpr-brightspot.s3.amazonaws.com%2F7e%2Fd1%2F3ff49c454549b377591751963158%2Fgettyimages-2222953085.jpg,2025-07-05T22:30:39Z,,"In the early hours of Friday, floods
 swept across Texas Hill Country. The Guadalupe River rose 26 feet within 45 minutes, according to state officials.
The flooding killed at least 14 children and… [+8691 chars]",,en,'floods'
https://people.com/mystic-camp-camper-lila-bonner-found-dead-following-texas-floods-11767067,https://people.com/mystic-camp-camper-lila-bonner-found-dead-following-texas-floods-11767067,0,people.com,"Lila Bonner, 1 of the Young Girls Who Went Missing from Texas Camp amid Catastrophic Floods, Confirmed Dead: 'Unimaginable Grief'","Lila was a camper at Camp Mystic, an all-girls Christian camp near the Guadalupe River in Kerr County",https://s.yimg.com/ny/api/res/1.2/29UTnmbDjKVWwLE9Sn2jdQ--/YXBwaWQ9aGlnaGxhbmRlcjt3PTEyMDA7aD04MDA7Y2Y9d2VicA--/https://media.zenfs.com/en/people_218/444e8bdfa9adf202981590180968e908,2025-07-05T23:10:42Z,,"NEED TO KNOW
<ul><li>The body of Lila Bonner, one of the missing campers at Camp Mystic in Texas, has been found, her family confirmed in a statement to PEOPLE on July 5
</li><li>Lila was one of th… [+3546 chars]",,en,'flooding evacuation'
https://www.yahoo.com/news/texas-officials-face-scrutiny-over-231534930.html,https://www.yahoo.com/news/texas-officials-face-scrutiny-over-231534930.html,0,www.yahoo.com,Texas officials face scrutiny over response to catastrophic and deadly flooding,"Before heading to bed before the Fourth of July holiday, Christopher Flowers checked the weather while staying at a friend's house along the Guadalupe River....",https://s.yimg.com/ny/api/res/1.2/XUxEDNvLhiZ4R0Dv.Ebvaw--/YXBwaWQ9aGlnaGxhbmRlcjt3PTEyMDA7aD04MTg7Y2Y9d2VicA--/https://media.zenfs.com/en/ap.org/523e20fc2a1e84c7b8b2ae2ca7f9b125,2025-07-05T23:15:34Z,,"KERRVILLE, Texas (AP) Before heading to bed before the Fourth of July holiday, Christopher Flowers checked the weather while staying at a friend's house along the Guadalupe River. Nothing in the fore… [+5128 chars]",,en,'flooding weather'
https://www.today.com/news/news/camp-mystic-location-victims-texas-floods-rcna217066,https://www.today.com/news/news/camp-mystic-location-victims-texas-floods-rcna217066,0,www.today.com,More Than 20 People Missing From Camp Mystic After Floods. What to Know About the Summer Camp,More than 25 girls are missing from a 99-year-old Christian summer camp in Texas after deadly flooding swept the Southern state this weekend.,"https://media-cldnry.s-nbcnews.com/image/upload/t_social_share_1200x630_center,f_auto,q_auto:best/rockcms/2025-07/250704-camp-mystic-se-407p-36bdad.jpg",2025-07-05T23:48:43Z,,"More than 25 girls are missing from a 99-year-old Christian summer camp in Texas after deadly flooding swept the Southern state this weekend. 
Camp Mystic, located in Hunt, Texas, was hosting 750 ch… [+3232 chars]",,en,'flooding buildings'
https://www.foxweather.com/lifestyle/tx-kerrville-disaster-deadly,https://www.foxweather.com/lifestyle/tx-kerrville-disaster-deadly,0,www.foxweather.com,Here’s how to help the victims of the Texas flooding,"More than 2 dozen people, including several children, were killed when between 10-20 inches of rain fell over Central Texas on Friday. Several groups...",https://media.zenfs.com/en/fox_weather_articles_483/577541293cff51e9da1823de2801cd31,2025-07-06T00:17:47Z,,"KERR COUNTY, Texas - Heavy rainfall on Independence Day caused rivers and streams to rise rapidly in Central Texas, leading to the deaths of dozens of residents and visitors.
While nearly 1,000 peop… [+3370 chars]",,en,'flooding'
https://consent.yahoo.com/v2/collectConsent?sessionId=1_cc-session_c0762ecb-8198-49bd-8c09-e0bfe4f47d3b,https://consent.yahoo.com/v2/collectConsent?sessionId=1_cc-session_c0762ecb-8198-49bd-8c09-e0bfe4f47d3b,0,consent.yahoo.com,ICE Barbie Dodges Blame for Disastrous Texas Flooding on Trump’s Watch,,,2025-07-06T00:38:16Z,,"If you click 'Accept all', we and our partners, including 237 who are part of the IAB Transparency &amp; Consent Framework, will also store and/or access information on a device (in other words, use … [+714 chars]",,en,'flooding'
http://www.rollingstone.com/politics/politics-news/alligator-alcatraz-immigrants-detention-risks-florida-1235379416/,http://www.rollingstone.com/politics/politics-news/alligator-alcatraz-immigrants-detention-risks-florida-1235379416/,0,www.rollingstone.com,‘Alligator Alcatraz’ Detention Center Poses Serious Risks to Immigrants Beyond Just Alligators,"'Alligator Alcatraz' immigrant detention center poses serious risks, including hurricanes, flooding, and mosquitoes, experts say.",https://www.rollingstone.com/wp-content/uploads/2025/07/AlligatorAlcatraz-1.jpg?w=1600&h=900&crop=1,2025-07-06T02:04:25Z,,"Experts are concerned about the dangerous conditions at Alligator Alcatraz, the immigrant detention center that opened Tuesday in the Florida Everglades. Hurricanes, flooding, and mosquitoes pose a m… [+4002 chars]",,en,'flooding'
https://freerepublic.com/focus/f-news/4327105/posts,https://freerepublic.com/focus/f-news/4327105/posts,0,freerepublic.com,"In Texas region prone to catastrophic floods, questions grow about lack of warning","The forecast began to look ominous in Texas Hill County on Thursday afternoon. A flood watch was issued by the National Weather Service at 1:18 p.m. that predicted up to 7 inches of isolated rainfall early Friday morning in South Central Texas, including Kerr…",,2025-07-06T05:19:33Z,,"Skip to comments.
In Texas region prone to catastrophic floods, questions grow about lack of warningThe Texas tribune ^
 | Paul Cobler
Posted on 07/05/2025 10:19:33 PM PDT by NoLibZone
The foreca… [+8339 chars]",,en,'floods'
https://www.nbcnews.com/news/us-news/man-tries-hold-together-family-members-missing-texas-flooding-rcna217085,https://www.nbcnews.com/news/us-news/man-tries-hold-together-family-members-missing-texas-flooding-rcna217085,0,www.nbcnews.com,Man tries to 'hold it together' with 5 family members missing amid Texas flooding,Xavier Ramirez's family had been at a campground in Texas' Kerr County when the waters of the Guadalupe River began to quickly rise.,"https://media-cldnry.s-nbcnews.com/image/upload/t_nbcnews-fp-1200-630,f_auto,q_auto:best/rockcms/2025-07/Texas-flooding-Cade-Loop-debris-AP-77cb4f.jpg",2025-07-06T05:37:53Z,,"KERRVILLE, Texas In the sticky Texas heat with night approaching, Xavier Ramirez waited outside Calvary Temple Church hoping for a miracle that somehow his mom, stepfather, aunt, uncle and cousin wer… [+3320 chars]",,en,'flooding'
https://www.dw.com/en/texas-flood-death-toll-hits-50-as-search-intensifies/a-73172435,https://www.dw.com/en/texas-flood-death-toll-hits-50-as-search-intensifies/a-73172435,0,www.dw.com,Texas flood death toll hits 50 as search intensifies,Texas Governor Greg Abbott has issued a disaster declaration. The severe flooding left dozens of people dead and several others missing — many from a girls' summer camp.,https://static.dw.com/image/73172459_6.jpg,2025-07-06T06:31:00Z,,"Twenty-seven girls remained missing from a riverside summer camp in the US state of Texas on Sunday, almost two days after the area was hit by devastating floods.
As the death toll from the disaster… [+4282 chars]",,en,'flooding death'
https://www.dw.com/en/texas-flood-death-toll-jumps-to-78-as-search-intensifies/a-73172435,https://www.dw.com/en/texas-flood-death-toll-jumps-to-78-as-search-intensifies/a-73172435,0,www.dw.com,Texas flood death toll jumps to 78 as search intensifies,"US President Donald Trump signed a major disaster declaration. The severe flooding left dozens of people dead and several others missing — many from Camp Mystic, a Christian youth camp. The death toll from flash floods in the US state of Texas jumped to at le…",https://static.dw.com/image/73172459_6.jpg,2025-07-06T06:31:00Z,,"The death toll from flash floods in the US state of Texas jumped to at least 78 people on Sunday as the search for girls missing from Camp Mystic, a Christian youth camp, continues.
Larry Leitha, th… [+4286 chars]",,en,'flooding'
https://consent.yahoo.com/v2/collectConsent?sessionId=1_cc-session_8be61d5a-e573-420a-be3c-d336d052c820,https://consent.yahoo.com/v2/collectConsent?sessionId=1_cc-session_8be61d5a-e573-420a-be3c-d336d052c820,0,consent.yahoo.com,Twenty-seven girls still missing from summer camp after Texas floods,,,2025-07-06T06:51:43Z,,"If you click 'Accept all', we and our partners, including 237 who are part of the IAB Transparency &amp; Consent Framework, will also store and/or access information on a device (in other words, use … [+714 chars]",,en,'floods'
https://www.irishtimes.com/world/us/2025/07/06/texas-floods-death-toll-reaches-at-least-43-dozens-still-missing/,https://www.irishtimes.com/world/us/2025/07/06/texas-floods-death-toll-reaches-at-least-43-dozens-still-missing/,0,www.irishtimes.com,Texas floods: Death toll reaches at least 43; dozens still missing,Waters recede as officials say more than 850 have been rescued,https://www.irishtimes.com/resizer/v2/XLLHMKGMPKS5ATTU6VJ5TJ2KHA.jpg?smart=true&auth=29278b3182f6a35b15de841fa1516ccaf38cbca83cf3a52f81ef63e3004de2bb&width=1200&height=630,2025-07-06T06:57:17Z,,"At least 43 people, including 15 children, have been confirmed dead following flash floods in central Texas, authorities said on Saturday as rescuers continued a frantic search for dozens more camper… [+5507 chars]",,en,'floods'
https://www.today.com/video/texas-flood-death-toll-rises-to-51-amid-search-for-survivors-242757701678,https://www.today.com/video/texas-flood-death-toll-rises-to-51-amid-search-for-survivors-242757701678,0,www.today.com,Texas Flood Death Toll Rises to 51 Amid Search for Survivors,"Rescue and recovery crews will be back on the scene Sunday in the Texas Hill Country, two days after catastrophic flash flooding swept through the area, killing at least 51 people including 15 children. At least 27 young girls from Camp Mystic, a Christian su…","https://media-cldnry.s-nbcnews.com/image/upload/t_social_share_1200x630_center,f_auto,q_auto:best/mpx/2704722219/2025_07/1751804234361_tdy_sun_chandler_texas_flood_250706_1920x1080-0lxcp1.jpg",2025-07-06T12:17:21Z,,"Rescue and recovery crews will be back on the scene Sunday in the Texas Hill Country, two days after catastrophic flash flooding swept through the area, killing at least 51 people including 15 childr… [+164 chars]",,en,'flooding'
https://www.tmz.com/2025/07/06/texas-dad-final-words-saving-family-from-flood/,https://www.tmz.com/2025/07/06/texas-dad-final-words-saving-family-from-flood/,0,www.tmz.com,Texas Dad's Gut-Wrenching Final Words as He Dies Saving Family From Floods,"Amid catastrophic flooding sweeping across Texas, a young father’s final, heartbreaking words have come to define both the devastation and the heroism from the storms. ""I’m sorry, I’m not going to make it. I love y’all,"" 27-year-old Julian…",https://imagez.tmz.com/image/db/16by9/2025/07/06/dbcaf0b387eb451ca6fe9ff3998f8dca_xl.jpg,2025-07-06T12:47:04Z,,"Amid catastrophic flooding sweeping across Texas, a young fathers final, heartbreaking words have come to define both the devastation and the heroism from the storms.
""Im sorry, Im not going to make… [+1555 chars]",,en,'flooding'
https://fortune.com/2025/07/06/texas-officials-scrutiny-response-flood-warnings-national-weather-service/,https://fortune.com/2025/07/06/texas-officials-scrutiny-response-flood-warnings-national-weather-service/,0,fortune.com,Texas officials face scrutiny over response to catastrophic and deadly flooding,"At 4:03 a.m., the National Weather Service issued an urgent warning that raised the potential of catastrophic damage and a severe threat to human life.","https://fortune.com/img-assets/wp-content/uploads/2025/07/AP25186779555850-e1751812858856.jpg?resize=1200,600",2025-07-06T14:46:25Z,,"Before heading to bed before the Fourth of July holiday, Christopher Flowers checked the weather while staying at a friends house along the Guadalupe River. Nothing in the forecast alarmed him.Hours … [+5014 chars]",,en,'flooding'
https://en.antaranews.com/news/364513/bogor-suffers-widespread-flooding-landslides-in-18-sub-disricts,https://en.antaranews.com/news/364513/bogor-suffers-widespread-flooding-landslides-in-18-sub-disricts,0,en.antaranews.com,"Bogor suffers widespread flooding, landslides in 18 sub-disricts",Head of Bogor District Rudy Susmanto reported that widespread flooding and landslides had struck 18 sub-districts in the region following continuous ...,https://cdn.antaranews.com/cache/1200x800/2025/07/06/1002447767.jpg,2025-07-06T15:20:22Z,,Bogor District (ANTARA) - Head of Bogor District Rudy Susmanto reported that widespread flooding and landslides had struck 18 sub-districts in the region following continuous torrential rain since Sa‚Ä¶ [+2031 chars],,en,'flooding'
https://thespun.com/nfl/nfl-legend-troy-aikman-is-asking-for-prayers,https://thespun.com/nfl/nfl-legend-troy-aikman-is-asking-for-prayers,0,thespun.com,NFL Legend Troy Aikman Is Asking For Prayers,Legendary NFL quarterback Troy Aikman is asking for prayers this weekend. Texas was hit hard by flash flooding over the Fourth of July holiday weekend...,https://media.zenfs.com/en/the_spun_articles_751/d2ac374d4b5ebad91222aaa6d718170c,2025-07-06T15:34:54Z,,"NFL Legend Troy Aikman Is Asking For Prayers originally appeared on The Spun.
Legendary NFL quarterback Troy Aikman is asking for prayers this weekend.
Texas was hit hard by flash flooding over the… [+2265 chars]",,en,'flooding'
https://www.forbes.com/sites/marshallshepherd/2025/07/06/texas-flood-disasterthe-case-for-a-weather-radio-renaissance/,https://www.forbes.com/sites/marshallshepherd/2025/07/06/texas-flood-disasterthe-case-for-a-weather-radio-renaissance/,0,www.forbes.com,Texas Flood Disaster - The Case For A Weather Radio Renaissance?,Do the catastrophic Texas floods make the case for NOAA weather radios? Experts weigh in.,https://imageio.forbes.com/specials-images/imageserve/686a89e280a92477deab9e42/0x0.jpg?format=jpg&height=900&width=1600&fit=bounds,2025-07-06T16:12:15Z,,"A member of the public looks out at flooding caused by a flash flood at the Guadalupe River in ... More Kerrville, Texas, on July 5, 2025. Rescuers were desperately searching for at least 20 girls mi… [+8740 chars]",,en,'floods'
https://www.breitbart.com/sports/2025/07/06/houston-texans-make-500000-donation-to-aid-texas-flooding-recovery-operations/,https://www.breitbart.com/sports/2025/07/06/houston-texans-make-500000-donation-to-aid-texas-flooding-recovery-operations/,0,www.breitbart.com,"Houston Texans Make $500,000 Donation to Aid Texas Flooding Recovery Operations","The Houston Texans have made a $500,000 donation to aid the Texas Hill Country community devastated after a flash flood killed dozens, including children.
The post Houston Texans Make $500,000 Donation to Aid Texas Flooding Recovery Operations appeared first …",https://media.breitbart.com/media/2025/07/Tim-Warner_Getty-Images-5-640x335.jpg,2025-07-06T16:14:07Z,,"The Houston Texans have made a $500,000 donation to aid the Texas Hill Country community devastated after a flash flood killed dozens, including children.
The Texans organization issued a statement … [+2146 chars]",,en,'flooding damage'
https://economictimes.indiatimes.com/news/international/us/texas-flood-death-toll-rises-to-67-why-did-the-guadalupe-river-flood-and-camp-mystic-updates/articleshow/122282457.cms,https://economictimes.indiatimes.com/news/international/us/texas-flood-death-toll-rises-to-67-why-did-the-guadalupe-river-flood-and-camp-mystic-updates/articleshow/122282457.cms,0,economictimes.indiatimes.com,Texas flood death toll rises to 67 — What went wrong and why the Guadalupe River overflowed,"The death toll from the devastating floods in Texas rose to at least 67 on Sunday, with 21 children confirmed among the victims, as rescue teams continued their search for several girls still missing from a summer camp.","https://img.etimg.com/thumb/msid-122282486,width-1200,height-630,imgsize-838402,overlay-economictimes/articleshow.jpg",2025-07-06T16:39:39Z,,"Rescue and recovery efforts continued across central Texas on Saturday, with teams searching devastated areas for survivors and victims. As of now, at least 67 people have perished, among them 21 chi… [+7197 chars]",,en,'floods'
https://www.mensjournal.com/sports/legendary-nfl-star-troy-aikman-asks-for-prayers,https://www.mensjournal.com/sports/legendary-nfl-star-troy-aikman-asks-for-prayers,0,www.mensjournal.com,Legendary NFL Star Troy Aikman Asks for Prayers,The minds and sympathies of Americans and many around the world are with the people of Texas this weekend. Heavy flooding has led to dozens of casualties as ...,https://media.zenfs.com/en/men_s_journal_718/ea735bfb8c9e5b95e6d417dd246ffc59,2025-07-06T18:25:12Z,,The minds and sympathies of Americans and many around the world are with the people of Texas this weekend. Heavy flooding has led to dozens of casualties as authorities work to assess the extent of t… [+1981 chars],,en,'flooding'
https://www.cbssports.com/nfl/news/dallas-cowboys-houston-texans-nfl-pool-together-donations-for-texas-flooding-recovery-efforts/,https://www.cbssports.com/nfl/news/dallas-cowboys-houston-texans-nfl-pool-together-donations-for-texas-flooding-recovery-efforts/,0,www.cbssports.com,"Dallas Cowboys, Houston Texans, NFL pool together donations for Texas flooding recovery efforts",At least 70 are dead after devastating floods ravaged central Texas,https://sportshub.cbsistatic.com/i/r/2025/07/06/3ad42cad-93a6-4657-9526-c3d701174efb/thumbnail/1200x675/6df6f0b850368d93410a40c09194e3db/usatsi-24796502-1.jpg,2025-07-06T18:56:03Z,,"The Dallas Cowboys, Houston Texans and NFL Foundation will combine to make $1.5 million in donations to those impacted by the devastating and deadly floods in central Texas, which thus far have kille… [+2281 chars]",,en,'flooding donation'
https://www.npr.org/sections/the-picture-show/2025/07/06/g-s1-76298/video-timelapse-texas-llano-river-flood-minutes,https://www.npr.org/sections/the-picture-show/2025/07/06/g-s1-76298/video-timelapse-texas-llano-river-flood-minutes,0,www.npr.org,Video: Timelapse Shows Texas' Llano River Completely Flood in Just Minutes,Timelapse video shows authorities blocking off a low water crossing over the Llano River in Kingsland just before flash flooding completely inundated the area in just 10 minutes.,https://npr.brightspotcdn.com/dims3/default/strip/false/crop/1920x1080+0+0/resize/1400/quality/100/format/png/?url=http%3A%2F%2Fnpr-brightspot.s3.amazonaws.com%2F01%2Ff6%2Fa3cf274d4081989cc89f5d86a0cf%2Fstoryful-326677-timelapse-shows-texas-llano-river-completely-flood-in-just-minutes-tm-2.png,2025-07-06T19:46:45Z,,"Credit: Robert Ivey via Storyful
The Llano River swelled with floodwater in Llano County, Texas, on July 4, as heavy rain and deadly flooding hit the state's Hill Country area.
Timelapse video capt… [+523 chars]",,en,'flooding area'
https://thespun.com/nfl/dallas-cowboys-announce-donation-following-texas-flooding,https://thespun.com/nfl/dallas-cowboys-announce-donation-following-texas-flooding,0,thespun.com,Dallas Cowboys Announce Donation Following Texas Flooding,The Dallas Cowboys announced on Sunday an official donation following the flash flooding that took place in Texas over the weekend. Heavy flash flooding took...,https://media.zenfs.com/en/the_spun_articles_751/0c9efdfa6445a38606782169d0fa2ec9,2025-07-06T20:13:35Z,,"Dallas Cowboys Announce Donation Following Texas Flooding originally appeared on The Spun.
The Dallas Cowboys announced on Sunday an official donation following the flash flooding that took place in… [+1962 chars]",,en,'flooding'
https://consent.yahoo.com/v2/collectConsent?sessionId=1_cc-session_93a936ea-37fc-4d80-aa81-d9616e958ebb,https://consent.yahoo.com/v2/collectConsent?sessionId=1_cc-session_93a936ea-37fc-4d80-aa81-d9616e958ebb,0,consent.yahoo.com,Flash floods like the one that swept through Texas are the nation’s top storm-related killer,,,2025-07-06T20:45:29Z,,"If you click 'Accept all', we and our partners, including 237 who are part of the IAB Transparency &amp; Consent Framework, will also store and/or access information on a device (in other words, use … [+714 chars]",,en,'floods'
https://www.newsweek.com/flash-floods-prompt-evacuation-responders-near-deadly-texas-flood-site-2095232,https://www.newsweek.com/flash-floods-prompt-evacuation-responders-near-deadly-texas-flood-site-2095232,0,www.newsweek.com,Flash Floods Prompt Evacuation of Responders Near Deadly Texas Flood Site,At least 68 people are dead in Kerr county following the flash flooding Friday.,https://d.newsweek.com/en/full/2677757/texas-flooding-damage.jpg,2025-07-06T21:37:26Z,,"As the search continues for multiple missing people, including at least 11 girls from Camp Mystic, a new round of rain has prompted more evacuations.
""FLASH FLOOD WARNING in effect for the Kerr Coun… [+1356 chars]",,en,'floods'
