index,published,keyword,domain,language,valid,title,description,url,image,archive,content,quote
f6c9c4dafc7ad0adb1880ad902c2bd63,2025-11-07T22:58:56Z,'flooding damage',www.rollingstone.com,en,0.1,Hurricane Melissa: How to Help Impacted Communities in Jamaica,Here's how to aid those affected by the devastating storm in the Caribbean nation,http://www.rollingstone.com/culture/culture-news/hurricane-melissa-how-to-help-jamaica-1235461929/,https://www.rollingstone.com/wp-content/uploads/2025/11/jamaica-hurricane-how-to-help.jpg?crop=0px%2C67px%2C1800px%2C1014px&resize=1600%2C900,,"When Hurricane Melissa made landfall in Jamaica late last month, it instantly became the strongest storm ever to strike the Caribbean island nation. The damage was devastating. According to the U.N.,… [+2734 chars]",
56797e0e177f5824ed4d8c73adf05764,2025-11-08T04:06:10Z,'flooding damage',economictimes.indiatimes.com,en,0.1,Earthquake of magnitude 4.4 strikes Afghanistan,Afghanistan experienced a magnitude 4.4 earthquake on Saturday at a depth of 180km. This follows another 4.4 magnitude quake on Friday at a shallow depth of 10km. These tremors occur in a seismically active region prone to frequent seismic activity due to its…,https://economictimes.indiatimes.com/news/international/world-news/earthquake-of-magnitude-4-4-strikes-afghanistan/articleshow/125178035.cms,"https://img.etimg.com/thumb/msid-125178111,width-1200,height-630,imgsize-266276,overlay-economictimes/articleshow.jpg",,"An earthquake of magnitude 4.4 struck Afghanistan on Saturday, according to the National Center for Seismology (NCS).As per the NCS, the earthquake struck at a depth of 180km.
In a post on X, he sai… [+2267 chars]",
dd78b4ce1bee0d817bc4a3705c0ff476,2025-11-08T05:09:35Z,'flooding damage',caribbeannewsglobal.com,en,0.1,PAHO scales up its emergency health response across the Caribbean following hurricane Melissa - Caribbean News Global,"KINGSTON, JAMAICA, (PAHO/WHO) — In response to Hurricane Melissa, the Pan American Health Organization/ World Health Organization (PAHO/WHO) immediately activated its health emergency coordination and response mechanisms and continues working closely with Car…",https://caribbeannewsglobal.com/paho-scales-up-its-emergency-health-response-across-the-caribbean-following-hurricane-melissa/,https://caribbeannewsglobal.com/wp-content/uploads/2025/11/paho_jamaica.jpg,,"KINGSTON, JAMAICA, (PAHO/WHO) In response to Hurricane Melissa, the Pan American Health Organization/ World Health Organization (PAHO/WHO) immediately activated its health emergency coordination and … [+5873 chars]",
787b1295429fb0a82d5aa75a357af988,2025-11-08T05:22:00Z,'flooding damage',www.thestar.com.my,en,0.1,Philippines warns of deadly storm surges as massive Typhoon Fung-wong nears super typhoon strength,"MANILA (Reuters) -The Philippines' weather bureau warned of life-threatening storm surges of up to five metres and destructive winds as Typhoon Fung-wong churns toward the country's eastern coast, where it is forecast to intensify into a super typhoon before …",https://www.thestar.com.my/news/world/2025/11/08/philippines-warns-of-deadly-storm-surges-as-massive-typhoon-fung-wong-nears-super-typhoon-strength,https://apicms.thestar.com.my/uploads/images/2025/11/08/3612054.jpg,,"MANILA (Reuters) -The Philippines' weather bureau warned of life-threatening storm surges of up to five metres and destructive winds as Typhoon Fung-wong churns toward the country's eastern coast, wh… [+2390 chars]",
a5bdd5e40c7f8911a589aa484f1050d5,2025-11-08T05:23:49Z,'flooding damage',www.abc.net.au,en,0.1,Phillippines braces for another typhoon amid devastation of Kalmaegi,Typhoon Kalmaegi left hundreds dead and as Filipinos are bracing for more extreme conditions as they mourn their loved ones and pick up the pieces.,https://www.abc.net.au/news/2025-11-08/typhoon-kalmaegi-vietnam-philippines/105987870,https://live-production.wcms.abc-cdn.net.au/3385f82baf03e806b442bf672dc13d3f?impolicy=wcms_watermark_news&cropH=2813&cropW=5000&xPos=0&yPos=260&width=862&height=485&imformat=generic,,"Typhoon Kalmaegi brought fierce winds and torrential rains to Vietnam on Friday, killing at least five people, flattening homes, blowing off roofs and uprooting trees.
In the Philippines, where the … [+5419 chars]",
57cc18a9706f4d2d0fe9deb876eb8759,2025-11-08T06:21:34Z,'flooding damage',www.channelnewsasia.com,en,0.1,Philippines warns of deadly storm surges as massive Typhoon Fung-wong nears super typhoon strength,The warning comes just days after Typhoon Kalmaegi left a trail of destruction across the region.,https://www.channelnewsasia.com/asia/philippines-warns-deadly-storm-surges-massive-typhoon-fung-wong-nears-super-typhoon-strength-5454991,"https://dam.mediacorp.sg/image/upload/s--QXJSuYx---/c_fill,g_auto,h_676,w_1200/fl_relative,g_south_east,l_mediacorp:cna:watermark:2024-04:reuters_1,w_0.1/f_auto,q_auto/v1/one-cms/core/2025-11-08T051816Z_1_LYNXMPELA701Z_RTROPTP_3_ASIA-WEATHER.JPG?itok=VLFOJ6u-",,"MANILA: The Philippines' weather bureau warned of life-threatening storm surges of up to 5m and destructive winds as Typhoon Fung-wong churns toward the country's eastern coast, where it is forecast … [+2216 chars]",
0486174db9546d51a4945110a57dcd23,2025-11-08T07:36:00Z,'flooding damage',www.dw.com,en,0.1,Philippines: New storm looms after Kalmaegi wreaks havoc,The Philippines is bracing itself for a new storm in the coming days after Typhoon Kalmaegi pounded the country. Kalmaegi also caused deaths and destruction in Vietnam.,https://www.dw.com/en/philippines-new-storm-looms-after-kalmaegi-wreaks-havoc/a-74652594,https://static.dw.com/image/74656307_6.jpg,,"The Philippines is in for another bout of extreme weather as a major storm moves toward the country's eastern coast, following close on the heels of Typhoon Kalmaegi, which devastated large swathes o… [+2985 chars]",
6efcf4b60a5e3bdfdd5ed19bb21a3090,2025-11-08T09:00:00Z,'flooding damage',www.cbc.ca,en,0.1,A City of Oshawa tree caused sewage to back up in this woman’s home. But the region won’t cover plumbing costs,"An Oshawa woman is warning other homeowners after Durham Region declined to cover $1,600 in plumbing costs caused by a city-owned tree, citing a bylaw.",https://www.cbc.ca/news/canada/toronto/city-of-oshawa-tree-sewage-back-up-durham-region-9.6969819,"https://i.cbc.ca/ais/d2c5d7d7-438b-4fd4-91a4-041891598f8c,1762462290517/full/max/0/default.jpg?im=Crop%2Crect%3D%280%2C535%2C5712%2C3213%29%3BResize%3D620",,"An Oshawa woman has a warning for homeowners after Durham Region declined to cover $1,600 in plumbing costs caused by a city-owned tree.
Bev Fiddler says the region is applying its bylaw unfairly, p… [+4574 chars]",
e935fdae067b359fe015f977503aa8fb,2025-11-08T10:25:52Z,'flooding mudslide',www.citizen.digital,en,0.1,"Gov't relocates Marakwet landslide victims, rolls out mental health support plan","The government has taken measures to help the victims of the Marakwet landslide by relocating the affected families to safe areas, providing mental health support and basic necessities.",https://www.citizen.digital/news/govt-relocates-marakwet-landslide-victims-rolls-out-mental-health-support-plan-n372681,https://assets.citizen.digital/161483/conversions/CS-Barasa-og_image.webp,,"The government has taken measures to help the victims of the Marakwet landslide by relocating the affected families to safe areas, providing mental health support and basic necessities. 
Speaking du… [+2394 chars]",
7df73ca1ba01e6407e93ec54690e7fb5,2025-11-08T10:43:01Z,'deluge',www.businessinsider.com,en,0.1,16 photos show how unhinged Black Friday shopping used to be,US shoppers and retailers used to really pull out the stops for the holiday season's big kickoff on the Friday after Thanksgiving.,https://www.businessinsider.com/photos-show-how-unhinged-black-friday-shopping-used-to-be-2025-10,https://i.insider.com/69012923599d46a4ccc106e9?width=1200&format=jpeg,,"A woman passes by a shop announcing Black Friday sales the day after Thanksgiving in New York City November 24,2017.Timothy A. Clary/AFP via Getty Images
<ul><li>US shoppers and retailers used to go… [+6689 chars]",
aed50c1cea099e2560f7dfcd6b06e927,2025-11-08T13:23:38Z,'flooding damage',ca.news.yahoo.com,en,0.9,"Punjab floods: Amid inaction from Indian government, Canadian Sikhs raise millions to help rebuild","Lawyer and journalist Jaskaran Sandhu says ""this is a natural disaster that the government has an immense role in manufacturing"" as historic flood exposes...",https://ca.news.yahoo.com/punjab-floods-amid-inaction-from-indian-government-canadian-sikhs-raise-millions-to-help-rebuild-132338565.html,https://s.yimg.com/ny/api/res/1.2/ko08wJC8umsJAINz33I_Bw--/YXBwaWQ9aGlnaGxhbmRlcjt3PTEyMDA7aD04MDA7Y2Y9d2VicA--/https://s.yimg.com/os/creatr-uploaded-images/2025-11/9d0876a0-bcb7-11f0-97f5-77901f94ebfa,,"This past August, Punjab, India experienced the worst flooding from monsoon rains in the area in over four decades precipitating a statewide crisis that submerged 1,400 villages in 13 districts. At l… [+9585 chars]",
cd13b29d69b3247dabe0b91a8ad47e8e,2025-11-08T13:37:54Z,'flooding damage',www.the-independent.com,en,0.1,Not all olive oils are not created equal. Experts explain how to find the best bottle,Olive oil is widely touted for its health benefits. Experts reveal how to pick the best bottle,https://www.the-independent.com/life-style/health-and-families/extra-virgin-olive-oil-harvest-b2859485.html,"https://static.the-independent.com/2025/11/05/18/10/GettyImages-2230753963.jpeg?trim=1,0,1,0&width=1200&height=800&crop=1200:800",,"Your support helps us to tell the story
From reproductive rights to climate change to Big Tech, The Independent is on the ground when the story is developing. Whether it's investigating the financia… [+5674 chars]",
0b76aeb36b30245b77007ceb63f88d62,2025-11-08T13:56:35Z,'flooding residents',www.bbc.com,en,0.1,New typhoon bears down on Philippines days after deadly storm,Filipinos are bracing for the arrival of a new typhoon after one earlier this week left more than 200 people dead.,https://www.bbc.com/news/articles/cq509yj82y8o,https://ichef.bbci.co.uk/news/1024/branded_news/3665/live/41b39b30-bca9-11f0-9886-b3acf9644cc5.jpg,,"Dozens of families in Remedios T Romualde, on the island of Mindanao, are among those who have been evacuated ahead of the typhoon's arrival
The Philippines is bracing for the arrival of another pot… [+3604 chars]",
639d4ec385d094d7d9bde9dc25347d27,2025-11-08T15:20:01Z,'flooding damage',phys.org,en,0.1,We studied 217 tropical cyclones globally to see how people died. Our findings might surprise you,"Tropical cyclones—also known as hurricanes, typhoons or storms, depending on their location and intensity—are among the world's most destructive and costly climate disasters.",https://phys.org/news/2025-11-tropical-cyclones-globally-people-died.html,https://scx2.b-cdn.net/gfx/news/hires/2022/tropical-cyclones.jpg,,"Tropical cyclonesalso known as hurricanes, typhoons or storms, depending on their location and intensityare among the world's most destructive and costly climate disasters.
Their direct physical imp… [+5919 chars]",
e453991c51d326ef133340dfe7ec009f,2025-11-08T18:12:20Z,'flooding damage',www.digitaljournal.com,en,0.1,"Tornado kills six, wrecks town in Brazil","A tornado killed at least six people and injured around 750 as it destroyed most of a town in southern Brazil, authorities said Saturday. The twister on Friday evening flipped cars like toys and wrecked buildings in Rio Bonito do Iguacu, a town of 14,000 peop…",https://www.digitaljournal.com/world/tornado-kills-six-wrecks-town-in-brazil/article,https://www.digitaljournal.com/wp-content/uploads/2025/11/fccdba71b98a5e8c735ebfa9a3a0b2135fca9520.jpg,,"This photo released by the Parana state government in Brazil shows the town of Rio Bonito do Iguacu after it was hit by a tornado on November 7, 2025 - Copyright Parana State Government/AFP Handout
… [+2132 chars]",
dcedfadb72e858392782d692505b909a,2025-11-09T02:23:57Z,'flooding residents',www.abc.net.au,en,0.1,Philippines evacuates more than 1 million people ahead of second typhoon,The Philippines has evacuated more than a million people ahead of Super Typhoon Fung-wong making landfall.,https://www.abc.net.au/news/2025-11-09/philippines-evacuates-million-people-fung-wong-intensifies/105989236,https://live-production.wcms.abc-cdn.net.au/d19bc3ab3a5686df7bc5437531e114cf?impolicy=wcms_watermark_news&cropH=1146&cropW=2038&xPos=0&yPos=1&width=862&height=485&imformat=generic,,"Super Typhoon Fung-wong has started battering the Philippines' north-eastern coast ahead of landfall on Sunday.
So far, it has knocked out power and led to authorities evacuating more than a million… [+3724 chars]",
619040f319ecbc04e91881bb4ada9a91,2025-11-09T04:30:52Z,'flooding residents',rollingout.com,en,0.1,Polk County Texas issues urgent dam evacuation order,"Emergency officials in Polk County, Texas, have ordered immediate evacuations after discovering serious structural damage to the Carter Lake Dam in Camden. The embankment compromise has created a potentially dangerous situation for nearby residents, with auth…",https://rollingout.com/2025/11/08/polk-county-texas-issues-dam-evacuation/,https://rollingout.com/wp-content/uploads/2025/11/e8522a1c-4c2a-4c2b-a89f-55fc7ac53fa7_1920x1080.jpg,,"Emergency officials in Polk County, Texas, have ordered immediate evacuations after discovering serious structural damage to the Carter Lake Dam in Camden. The embankment compromise has created a pot… [+4636 chars]",
384f48dd8d0e60a74cd60726acd2f00a,2025-11-09T05:43:21Z,'flooding residents',www.digitaljournal.com,en,0.1,Philippines evacuates hundreds of thousands as super typhoon nears,"Nearly a million people have been evacuated and floodwaters were rising in the Philippines on Sunday before Typhoon Fung-wong’s expected late-night landfall on the east coast. The super typhoon, which comes just days after another storm ravaged the country, w…",https://www.digitaljournal.com/world/philippines-evacuates-hundreds-of-thousands-as-super-typhoon-nears/article,https://www.digitaljournal.com/wp-content/uploads/2025/11/8e6d9f963159734fc688823dcff0c9d2128a6f6e.jpg,,"Nearly a million people have been evacuated as the Philippines prepares for super Typhoon Fung-wong in Remedios . - Copyright AFP Erwin MASCARINAS
Nearly a million people have been evacuated and flo… [+3611 chars]",
bf7599bd7597c3e0dcd7599d3fd892c4,2025-11-09T06:44:36Z,'tidal surge',www.npr.org,en,0.1,Nearly a million people evacuate as Super Typhoon Fung-wong threatens the Philippines,"Super Typhoon Fung-wong, the biggest storm to threaten the Philippines this year, started battering the country's northeastern coast ahead of landfall on Sunday.",https://www.npr.org/2025/11/09/g-s1-97091/nearly-a-million-people-evacuate-as-super-typhoon-fung-wong-threatens-the-philippines,https://npr.brightspotcdn.com/dims3/default/strip/false/crop/6882x3871+0+358/resize/1400/quality/100/format/jpeg/?url=http%3A%2F%2Fnpr-brightspot.s3.amazonaws.com%2F5d%2F19%2F75e62383426da4e4ddb488b61e38%2Fap25311360634661.jpg,,"MANILA, Philippines Super Typhoon Fung-wong, the biggest storm to threaten the Philippines this year, started battering the country's northeastern coast ahead of landfall on Sunday, knocking down pow… [+3834 chars]",
7db28c7ae66372614f3a42fd63835b8a,2025-11-09T07:01:35Z,'flooding residents',www.hurriyetdailynews.com,en,0.1,Nearly a million evacuate as typhoon nears Philippines,Nearly a million people have been evacuated and floodwaters were rising in the Philippines on Sunday before Typhoon Fung-wong's expected late-night landfall on the east coast.,https://www.hurriyetdailynews.com/nearly-a-million-evacuate-as-typhoon-nears-philippines-215516,https://image.hurimg.com/i/hurriyet/75/200x200/69103c440d616c03a2b04191.jpg,,"MANILA
Nearly a million people have been evacuated and floodwaters were rising in the Philippines on Sunday before Typhoon Fung-wong's expected late-night landfall on the east coast.
The super typh… [+3479 chars]",
40aa486e8ad551f3ca0da94372ef44ee,2025-11-09T07:38:16Z,'flooding residents',www.thejournal.ie,en,0.1,Nearly a million evacuated in Philippines as super typhoon nears just days after previous typhoon,The typhoon is expected to bring up to eight inches of rainfall to some regions.,https://www.thejournal.ie/evacuation-philippines-super-typhoon-6869215-Nov2025/,https://img2.thejournal.ie/article/6869215/river/?height=400&version=6869217,,"NEARLY A MILLION people have been evacuated and floodwaters were rising in the Philippines this morning before Typhoon Fung-wongs expected late-night landfall on the east coast.
The super typhoon, w… [+3688 chars]",
61f0a2e814402cf55ca12f5858d06ae8,2025-11-09T07:44:21Z,'flooding military',www.aljazeera.com,en,0.1,Nearly 1 million Filipinos evacuate as Super Typhoon Fung-wong approaches,Philippines weather bureau warns of 'life-threatening conditions' as super storm heads for its largest island.,https://www.aljazeera.com/news/2025/11/9/nearly-1-million-filipinos-evacuate-as-super-typhoon-fung-wong-approaches,https://www.aljazeera.com/wp-content/uploads/2025/11/2025-11-07T235956Z_1273815168_RC2ZRHAN0BNK_RTRMADP_3_ASIA-WEATHER-1762666232.jpg?resize=1920%2C1149,,"Nearly a million people have evacuated their homes in the Philippines as the country braced for another powerful storm, days after a typhoon killed more than 200 people.
The storm, named Fung-wong, … [+4225 chars]",
d9aacc9e4cb1826c62c35bafce6f9944,2025-11-09T07:47:20Z,'flooding residents',biztoc.com,en,0.1,Philippine anger boils over as deadly typhoons and graft derail economy,"PoliticsPhilippine anger boils over as deadly typhoons and graft derail economy
Ghost projects haunt disaster-prone country as Marcos' corruption probes stir little hope
A drone view shows residents returning to the remains of their wrecked homes after heavy …",https://biztoc.com/x/99a2ab3ed17bb30d,https://biztoc.com/cdn/99a2ab3ed17bb30d_s.webp,,PoliticsPhilippine anger boils over as deadly typhoons and graft derail economyGhost projects haunt disaster-prone country as Marcos' corruption probes stir little hopeA drone view shows residents re… [+145 chars],
59519f8ff3088fb686bbe22c072b381c,2025-11-09T08:31:52Z,'flooding residents',www.rte.ie,en,0.1,Super typhoon to hit Philippines as floodwaters rise,Nearly a million people have been evacuated and floodwaters are rising in the Philippines before Typhoon Fung-wong's expected late-night landfall on the east coast.,https://www.rte.ie/news/2025/1109/1542958-super-typhoon-philippines/,https://www.rte.ie/images/00237340-1600.jpg,,"Nearly a million people have been evacuated and floodwaters are rising in the Philippines before Typhoon Fung-wong's expected late-night landfall on the east coast.
The super typhoon, which comes ju… [+3540 chars]",
0b382ce096f1ea31b666906367c2bcb2,2025-11-09T09:00:00Z,'flooding residents',www.cbc.ca,en,0.1,Clock ticks on Toronto laneway construction project as some residents grow antsy,"The constant dust, noise and parking headaches were to be expected, residents who use the Montrose laneway say about an ongoing city watermain replacement project. But the project has been going on nine months, and several residents who spoke with CBC Toronto…",https://www.cbc.ca/news/canada/toronto/toronto-laneway-complaints-9.6968443,"https://i.cbc.ca/ais/ee99e533-d910-4b73-ac56-1c076881e1d4,1762382128922/full/max/0/default.jpg?im=Crop%2Crect%3D%280%2C632%2C4032%2C2268%29%3BResize%3D620",,"The constant dust, noise and parking headaches were to be expected, residents who use the Montrose laneway say about an ongoing city watermain replacement project. 
But the project has been going on… [+4086 chars]",
3e16f4e3674a21e984ab092467aeea4c,2025-11-09T09:58:00Z,'tidal surge',news.sky.com,en,1.0,Three dead and 15 injured in Tenerife tidal surge,"Authorities had warned people of a tidal surge and strong winds at the popular Spanish holiday island, advising them not to walk along coastal paths.",https://news.sky.com/story/three-dead-and-15-injured-in-tenerife-tidal-surge-13467146,https://e3.365dm.com/25/11/1600x900/skynews-tenerife-generic_7076675.jpg?20251109100636,,"Three people have died after they were swept into the sea off the coast of Tenerife during treacherous weather, officials said on Sunday.
Strong waves pulled them into the Atlantic Ocean during a ti… [+2135 chars]",
16f6ed209e27eb0dcf6196c250c95a47,2025-11-09T10:01:56Z,'tidal surge',abcnews.go.com,en,1.0,"At least 3 dead, over a dozen injured in tidal surge on Spain's Canary Islands",Strong waves have killed three people on Spain's Canary Islands by pulling them into the Atlantic Ocean during a tidal surge,https://abcnews.go.com/International/wireStory/3-dead-15-injured-tidal-surge-spains-canary-127349308,https://s.abcnews.com/images/US/abc_news_default_2000x2000_update_16x9_992.jpg,,"BARCELONA, Spain -- Strong waves killed three people on Spains Canary Islands by pulling them into the Atlantic Ocean during a tidal surge, officials said Sunday. 
Another 15 were injured in four di… [+589 chars]",
11b48ca80edfbe94071b25478187d4e8,2025-11-09T10:26:24Z,'tidal surge',www.cbc.ca,en,0.1,"Super typhoon threatens the Philippines, forcing more than 1 million people to evacuate","Super Typhoon Fung-wong, the biggest storm to threaten the Philippines this year, started battering the country's northeastern coast ahead of landfall on Sunday, knocking down power, forcing the evacuation of more than a million people and prompting the defen…",https://www.cbc.ca/news/world/super-typhoon-the-philippines-evacuation-9.6972581,"https://i.cbc.ca/ais/0777d1af-670c-4d20-8c04-df28215c1080,1762675039529/full/max/0/default.jpg?im=Crop%2Crect%3D%280%2C178%2C3432%2C1930%29%3BResize%3D620",,"Super Typhoon Fung-wong, the biggest storm to threaten the Philippines this year, started battering the country's northeastern coast ahead of landfall on Sunday, knocking down power, forcing the evac… [+4606 chars]",
1e404de1f629da5ec8af92b714beb3bf,2025-11-09T10:45:43Z,'tidal surge',www.thejournal.ie,en,1.0,Three dead as strong waves sweep people into Atlantic on Tenerife,Authorities have warned of tidal surges and rough seas after multiple incidents on Tenerife.,https://www.thejournal.ie/tenerife-tidal-waves-three-dead-canary-islands-6869269-Nov2025/,https://img2.thejournal.ie/article/6869269/river/?height=400&version=6869270,,"STRONG WAVES HAVE killed three people on Spains Canary Islands by pulling them into the Atlantic Ocean during a tidal surge, officials have said.
Another 15 were injured in four incidents along the … [+570 chars]",
6c7360834ff46c6f07d7f42b4deb8f9f,2025-11-09T11:53:29Z,'flooding residents',www.sunstar.com.ph,en,0.1,Frasco Blasts Gov Baricuatro: Liloan Residents Face Health,"RESIDENTS in the northern town of Liloan, Cebu are voicing urgent concerns over health hazards due to uncollected typhoon debris and animal remains, even as the",https://www.sunstar.com.ph/cebu/frasco-blasts-baricuatro-over-liloan-aid,https://media.assettype.com/sunstar%2F2025-08-13%2Fgcih135j%2Fp1.jpg?rect=0%2C23%2C750%2C394&w=1200&ar=40%3A21&auto=format%2Ccompress&ogImage=true&mode=crop&enlarge=true&overlay=false&overlay_position=bottom&overlay_width=100,,"RESIDENTS in the northern town of Liloan, Cebu are voicing urgent concerns over health hazards due to uncollected typhoon debris and animal remains, even as the towns representative publicly criticiz… [+2628 chars]",
0ca352c16bf7cb1efb177e158ab190b2,2025-11-09T12:00:24Z,'flooding residents',economictimes.indiatimes.com,en,0.1,"Super Typhoon Uwan: Airport operations suspended, 403 families evacuated — Here’s where the storm is heading",Several airports in the Bicol region suspended operations on Sunday as Super Typhoon Uwan (international name: Fung-Wong) battered the Philippines with intense rain and strong winds.,https://economictimes.indiatimes.com/news/international/us/super-typhoon-uwan-airport-operations-suspended-403-families-evacuated-heres-where-the-storm-is-heading/articleshow/125201122.cms,"https://img.etimg.com/thumb/msid-125201149,width-1200,height-630,imgsize-117042,overlay-economictimes/articleshow.jpg",,Several airports across the Bicol region have suspended operations on Sunday as Super Typhoon Uwan (international name: Fung-Wong) lashed the Philippines with torrential rain and powerful winds. The … [+4847 chars],
1313a2b5a0b660da33119e3ef7b0aec2,2025-11-09T14:13:56Z,'flooding residents',www.yahoo.com,en,0.1,Super Typhoon Fung-wong makes landfall in Philippines,"Super Typhoon Fung-wong slammed into the Philippines' eastern seaboard on Sunday, the national weather service said, after killing at least two people and...",https://www.yahoo.com/news/videos/super-typhoon-fung-wong-makes-141356314.html,https://s.yimg.com/lo/mysterio/api/6F34B4298824F925AC13444C531D502F0CFE4C579AB2E93ECA3407202CD5288C/subgraphmysterio/resizefill_w1200_h675;quality_80;format_webp/https:%2F%2Fcf-images.us-east-1.prod.boltdns.net%2Fv1%2Fjit%2F6415665815001%2Fd0203068-2b61-4b46-afc8-5f9a3cc27b64%2Fmain%2F1280x720%2F30s581ms%2Fmatch%2Fimage.jpg,,"Super Typhoon Fung-wong slammed into the Philippines' eastern seaboard on Sunday, the national weather service said, after killing at least two people and forcing more than a million to evacuate.
Th… [+4041 chars]",
