index,published,keyword,domain,language,valid,title,description,url,image,archive,content,quote,de,en,la,added
7fd33ccf6375436a506f0f03060fcfc8,2025-11-13T10:50:00Z,'flooding',news.sky.com,en,0.9,Flood and 'do not travel' warnings issued as Storm Claudia prepares to batter parts of UK,"An amber weather warning has been issued for parts of England and Wales today, as Storm Claudia prepares to bring heavy downpours and potential flooding.",https://news.sky.com/story/uk-weather-flood-and-do-not-travel-warnings-issued-as-storm-claudia-arrives-13469515,https://e3.365dm.com/25/11/1600x900/skynews-rain-uk-weather_7080994.jpg?20251113122551,,"An amber weather warning has been issued for parts of England and Wales today, as Storm Claudia prepares to bring heavy downpours and potential flooding.
Flooding is likely, with some areas facing u… [+3791 chars]",,"Überschwemmungs- und Reiseverbotswarnungen werden ausgegeben, während Sturm Claudia sich darauf vorbereitet, Teile des Vereinigten Königreichs zu verwüsten. Für Teile von England und Wales wurde heute eine bernsteinfarbene Wetterwarnung herausgegeben, da Sturm Claudia sich auf heftige Regenfälle und mögliche Überschwemmungen vorbereitet.","Flood and 'do not travel' warnings issued as Storm Claudia prepares to batter parts of UK. An amber weather warning has been issued for parts of England and Wales today, as Storm Claudia prepares to bring heavy downpours and potential flooding.","Diluvium et 'noli iter' monita ut Storm Claudia quatere partes UK parat. Tempestas electra monitum pro partibus Angliae et Walliae hodie denuntiatum est, sicut Storm Claudia parat graves imbres et inundationes potentiales afferre.",2025-10-21 18:42:08+00:00
63c83a68719fbaa8f52013073c43783b,2025-11-13T11:49:09Z,'flooding',www.bbc.com,en,0.9,Amber warnings issued ahead of heavy rain from Storm Claudia,Storm Claudia is set to bring heavy and persistent rain to parts of the UK with amber warnings issued with risk of flooding and disruption.,https://www.bbc.com/weather/articles/cj0e3y6yy99o,https://ichef.bbci.co.uk/ace/branded_weather/1200/cpsprodpb/4158/live/3a0c79b0-c078-11f0-b95f-c7c5e73ea311.png,http://web.archive.org/web/20251113140744/https://www.bbc.com/weather/articles/cj0e3y6yy99o,"Storm Claudia - named by the Spanish Meteorological Agency (AEMET) - has already brought heavy rain and strong winds to Spain and Portugal.
But rain associated with this storm will spread quickly no… [+1212 chars]",,"Gelbe Warnungen vor starkem Regen durch Sturm Claudia. Sturm Claudia wird voraussichtlich starken und anhaltenden Regen in Teile des Vereinigten Königreichs bringen, wobei gelbe Warnungen mit der Gefahr von Überschwemmungen und Störungen ausgegeben werden.",Amber warnings issued ahead of heavy rain from Storm Claudia. Storm Claudia is set to bring heavy and persistent rain to parts of the UK with amber warnings issued with risk of flooding and disruption.,Amber monita pluviae a Claudia Storm edita praecedit. Claudia tempestas instituitur ut pluviam gravem et pertinacem ad partes UK permoveat cum monitis electri editis cum periculo inundationis et distractionis.,2025-10-21 18:42:08+00:00
1e4b119dadb6748398a75376272dbdc2,2025-11-13T11:52:54Z,'flooding storm',slashdot.org,en,0.9,"SoCal storm forecast worsens: Periods of heavy rain, possible flooding — maybe even a tornado - Los Angeles Times","SoCal storm forecast worsens: Periods of heavy rain, possible flooding — maybe even a tornadoLos Angeles Times Get ready for flooding and mudslides. Here's the latest on the unpredictable storm headed for SoCalLAist ‘A Lot of Uncertainty’ Suddenly Surrounds a…",https://slashdot.org/firehose.pl?op=view&amp;id=180062832,,http://web.archive.org/web/20160119174443/http://slashdot.org/firehose.pl?op=view,The Fine Print: The following comments are owned by whoever posted them. We are not responsible for them in any way.,,"Die Sturmvorhersage für Südkalifornien verschlechtert sich: Perioden mit starkem Regen, mögliche Überschwemmungen – vielleicht sogar ein Tornado – Los Angeles Times. Die Sturmvorhersage für Südkalifornien verschlechtert sich: Perioden mit starkem Regen, mögliche Überschwemmungen – vielleicht sogar ein TornadoLos Angeles Times Machen Sie sich auf Überschwemmungen und Schlammlawinen gefasst. Hier ist das Neueste über den unvorhersehbaren Sturm, der auf SoCalLA zusteuert. „A Lot of Uncertainty“ umgibt plötzlich ein…","SoCal storm forecast worsens: Periods of heavy rain, possible flooding — maybe even a tornado - Los Angeles Times. SoCal storm forecast worsens: Periods of heavy rain, possible flooding — maybe even a tornadoLos Angeles Times Get ready for flooding and mudslides. Here's the latest on the unpredictable storm headed for SoCalLAist ‘A Lot of Uncertainty’ Suddenly Surrounds a…","SoCal tempestas praecognoscet gravescit: Tempora pluviae, inundatio possibilis — fortasse etiam turbo - Los Angeles Times. Tempestas SoCal praecognoscet gravescit: Tempora pluviae, inundatio possibilis — fortasse etiam tornadoLos Angeles Tempora para inundationem et mudslides. Hic est tardus in inopinata tempestate petitus ad SoCalLAist 'A Lot of Incertae' subito circumscribit a…",2025-10-21 18:42:08+00:00
23fafc49dd46062c845a7d3f00c295bb,2025-11-13T20:35:03Z,'floods',gizmodo.com,en,0.9,Evacuation Warnings Issued as Atmospheric River Threatens to Drench Burn-Scarred Los Angeles,"The storm could trigger dangerous flash floods and mudslides, but it may also extinguish California’s wildfire season.",https://gizmodo.com/evacuation-warnings-issued-as-atmospheric-river-threatens-to-drench-burn-scarred-los-angeles-2000685632,https://gizmodo.com/app/uploads/2025/11/atmospheric-river-alifornia-1200x675.jpg,,"Californias historic wildfire season may come to an early end this week as an atmospheric river drenches the state, but the much-needed rain is bringing new hazards.
The storm arrived in California … [+3607 chars]",,"Evakuierungswarnungen werden ausgegeben, da der atmosphärische Fluss das von Verbrennungen gezeichnete Los Angeles zu durchnässen droht. Der Sturm könnte gefährliche Sturzfluten und Schlammlawinen auslösen, könnte aber auch die Waldbrandsaison in Kalifornien auslöschen.","Evacuation Warnings Issued as Atmospheric River Threatens to Drench Burn-Scarred Los Angeles. The storm could trigger dangerous flash floods and mudslides, but it may also extinguish California’s wildfire season.","Monitiones Evacuationis Atmosphaericae Flumen denuntiatum minatur ut perfundat Burn-Scarred Los Angeles. Tempestas potest felis periculosa inundationes et mudslides micare, sed etiam tempus ignis ferum Californiae extinguere potest.",2025-10-21 18:42:08+00:00
ed2d9190e1283318b57ed2579c3fe541,2025-11-14T00:05:39Z,'flooding',www.thejournal.ie,en,0.9,'Significant flooding' could hit any part of the country today - here's what you need to know,"A Status Orange warning for rain will be in place across Dublin, Wexford and Wicklow but all areas are at risk of flooding.",https://www.thejournal.ie/status-orange-rain-alert-met-eireann-flood-risk-6873757-Nov2025/,https://img2.thejournal.ie/article/6873757/river/?height=400&version=6873854,,"FROM 2PM THIS afternoon, a Status Orange warning for rain will be in place across Dublin, Wexford and Wicklow.
This alert is in place from 2pm until 11am tomorrow and Met Éireann is warning that sig… [+5545 chars]",,"„Erhebliche Überschwemmungen“ könnten heute jeden Teil des Landes treffen – hier ist, was Sie wissen müssen. In Dublin, Wexford und Wicklow wird es eine Regenwarnung mit Status Orange geben, aber in allen Gebieten besteht Überschwemmungsgefahr.","'Significant flooding' could hit any part of the country today - here's what you need to know. A Status Orange warning for rain will be in place across Dublin, Wexford and Wicklow but all areas are at risk of flooding.","""Inundationem significans"" nullam partem regionis hodie attingere potuit - hic quod scire debes. Status Orange monitus pluviae in loco trans Dublin, Wexford et Wicklow erunt, sed omnes areae inundationis periculo sunt.",2025-10-21 18:42:08+00:00
725209059903e98ad920e9bfd7d3bcb2,2025-11-14T05:30:00Z,'flooding',www.independent.ie,en,0.9,Country braced for threat of ‘significant’ flooding as Status Orange alert issued for three counties,Half the country will be subjected to heavy rain and potential flooding today and tomorrow as a result of Storm Claudia.,https://www.independent.ie/weather/country-braced-for-threat-of-significant-flooding-as-status-orange-alert-issued-for-three-counties/a432837382.html,https://focus.independent.ie/thumbor/3PPZ6wJT-Rf7GN83t-2TeiibqeE=/0x26:3160x2132/629x0/prod-mh-ireland/acddfa84-df45-43e4-8162-652330db8c81/b46242b9-41d7-454a-b281-7e47727085ec/acddfa84-df45-43e4-8162-652330db8c81.jpg,,"Half the country will be subjected to heavy rain and potential flooding today and tomorrow as a result of Storm Claudia.Met Éireann said a massive band of rain will hit many counties in the east, all… [+2823 chars]",,"Das Land bereitete sich auf die Gefahr „erheblicher“ Überschwemmungen vor, da für drei Landkreise die Status-Orange-Warnung ausgegeben wurde. Das halbe Land wird heute und morgen aufgrund des Sturms Claudia starken Regenfällen und möglichen Überschwemmungen ausgesetzt sein.",Country braced for threat of ‘significant’ flooding as Status Orange alert issued for three counties. Half the country will be subjected to heavy rain and potential flooding today and tomorrow as a result of Storm Claudia.,Patria aptata pro comminatione de inundatione significans sicut Status Orange erectus pro tribus comitatibus emanavit. Media regio pluviae et potentiae inundationis hodiernae et crastinae ob Claudiam Stormorum subiecta erit.,2025-10-21 18:42:08+00:00
10a4e4f06a15afb7bf5af963adefa78f,2025-11-14T11:10:47Z,'flooding rain',www.thejournal.ie,en,0.9,Country braces for potential flooding as Storm Claudia brings heavy rain and wind,Disruptions and delays for drivers and public transport users are likely.,https://www.thejournal.ie/weather-warnings-storm-claudia-live-updates-6874497-Nov2025/,https://img2.thejournal.ie/article/6874497/river/?height=400&version=6874515,,"ITS RAINING BUCKETS in much of the country today.
Met Éireann has issued weather warnings for much of the east and south, cautioning of potential significant flooding and difficult travel conditions… [+2047 chars]",,"Das Land bereitet sich auf mögliche Überschwemmungen vor, da Sturm Claudia starken Regen und Wind mit sich bringt. Störungen und Verzögerungen für Fahrer und Nutzer öffentlicher Verkehrsmittel sind wahrscheinlich.",Country braces for potential flooding as Storm Claudia brings heavy rain and wind. Disruptions and delays for drivers and public transport users are likely.,Patriae adstringit potentialis inundationem sicut Storm Claudia pluviam et ventum affert. Disruptiones et moras pro rectoribus et utentes onerariis publicis verisimile sunt.,2025-10-21 18:42:08+00:00
a0dc024752eda887d8b74980a7ed878f,2025-11-14T14:34:33Z,'flooding',www.haaretz.com,en,0.9,"As rain hits Gaza, experts warn flooding could lead to disease as nearly all tents become uninhabitable",Humanitarian aid organizations say hundreds of tents have been flooded. Some displaced persons have been forced to seek new shelter. Rains mixing with sewage in areas where infrastructure was destroyed,https://www.haaretz.com/gaza/2025-11-14/ty-article/.premium/rain-in-gaza-experts-say-flooding-could-lead-to-disease-as-nearly-all-tents-uninhabitable/0000019a-829a-dc34-afbf-fa9fb4800000,"https://img.haarets.co.il/bs/0000019a-829a-dc34-afbf-fa9fb4800000/7e/b0/a4833e424127ad8686bb2653a234/789680.jpg?precrop=2400,1395,x0,y195&width=1200&height=630&cmsprod",,Humanitarian aid organizations say hundreds of tents have been flooded. Some displaced persons have been forced to seek new shelter. Rains mixing with sewage in areas where infrastructure was destroy… [+1 chars],,"Wenn der Regen Gaza erreicht, warnen Experten, dass Überschwemmungen zu Krankheiten führen könnten, da fast alle Zelte unbewohnbar werden. Nach Angaben humanitärer Hilfsorganisationen seien Hunderte Zelte überflutet worden. Einige Vertriebene waren gezwungen, eine neue Unterkunft zu suchen. Regen vermischt sich mit Abwasser in Gebieten, in denen die Infrastruktur zerstört wurde","As rain hits Gaza, experts warn flooding could lead to disease as nearly all tents become uninhabitable. Humanitarian aid organizations say hundreds of tents have been flooded. Some displaced persons have been forced to seek new shelter. Rains mixing with sewage in areas where infrastructure was destroyed","Sicut Gaza pluvia pervenit, periti monent inundationem morbum ducere posse ut omnia fere tabernacula inhabitabilia fiant. Institutiones auxilium humanitarium dicunt centena tabernacula inundata esse. Nonnulli moti sunt homines ad novas receptacula quaerere. Pluviis miscentes purgamentorum in locis ubi infrastructura destructa est",2025-10-21 18:42:08+00:00
8a7771c34b1b3cc7023c52b9b854b4f1,2025-11-14T17:17:24Z,'flooding evacuation',biztoc.com,en,0.9,"California Evacuation Map as Millions Face Heavy Rain, Flooding","A strong atmospheric river is pummeling Southern California, bringing a widespread risk of floods and prompting evacuations.",https://biztoc.com/x/d73ff692a69468a8,https://biztoc.com/cdn/954/og.png,,"A strong atmospheric river is pummeling Southern California, bringing a widespread risk of floods and prompting evacuations.
This story appeared on newsweek.com, 2025-11-14 17:06:12.",,"Evakuierungskarte für Kalifornien, da Millionen von Menschen mit starkem Regen und Überschwemmungen konfrontiert sind. Ein starker atmosphärischer Fluss schüttet Südkalifornien aus, was zu einer weit verbreiteten Überschwemmungsgefahr führt und Evakuierungen nach sich zieht.","California Evacuation Map as Millions Face Heavy Rain, Flooding. A strong atmospheric river is pummeling Southern California, bringing a widespread risk of floods and prompting evacuations.","California Evacuation Map as Millions Face Gravis Pluviae, Inundatio. Fluvius atmosphaericus validus in California meridionalem labefacit, latissime periculum inundationum et evacuationes excitat.",2025-10-21 18:42:08+00:00
93e0c2be51b7a19bf0428a02e687d3c0,2025-11-14T18:36:28Z,'flooding area',www.bbc.com,en,0.9,Weather warnings in force as Storm Claudia brings heavy rain to UK,"The storm has brought flooding and downpours, with some areas expecting up to a month's worth of rain in a day.",https://www.bbc.com/news/articles/c4gw5xxej04o,https://ichef.bbci.co.uk/news/1024/branded_news/a7c5/live/c48b8af0-c171-11f0-8669-5560f5c90fbe.jpg,http://web.archive.org/web/20251115010607/https://www.bbc.com/news/articles/c4gw5xxej04o,"Ruth Comerford and BBC Weather
Amber warnings from the Met Office for ""persistent and heavy"" rain are in force as Storm Claudia continues to move across the United Kingdom.
A wider yellow severe we… [+4410 chars]",,"Es gelten Wetterwarnungen, da Sturm Claudia heftigen Regen nach Großbritannien bringt. Der Sturm hat Überschwemmungen und Regenfälle mit sich gebracht, wobei in manchen Gebieten mit bis zu einem Monat Regen an einem Tag gerechnet wird.","Weather warnings in force as Storm Claudia brings heavy rain to UK. The storm has brought flooding and downpours, with some areas expecting up to a month's worth of rain in a day.","Tempestas admonitiones in vi sicut Storm Claudia pluviam UK adfert. Tempestas inundationes et imbres attulit, nonnullis locis usque ad mensem pluviam in diem exspectantibus.",2025-10-21 18:42:08+00:00
c1377cb6419c899771c8c0b028faf248,2025-11-14T20:53:14Z,'flooding area',www.yahoo.com,en,0.9,"California hit by flooding, snow, landslides, winds, wildfires, and an earthquake, all in one day",Nearly a dozen weather phenomena occurred in California Thursday as the state lived up to its reputation.,https://www.yahoo.com/news/articles/california-hit-flooding-snow-landslides-205314489.html,https://media.zenfs.com/en/accuweather_articles_339/b59fa6b39e40edd7079b30c5ebee0993,,"California hit by flooding, snow, landslides, winds, wildfires, and an earthquake, all in one day
In a state known for both ""boring"" and ""scary"" weather- as well as frequent natural disasters - Cali… [+3645 chars]",,"Kalifornien wurde an einem Tag von Überschwemmungen, Schnee, Erdrutschen, Winden, Waldbränden und einem Erdbeben heimgesucht. Fast ein Dutzend Wetterphänomene ereigneten sich am Donnerstag in Kalifornien, womit der Staat seinem Ruf alle Ehre machte.","California hit by flooding, snow, landslides, winds, wildfires, and an earthquake, all in one day. Nearly a dozen weather phenomena occurred in California Thursday as the state lived up to its reputation.","Cali- hit per inundationem, nix, ruinas, ventos, incendia et terrae motus omnes in una die. Fere duodecim phaenomena tempestatum in California Iovis facta sunt sicut res publica usque ad famam suam vixit.",2025-10-21 18:42:08+00:00
af45ecbd882c0fe6e648e7748ddae2a3,2025-11-15T01:48:23Z,'flooding',www.rte.ie,en,0.9,"Wexford premises flooded as storm impacts power for 3,000","Eighteen properties were flooded across Co Wexford overnight and the county remains on alert for the possibility of flooding in Enniscorthy later today, following heavy rains associated with Storm Claudia overnight.",https://www.rte.ie/news/2025/1115/1544115-weather-flooding/,https://www.rte.ie/images/00237c3c-1600.jpg,,"Eighteen properties were flooded across Co Wexford overnight and the county remains on alert for the possibility of flooding in Enniscorthy later today, following heavy rains associated with Storm Cl… [+4523 chars]",,"Das Gelände in Wexford wurde überschwemmt, da der Sturm den Strom für 3.000 Menschen beeinträchtigte. Über Nacht wurden im gesamten Landkreis Wexford 18 Grundstücke überschwemmt, und der Landkreis ist weiterhin in Alarmbereitschaft, da in Enniscorthy im weiteren Verlauf des heutigen Tages nach heftigen Regenfällen im Zusammenhang mit dem Sturm Claudia über Nacht Überschwemmungen möglich sein könnten.","Wexford premises flooded as storm impacts power for 3,000. Eighteen properties were flooded across Co Wexford overnight and the county remains on alert for the possibility of flooding in Enniscorthy later today, following heavy rains associated with Storm Claudia overnight.","Wexford praemissa inundata sicut impetus tempestatis pro 3,000 potestate. Duodeviginti possessiones trans Co Wexford pernoctare inundatae sunt et comitatus intenti ad possibilitatem inundationis in Enniscorthy postea hodie sequentes pluviae cum Claudia Storm pernoctare coniunguntur.",2025-10-21 18:42:08+00:00
cf6896454e4f540ea5ea98ebfb70076d,2025-11-15T05:30:00Z,'flooding weather',www.independent.ie,en,0.9,Storm Claudia leaves flooding and power outages in its wake – but conditions set to stabilise today,Storm Claudia left its mark on the country yesterday as several counties reported significant flooding and power outages after conditions lived up to earlier Status Orange and ­Yellow rain and wind warnings.,https://www.independent.ie/weather/storm-claudia-leaves-flooding-and-power-outages-in-its-wake-but-conditions-set-to-stabilise-today/a1583188140.html,https://focus.independent.ie/thumbor/FywqsCvRymsIYM1PTuIZ6BFhiaM=/629x460/smart/prod-mh-ireland/289de995-11e6-46d3-8d4b-7154a725db3f/e3bc1378-3a9a-4129-9dbe-4148108af232/er%20alert%20_%20dublin%206.jpg,,Storm Claudia left its mark on the country yesterday as several counties reported significant flooding and power outages after conditions lived up to earlier Status Orange and ­Yellow rain and wind w… [+4262 chars],,"Sturm Claudia hinterlässt Überschwemmungen und Stromausfälle – doch heute dürfte sich die Lage stabilisieren. Sturm Claudia hinterließ gestern seine Spuren im Land, da mehrere Landkreise erhebliche Überschwemmungen und Stromausfälle meldeten, nachdem die Bedingungen den früheren Regen- und Windwarnungen in Status Orange und Gelb entsprachen.",Storm Claudia leaves flooding and power outages in its wake – but conditions set to stabilise today. Storm Claudia left its mark on the country yesterday as several counties reported significant flooding and power outages after conditions lived up to earlier Status Orange and ­Yellow rain and wind warnings.,Tempestas Claudia inundationem et vim outages in suo motu relinquit – sed condiciones hodie ad stabiliendum positae sunt. Tempestas Claudia hesterno die signum suum reliquit ut aliquot comitatus significantes inundationes et potentias outages nuntiaverunt post condiciones usque ad maturitatem Status Aurei et Flavii pluviae et venti monita vixerunt.,2025-10-21 18:42:08+00:00
34d0cd11eae5fd6bc71679bbaefb008c,2025-11-15T07:34:27Z,'flooding',www.thejournal.ie,en,0.9,Storm Claudia: Warnings still in place amid power outages and flooding - but it may ease off later,A rain warning will remain in place across 13 counties until 9am.,https://www.thejournal.ie/storm-claudia-weather-warnings-wind-rain-6875632-Nov2025/,https://img2.thejournal.ie/article/6875632/river/?height=400&version=6875633,,"STORM CLAUDIA HAS begun to move away from Ireland this morning, but weather warnings remain in effect and thousands of homes and businesses are still without power following a day of severe rain, flo… [+3661 chars]",,Sturm Claudia: Bei Stromausfällen und Überschwemmungen gelten weiterhin Warnungen – es könnte aber später nachlassen. Bis 9 Uhr morgens gilt in 13 Landkreisen weiterhin eine Regenwarnung.,Storm Claudia: Warnings still in place amid power outages and flooding - but it may ease off later. A rain warning will remain in place across 13 counties until 9am.,Tempestas Claudia: Admonitiones adhuc in loco inter vim outages et inundationem - sed postea potest relevare. Monitio pluviae loco per 13 comitatus usque ad 9am manebit.,2025-10-21 18:42:08+00:00
fbbe32b03044ac17f104b78c0bf48dd2,2025-11-15T08:30:00Z,'flooding weather',www.independent.ie,en,0.9,Rivers in Dublin remain under ‘close observation’ as severe flooding hits parts of Wexford after Storm Claudia,"{
 ""themeId"": ""lct_64772ae4d1d7dec0c5b716ac"",
 ""clientId"": ""64772ae4d1d7dec0c5b716af"",
 ""liveblogId"": ""69183ea87ae32051200a079a""
}",https://www.independent.ie/weather/rivers-in-dublin-remain-under-close-observation-as-severe-flooding-hits-parts-of-wexford-after-storm-claudia/a1583188140.html,https://focus.independent.ie/thumbor/eCEj4xt4OLW5CADwrQRyIDigzqQ=/629x460/smart/prod-mh-ireland/289de995-11e6-46d3-8d4b-7154a725db3f/763c9da8-29b5-4cc4-a1e9-16657df944fd/er%20alert%20_%20dublin%206.jpg,,Storm Claudia left its mark on the country yesterday as several counties reported significant flooding and power outages after conditions lived up to earlier Status Orange and ­Yellow rain and wind w… [+4106 chars],,"Die Flüsse in Dublin bleiben unter „genauer Beobachtung“, da Teile von Wexford nach dem Sturm Claudia von schweren Überschwemmungen heimgesucht werden. {
 „themeId“: „lct_64772ae4d1d7dec0c5b716ac“,
 „clientId“: „64772ae4d1d7dec0c5b716af“,
 „liveblogId“: „69183ea87ae32051200a079a“
}","Rivers in Dublin remain under ‘close observation’ as severe flooding hits parts of Wexford after Storm Claudia. {
 ""themeId"": ""lct_64772ae4d1d7dec0c5b716ac"",
 ""clientId"": ""64772ae4d1d7dec0c5b716af"",
 ""liveblogId"": ""69183ea87ae32051200a079a""
}","Flumina in Dublin manent sub stricta observatione tamquam graves hits inundationes partium Wexforde post Storm Claudia. {
 ""themeId"": ""lct_64772ae4d1d7dec0c5b716ac"",
 ""clientId"": ""64772ae4d1d7dec0c5b716af"",
 ""liveblogId"": ""69183ea87ae32051200a079a""
}",2025-10-21 18:42:08+00:00
18ee6b873b4cb6e10fef1353766a3bc6,2025-11-15T08:30:00Z,'flooding weather',www.independent.ie,en,0.9,"Storm Claudia leaves flooding and 5,000 without power in its wake – but conditions set to stabilise today","{
 ""themeId"": ""lct_64772ae4d1d7dec0c5b716ac"",
 ""clientId"": ""64772ae4d1d7dec0c5b716af"",
 ""liveblogId"": ""69183ea87ae32051200a079a""
}",https://www.independent.ie/weather/storm-claudia-leaves-flooding-and-5000-without-power-in-its-wake-but-conditions-set-to-stabilise-today/a1583188140.html,https://focus.independent.ie/thumbor/AvQZL9z1lGytU9yRrtjLbO6j8n0=/629x460/smart/prod-mh-ireland/289de995-11e6-46d3-8d4b-7154a725db3f/d1933385-c44b-4e10-aeb2-b73ca340ed4e/er%20alert%20_%20dublin%206.jpg,,Storm Claudia left its mark on the country yesterday as several counties reported significant flooding and power outages after conditions lived up to earlier Status Orange and ­Yellow rain and wind w… [+4110 chars],,"Sturm Claudia hinterlässt Überschwemmungen und 5.000 Menschen ohne Strom – doch die Bedingungen dürften sich heute stabilisieren. {
 „themeId“: „lct_64772ae4d1d7dec0c5b716ac“,
 „clientId“: „64772ae4d1d7dec0c5b716af“,
 „liveblogId“: „69183ea87ae32051200a079a“
}","Storm Claudia leaves flooding and 5,000 without power in its wake – but conditions set to stabilise today. {
 ""themeId"": ""lct_64772ae4d1d7dec0c5b716ac"",
 ""clientId"": ""64772ae4d1d7dec0c5b716af"",
 ""liveblogId"": ""69183ea87ae32051200a079a""
}","Tempestas Claudia inundationem et 5,000 sine vi in ​​ortu relinquit — condiciones autem hodie ad stabiliendum positae sunt. {
 ""themeId"": ""lct_64772ae4d1d7dec0c5b716ac"",
 ""clientId"": ""64772ae4d1d7dec0c5b716af"",
 ""liveblogId"": ""69183ea87ae32051200a079a""
}",2025-10-21 18:42:08+00:00
