index,url,valid,domain,title,description,image,published,archive,content,quote,language,keyword
https://www.breitbart.com/sports/2025/07/06/houston-texans-make-500000-donation-to-aid-texas-flooding-recovery-operations/,https://www.breitbart.com/sports/2025/07/06/houston-texans-make-500000-donation-to-aid-texas-flooding-recovery-operations/,0,www.breitbart.com,"Houston Texans Make $500,000 Donation to Aid Texas Flooding Recovery Operations","The Houston Texans have made a $500,000 donation to aid the Texas Hill Country community devastated after a flash flood killed dozens, including children.
The post Houston Texans Make $500,000 Donation to Aid Texas Flooding Recovery Operations appeared first …",https://media.breitbart.com/media/2025/07/Tim-Warner_Getty-Images-5-640x335.jpg,2025-07-06T16:14:07Z,,"The Houston Texans have made a $500,000 donation to aid the Texas Hill Country community devastated after a flash flood killed dozens, including children.
The Texans organization issued a statement … [+2146 chars]",,en,'flooding damage'
https://economictimes.indiatimes.com/news/international/us/texas-flood-death-toll-rises-to-67-why-did-the-guadalupe-river-flood-and-camp-mystic-updates/articleshow/122282457.cms,https://economictimes.indiatimes.com/news/international/us/texas-flood-death-toll-rises-to-67-why-did-the-guadalupe-river-flood-and-camp-mystic-updates/articleshow/122282457.cms,0,economictimes.indiatimes.com,Texas flood death toll rises to 67 — What went wrong and why the Guadalupe River overflowed,"The death toll from the devastating floods in Texas rose to at least 67 on Sunday, with 21 children confirmed among the victims, as rescue teams continued their search for several girls still missing from a summer camp.","https://img.etimg.com/thumb/msid-122282486,width-1200,height-630,imgsize-838402,overlay-economictimes/articleshow.jpg",2025-07-06T16:39:39Z,,"Rescue and recovery efforts continued across central Texas on Saturday, with teams searching devastated areas for survivors and victims. As of now, at least 67 people have perished, among them 21 chi… [+7197 chars]",,en,'floods'
https://www.mensjournal.com/sports/legendary-nfl-star-troy-aikman-asks-for-prayers,https://www.mensjournal.com/sports/legendary-nfl-star-troy-aikman-asks-for-prayers,0,www.mensjournal.com,Legendary NFL Star Troy Aikman Asks for Prayers,The minds and sympathies of Americans and many around the world are with the people of Texas this weekend. Heavy flooding has led to dozens of casualties as ...,https://media.zenfs.com/en/men_s_journal_718/ea735bfb8c9e5b95e6d417dd246ffc59,2025-07-06T18:25:12Z,,The minds and sympathies of Americans and many around the world are with the people of Texas this weekend. Heavy flooding has led to dozens of casualties as authorities work to assess the extent of t… [+1981 chars],,en,'flooding'
https://www.cbssports.com/nfl/news/dallas-cowboys-houston-texans-nfl-pool-together-donations-for-texas-flooding-recovery-efforts/,https://www.cbssports.com/nfl/news/dallas-cowboys-houston-texans-nfl-pool-together-donations-for-texas-flooding-recovery-efforts/,0,www.cbssports.com,"Dallas Cowboys, Houston Texans, NFL pool together donations for Texas flooding recovery efforts",At least 70 are dead after devastating floods ravaged central Texas,https://sportshub.cbsistatic.com/i/r/2025/07/06/3ad42cad-93a6-4657-9526-c3d701174efb/thumbnail/1200x675/6df6f0b850368d93410a40c09194e3db/usatsi-24796502-1.jpg,2025-07-06T18:56:03Z,,"The Dallas Cowboys, Houston Texans and NFL Foundation will combine to make $1.5 million in donations to those impacted by the devastating and deadly floods in central Texas, which thus far have kille… [+2281 chars]",,en,'flooding donation'
https://www.npr.org/sections/the-picture-show/2025/07/06/g-s1-76298/video-timelapse-texas-llano-river-flood-minutes,https://www.npr.org/sections/the-picture-show/2025/07/06/g-s1-76298/video-timelapse-texas-llano-river-flood-minutes,0,www.npr.org,Video: Timelapse Shows Texas' Llano River Completely Flood in Just Minutes,Timelapse video shows authorities blocking off a low water crossing over the Llano River in Kingsland just before flash flooding completely inundated the area in just 10 minutes.,https://npr.brightspotcdn.com/dims3/default/strip/false/crop/1920x1080+0+0/resize/1400/quality/100/format/png/?url=http%3A%2F%2Fnpr-brightspot.s3.amazonaws.com%2F01%2Ff6%2Fa3cf274d4081989cc89f5d86a0cf%2Fstoryful-326677-timelapse-shows-texas-llano-river-completely-flood-in-just-minutes-tm-2.png,2025-07-06T19:46:45Z,,"Credit: Robert Ivey via Storyful
The Llano River swelled with floodwater in Llano County, Texas, on July 4, as heavy rain and deadly flooding hit the state's Hill Country area.
Timelapse video capt… [+523 chars]",,en,'flooding area'
https://thespun.com/nfl/dallas-cowboys-announce-donation-following-texas-flooding,https://thespun.com/nfl/dallas-cowboys-announce-donation-following-texas-flooding,0,thespun.com,Dallas Cowboys Announce Donation Following Texas Flooding,The Dallas Cowboys announced on Sunday an official donation following the flash flooding that took place in Texas over the weekend. Heavy flash flooding took...,https://media.zenfs.com/en/the_spun_articles_751/0c9efdfa6445a38606782169d0fa2ec9,2025-07-06T20:13:35Z,,"Dallas Cowboys Announce Donation Following Texas Flooding originally appeared on The Spun.
The Dallas Cowboys announced on Sunday an official donation following the flash flooding that took place in… [+1962 chars]",,en,'flooding'
https://www.salon.com/2025/07/06/70-dead-12-campers-missing-in-tx-floods-time-is-critical/,https://www.salon.com/2025/07/06/70-dead-12-campers-missing-in-tx-floods-time-is-critical/,0,www.salon.com,"70 dead, 12 campers missing in Texas floods: “Time is critical”","70 dead, 12 missing after flash floods swept through Texas Hill Country, including young girls from summer camp",https://www.salon.com/app/uploads/2025/07/GettyImages-2223000728.jpg,2025-07-06T20:30:34Z,,"The death toll from catastrophic flash flooding in Texas Hill Country climbed to 70 on Sunday, as rescue teams continued searching for more than a dozen missing people including 11 girls and a camp c… [+2008 chars]",,en,'floods'
https://consent.yahoo.com/v2/collectConsent?sessionId=1_cc-session_93a936ea-37fc-4d80-aa81-d9616e958ebb,https://consent.yahoo.com/v2/collectConsent?sessionId=1_cc-session_93a936ea-37fc-4d80-aa81-d9616e958ebb,0,consent.yahoo.com,Flash floods like the one that swept through Texas are the nation’s top storm-related killer,,,2025-07-06T20:45:29Z,,"If you click 'Accept all', we and our partners, including 237 who are part of the IAB Transparency &amp; Consent Framework, will also store and/or access information on a device (in other words, use … [+714 chars]",,en,'floods'
https://www.newsweek.com/flash-floods-prompt-evacuation-responders-near-deadly-texas-flood-site-2095232,https://www.newsweek.com/flash-floods-prompt-evacuation-responders-near-deadly-texas-flood-site-2095232,0,www.newsweek.com,Flash Floods Prompt Evacuation of Responders Near Deadly Texas Flood Site,At least 68 people are dead in Kerr county following the flash flooding Friday.,https://d.newsweek.com/en/full/2677757/texas-flooding-damage.jpg,2025-07-06T21:37:26Z,,"As the search continues for multiple missing people, including at least 11 girls from Camp Mystic, a new round of rain has prompted more evacuations.
""FLASH FLOOD WARNING in effect for the Kerr Coun… [+1356 chars]",,en,'floods'
https://www.usmagazine.com/celebrity-news/news/shakira-donates-show-proceeds-to-texas-flood-victims/#article,https://www.usmagazine.com/celebrity-news/news/shakira-donates-show-proceeds-to-texas-flood-victims/#article,0,www.usmagazine.com,Shakira Donates Portion of Show Proceeds to Victims of Deadly Texas Floods,"Shakira is reaching out to help the victims of and families devastated by the ongoing floods in central Texas. “Dear San Antonio, Our hearts and prayers are with those affected by the flood in Central Texas,” Shakira wrote on X on Saturday, July 5. “We are do…",https://www.usmagazine.com/wp-content/uploads/2025/07/shakira-2218999784.jpg?crop=0px%2C331px%2C2460px%2C1292px&resize=1200%2C630&quality=40&strip=all,2025-07-06T21:39:54Z,,"Shakira is reaching out to help the victims of and families devastated by the ongoing floods in central Texas.
“Dear San Antonio, Our hearts and prayers are with those affected by the flood in Centr… [+2629 chars]",,en,'floods'
https://www.nbcnews.com/news/us-news/weekend-rundown-july-6-rcna217034,https://www.nbcnews.com/news/us-news/weekend-rundown-july-6-rcna217034,0,www.nbcnews.com,Here's the biggest news you missed this weekend,"Catastrophic flooding struck central Texas on Friday, causing a surge of 20 to 26 feet on the Guadalupe River near Kerrville, leading to widespread damage and washing out roads","https://media-cldnry.s-nbcnews.com/image/upload/t_nbcnews-fp-1200-630,f_auto,q_auto:best/rockcms/2025-07/250706-texas-flooding-vl-218p-c67861.jpg",2025-07-06T22:00:00Z,,"Catastrophic flooding struck central Texas on Friday, causing a surge of 20 to 26 feet on the Guadalupe River near Kerrville, leading to widespread damage and washing out roads.
Dozens of people wer… [+7386 chars]",,en,'flooding'
https://www.npr.org/2025/07/06/nx-s1-5458512/texas-flash-flood-weather-forecast,https://www.npr.org/2025/07/06/nx-s1-5458512/texas-flash-flood-weather-forecast,0,www.npr.org,How good was the forecast? Texas officials and the National Weather Service disagree,"As searchers continue to look for victims in the deadly flash flooding in Texas, officials are answering questions about the weather forecasts ahead of and during the storm.",https://npr.brightspotcdn.com/dims3/default/strip/false/crop/3000x1688+0+199/resize/1400/quality/100/format/jpeg/?url=http%3A%2F%2Fnpr-brightspot.s3.amazonaws.com%2F90%2F92%2F209abac34b668ee202c419d649ad%2Fgettyimages-2222953014.jpg,2025-07-06T22:06:49Z,,"As early as Wednesday, Texas officials were marshalling the state's emergency response resources to prepare for the coming storm
.
By Thursday afternoon, the National Weather Service's Austin/San A… [+6407 chars]",,en,'flooding'
https://www.businessinsider.com/consumer-drones-interfere-rescue-operations-texas-floods-la-wildfires-helene-2025-7,https://www.businessinsider.com/consumer-drones-interfere-rescue-operations-texas-floods-la-wildfires-helene-2025-7,0,www.businessinsider.com,"From the Texas floods to the LA fires, consumer drones keep getting in the way of rescue operations",Texas officials say private drones are interfering with flood rescue. This isn't the first time personal drones have caused issues during emergencies.,https://i.insider.com/686ae32c85e81483682d6f40?width=1200&format=jpeg,2025-07-06T22:25:35Z,,"Search and rescue operations continue in central Texas, where catastrophic flooding has killed at least 69 people. Dozens are still missing.
During a Sunday press conference, after the usual updates… [+5013 chars]",,en,'floods'
https://economictimes.indiatimes.com/news/international/uae/uae-expresses-solidarity-with-us-after-texas-flash-floods-kill-over-60-including-children/articleshow/122285208.cms,https://economictimes.indiatimes.com/news/international/uae/uae-expresses-solidarity-with-us-after-texas-flash-floods-kill-over-60-including-children/articleshow/122285208.cms,0,economictimes.indiatimes.com,"UAE expresses solidarity with US after Texas flash floods kill over 60, including children","The UAE has expressed solidarity with the United States following the devastating floods in Texas, which have claimed at least 69 lives, including 21 children. The UAE offered condolences to the victims' families and support for those affected by the ""heartbr…","https://img.etimg.com/thumb/msid-122285288,width-1200,height-630,imgsize-604518,overlay-economictimes/articleshow.jpg",2025-07-06T22:44:27Z,,"As devastating floods batter Texas, leaving dozens dead, others missing, and causing extensive damage, the United Arab Emirates expressed its solidarity with the United States for the victims. The Mi… [+1922 chars]",,en,'flooding solidarity'
https://www.npr.org/2025/07/06/nx-s1-5458514/texas-flooding-search-rescue-efforts,https://www.npr.org/2025/07/06/nx-s1-5458514/texas-flooding-search-rescue-efforts,0,www.npr.org,Texas officials race to find survivors after devastating floods,"At least 78 people are reported dead after flooding over the weekend. Meanwhile, residents are advised to be cautious over the next 24 to 48 hours as more rain threatens the area.",https://npr.brightspotcdn.com/dims3/default/strip/false/crop/8256x4644+0+430/resize/1400/quality/100/format/jpeg/?url=http%3A%2F%2Fnpr-brightspot.s3.amazonaws.com%2Fce%2F15%2F1a0c97e84a808ec5784aa7af53ea%2Fgettyimages-2223219906.jpg,2025-07-06T23:13:38Z,,"Officials in Central Texas are desperately searching for survivors after a flash flood on Friday left at least 78 people dead and dozens unaccounted for, including many children.
More than 850 peopl… [+2982 chars]",,en,'flooding'
https://www.bbc.com/news/articles/cddzrj323zzo,https://www.bbc.com/news/articles/cddzrj323zzo,0,www.bbc.com,At least 78 dead and dozens missing in Texas floods as more rain looms,"Forecasts of continued heavy rain and thunderstorms are raising concerns, as rising water levels could further hamper rescue efforts, officials say.",https://ichef.bbci.co.uk/news/1024/branded_news/c48f/live/325c5e20-5ab5-11f0-a090-757f18d89a96.jpg,2025-07-06T23:28:39Z,,"At least 78 people have been confirmed dead in central Texas and another 41 are missing following flash floods on Friday.
Sixty-eight of the fatalities, including 28 children, occurred in Kerr Count… [+3623 chars]",,en,'floods'
https://consent.yahoo.com/v2/collectConsent?sessionId=1_cc-session_adc71cb6-e169-41eb-8f95-6c9d76ee3bae,https://consent.yahoo.com/v2/collectConsent?sessionId=1_cc-session_adc71cb6-e169-41eb-8f95-6c9d76ee3bae,0,consent.yahoo.com,Texas high school says Camp Mystic counselor was among those killed in flooding,,,2025-07-07T00:17:00Z,,"If you click 'Accept all', we and our partners, including 237 who are part of the IAB Transparency &amp; Consent Framework, will also store and/or access information on a device (in other words, use … [+714 chars]",,en,'flooding'
https://www.newsweek.com/sports/nfl/dallas-cowboys-lend-helping-hand-amid-texas-tragedy-2095251,https://www.newsweek.com/sports/nfl/dallas-cowboys-lend-helping-hand-amid-texas-tragedy-2095251,0,www.newsweek.com,Dallas Cowboys Lend Helping Hand Amid Texas Tragedy,"As parts of Texas continue to recover from severe flooding, the Dallas Cowboys are doing their part by offering a sizable donation for relief efforts.",https://d.newsweek.com/en/full/2574425/cowboys-owner-jerry-jones.jpg,2025-07-07T00:19:09Z,,"As one of the most iconic franchises in all of sports, the Dallas Cowboys have deep roots in the Texas community. Following a recent weather disaster in the area, the organization has decided to step… [+2716 chars]",,en,'flooding donation'
https://abcnews.go.com/US/camp-mystic-counselor-died-texas-flooding-remembered-loyal/story?id=123524812,https://abcnews.go.com/US/camp-mystic-counselor-died-texas-flooding-remembered-loyal/story?id=123524812,0,abcnews.go.com,Camp Mystic counselor who died in Texas flooding remembered as 'loyal and beloved',"Chloe Childress, a counselor at Camp Mystic, died during the flooding in Hunt, Texas, according to a representative of her high school.",https://i.abcnewsfe.com/a/403b0c02-8ad1-4056-ac90-4623b5d49e43/camp_1751847099456_hpMain_16x9.jpg?w=1600,2025-07-07T00:24:40Z,,"Chloe Childress, a counselor at Camp Mystic, was killed during the devastating flooding in Hunt, Texas, over the holiday weekend, according to a representative of her high school.
She graduated from… [+1932 chars]",,en,'flooding'
https://www.justjared.com/2025/07/06/shakira-donates-portion-of-concert-proceeds-to-victims-families-of-deadly-texas-floods/,https://www.justjared.com/2025/07/06/shakira-donates-portion-of-concert-proceeds-to-victims-families-of-deadly-texas-floods/,0,www.justjared.com,Shakira Donates Portion of Concert Proceeds to Victims & Families of Deadly Texas Floods,"Shakira is giving back to those affected by the deadly floods in Texas. Over the holiday weekend, at least 70 people have died after flash floods took over Texas Hill Country. The flooding happened after the Guadalupe River broke its banks following a period …",https://cdn01.justjared.com/wp-content/uploads/headlines/2025/07/shakira-texas-floods.jpg,2025-07-07T00:42:40Z,,"Shakira is giving back to those affected by the deadly floods in Texas.
Over the holiday weekend, at least 70 people have died after flash floods took over Texas Hill Country. The flooding happened … [+1301 chars]",,en,'floods'
https://economictimes.indiatimes.com/news/india/india-weather-today-uttarakhand-landslide-alert-gujarat-flood-risk-in-focus-check-imds-forecast-for-your-city/articleshow/122287027.cms,https://economictimes.indiatimes.com/news/india/india-weather-today-uttarakhand-landslide-alert-gujarat-flood-risk-in-focus-check-imds-forecast-for-your-city/articleshow/122287027.cms,0,economictimes.indiatimes.com,"India Weather Today: Uttarakhand landslide alert, Gujarat flood risk in focus; check IMD's forecast for your city","India faces intensified monsoon conditions, prompting the IMD to issue alerts for landslides in Uttarakhand and severe flooding in Gujarat. Konkan, Goa, and Maharashtra Ghat regions brace for extremely heavy rainfall, increasing risks of slope failures and ur‚Ä¶","https://img.etimg.com/thumb/msid-122287067,width-1200,height-630,imgsize-62332,overlay-economictimes/articleshow.jpg",2025-07-07T02:03:54Z,,"As monsoon intensifies across India, the India Meteorological Department (IMD) and allied agencies have issued multiple weather alerts ranging from landslides in the Himalayas to urban flooding in we‚Ä¶ [+4160 chars]",,en,'flooding'
https://www.aljazeera.com/news/2025/7/7/death-toll-from-texas-floods-rises-to-82-dozens-still-missing,https://www.aljazeera.com/news/2025/7/7/death-toll-from-texas-floods-rises-to-82-dozens-still-missing,0,www.aljazeera.com,"Death toll from Texas floods rises to 82, dozens still missing",At least 41 people still missing as officials face questions about why warnings did not reach hard-hit Kerr County.,https://www.aljazeera.com/wp-content/uploads/2025/07/AP25188055264865-1751852674.jpg?resize=1200%2C675,2025-07-07T04:24:39Z,,"The death toll from the catastrophic floods that hit the state of Texas in the United States has risen to 82, as the search for the missing continues and officials face questions over a failure to ev… [+5147 chars]",,en,'floods'
https://nypost.com/2025/07/07/entertainment/matthew-mcconaughey-speaks-out-about-the-devastating-floods-that-ravaged-his-home-state-of-texas/?utm_source=yahoo&amp;utm_campaign=nypost&amp;utm_medium=referral,https://nypost.com/2025/07/07/entertainment/matthew-mcconaughey-speaks-out-about-the-devastating-floods-that-ravaged-his-home-state-of-texas/?utm_source=yahoo&amp;utm_campaign=nypost&amp;utm_medium=referral,0,nypost.com,Matthew McConaughey speaks out about the devastating floods that ravaged his home state of Texas: ‘A long road ahead’,"Matthew McConaughey is pleading with fans to “lend a helping hand” after the catastrophic floods ravaged his home state of Texas, killing dozens of people.",https://s.yimg.com/ny/api/res/1.2/WTgbxNRiHaWmGXT3K61MIQ--/YXBwaWQ9aGlnaGxhbmRlcjt3PTEyMDA7aD04MDA7Y2Y9d2VicA--/https://media.zenfs.com/en/ny_post_articles_869/c8fae77739b60f36dbddaa4047bd9363,2025-07-07T04:54:37Z,,"Matthew McConaughey is pleading with fans to lend a helping hand after the catastrophic floods ravaged his home state of Texas, killing dozens of people.
At least 70 lives have been lost, many more … [+3067 chars]",,en,'flooding relief'
https://www.dumblittleman.com/texas-flooding-2025/,https://www.dumblittleman.com/texas-flooding-2025/,0,www.dumblittleman.com,Texas Flooding: Death Toll Rises to 82 as Search Continues for Missing Campers,"Central Texas is reeling from one of the deadliest flash floods in state history, with at least 82 confirmed deaths and more than 40 individuals still missing as of Monday evening. The devastating Texas flooding, which began over the July 4th weekend, has ove…",https://www.dumblittleman.com/wp-content/uploads/2025/07/381.jpg,2025-07-07T05:34:35Z,,"Central Texas is reeling from one of the deadliest flash floods in state history, with at least 82 confirmed deaths and more than 40 individuals still missing as of Monday evening. The devastating Te… [+9275 chars]",,en,'flooding'
https://www.yahoo.com/news/death-toll-rises-texas-floods-054336685.html,https://www.yahoo.com/news/death-toll-rises-texas-floods-054336685.html,0,www.yahoo.com,"Death toll rises in Texas floods, Trump plans visit","STORY: The death toll from devastating floods in Texas reached at least 78 on Sunday, including 28 children.Among the worst impacts were felt at Camp Mystic,...",https://media.zenfs.com/en/video.reutersnews.com/f941d6b06b3b58be8975fadfe1511307,2025-07-07T05:43:36Z,,"STORY: The death toll from devastating floods in Texas reached at least 78 on Sunday, including 28 children.
Among the worst impacts were felt at Camp Mystic, a nearly century-old Christian girls ca… [+2598 chars]",,en,'floods'
https://thehillstimes.in/northeast/three-dead-as-floods-and-electrocutions-devastate-dimapur-and-kohima,https://thehillstimes.in/northeast/three-dead-as-floods-and-electrocutions-devastate-dimapur-and-kohima,0,thehillstimes.in,Three Dead as Floods and Electrocutions Devastate Dimapur and Kohima,"HT DIGITAL KOHIMA, JULY 7: Continuous rain over the weekend has dipped Dimapur and areas of Kohima in Nagaland into a state of crisis, with many areas under water and citizens compelled to live in unsafe and disorganized conditions. Not only did the continuou‚Ä¶",https://thehillstimes.in/wp-content/uploads/2024/07/668cd89449604-assam-floods-brahmaputra-water-levels-recede-informs-himanta-biswa-sarma-092835263-16x9-1.jpg,2025-07-07T05:54:15Z,,"HT DIGITAL
KOHIMA, JULY 7: Continuous rain over the weekend has dipped Dimapur and areas of Kohima in Nagaland into a state of crisis, with many areas under water and citizens compelled to live in u‚Ä¶ [+3075 chars]",,en,'flooding landslide'
https://www.naturalnews.com/2025-07-07-catastrophic-flooding-in-central-texas-claims-over-50-lives.html,https://www.naturalnews.com/2025-07-07-catastrophic-flooding-in-central-texas-claims-over-50-lives.html,0,www.naturalnews.com,"Catastrophic flooding in central Texas claims over 50 lives, raises questions about weather control","Catastrophic Flooding in Kerr County: Over 50 deaths, including 20 young girls at Camp Mystic, as flooding began early Saturday morning, transforming the South San Gabriel River into a destructive force. Weather Control Speculation: Unusual storm intensity ra…",https://www.naturalnews.com/wp-content/uploads/sites/91/2025/07/2025-07-07-BBN-Texas-flood-catastrophe.jpg,2025-07-07T06:00:00Z,,"<ul><li>Catastrophic Flooding in Kerr County: Over 50 deaths, including 20 young girls at Camp Mystic, as flooding began early Saturday morning, transforming the South San Gabriel River into a destru… [+5791 chars]",,en,'flooding'
https://en.antaranews.com/news/364557/over-30000-affected-by-major-floods-in-indonesias-mataram,https://en.antaranews.com/news/364557/over-30000-affected-by-major-floods-in-indonesias-mataram,0,en.antaranews.com,"Over 30,000 affected by major floods in Indonesia's Mataram","Indonesia&#39;s disaster management agency has reported that 7,676 families, or more than 30,000 people, have been affected by flooding in Mataram City and ...",https://cdn.antaranews.com/cache/1200x800/2025/07/07/1000653197.jpg,2025-07-07T06:46:38Z,,"Mataram (ANTARA) - Indonesia's disaster management agency has reported that 7,676 families, or more than 30,000 people, have been affected by flooding in Mataram City and surrounding areas in West Nu‚Ä¶ [+1595 chars]",,en,'floods'
https://en.protothema.gr/2025/07/07/deadly-flooding-in-texas-nearly-80-dead-fading-hopes-for-10-girls-still-missing/,https://en.protothema.gr/2025/07/07/deadly-flooding-in-texas-nearly-80-dead-fading-hopes-for-10-girls-still-missing/,0,en.protothema.gr,Deadly flooding in Texas: Nearly 80 dead – Fading hopes for 10 girls still missing,"Trump will visit the region on Friday
The post Deadly flooding in Texas: Nearly 80 dead – Fading hopes for 10 girls still missing appeared first on ProtoThema English.",https://en.protothema.gr/wp-content/uploads/2025/07/flash_floods_nn-1.jpg-1.jpg,2025-07-07T07:25:54Z,,"The death toll from the floods that hit the US South state of Texas has now approached 80 dead and is almost certain to keep getting heavier, local authorities said yesterday, as hopes of locating so… [+2696 chars]",,en,'flooding'
https://www.aljazeera.com/video/newsfeed/2025/7/7/timelapse-shows-speed-of-texas-floods,https://www.aljazeera.com/video/newsfeed/2025/7/7/timelapse-shows-speed-of-texas-floods,0,www.aljazeera.com,Timelapse shows speed of Texas floods,"Timelapse video from Texas shows how quickly floodwaters rose in the Llano River, engulfing a road within minutes.",https://www.aljazeera.com/wp-content/uploads/2025/07/image-1751874410.jpg?resize=1920%2C1080&quality=80,2025-07-07T07:47:48Z,,"NewsFeed
Timelapse video from Texas in the US shows how quickly floodwaters rose in the Llano River, engulfing a road within minutes as torrential rain triggered flash flooding that killed dozens of… [+7 chars]",,en,'floods'
