index,published,keyword,domain,language,valid,title,description,url,image,archive,content,quote
755897ddd2c06cc9661c9939f5ebb001,2025-11-06T11:55:13Z,'flooding military',www.nakedcapitalism.com,en,0.1,Links 11/6/2025,"Our tantalizing daily links, including AI bailout groundwork, Senate considers blocking war with Venezuela, Lina Khan joins Mamdani team, and cat belly rubs.",https://www.nakedcapitalism.com/2025/11/links-11-6-2025.html,https://www.nakedcapitalism.com/wp-content/uploads/2025/11/Screenshot-2025-11-05-at-5.12.41 PM-710x1024.png,,"Belly Rubs Gone Dangerously Awry: Why So Many Humans Miss Grumpy Cat Signals StudyFinds
Kentucky woman expecting meds in mail gets box of human hands, fingers instead NBC News
Explosion at Mississi… [+8378 chars]",
28d9dbeeb78a95dcb081561c7a8e32b2,2025-11-06T13:30:00Z,'deluge',www.memeorandum.com,en,1.0,"Meta is earning a fortune on a deluge of fraudulent ads, documents show (Jeff Horwitz/Reuters)","Jeff Horwitz / Reuters:
Meta is earning a fortune on a deluge of fraudulent ads, documents show  —  Meta projected 10% of its 2024 revenue would come from ads for scams and banned goods, documents seen by Reuters show.  And the social media giant internally e…",https://www.memeorandum.com/251106/p17,https://www.reuters.com/resizer/v2/TUJMUVZF2ZGEDCMIBKDBF7VKVU.jpg?auth=3ac56d6a29dc630a09ade5d87f66bde14cefee15131b6c48dcc7eaf5548b10f2&height=1005&width=1920&quality=80&smart=true,,"memeorandum is an auto-generated summary of the stories that US political commentators are discussing online right now.
Unlike sister sites Techmeme and Mediagazer, it is not a human-edited news out… [+72 chars]",
e5165de2f84d58988662f3e8c2508a0f,2025-11-06T13:30:00Z,'tidal surge',www.forbes.com,en,0.1,AC/DC Quietly Pulls Off A Major Chart Comeback,"AC/DC proves its timeless appeal as “Highway to Hell,” “You Shook Me All Night Long,” and “Thunderstruck” all reappear on Billboard charts together.",https://www.forbes.com/sites/hughmcintyre/2025/11/06/acdc-quietly-pulls-off-a-major-chart-comeback/,https://imageio.forbes.com/specials-images/imageserve/685e973370192671c7dd0717/0x0.jpg?format=jpg&height=900&width=1600&fit=bounds,,"AC/DC proves its timeless appeal as Highway to Hell, You Shook Me All Night Long, and Thunderstruck all reappear on Billboard charts together. NASHVILLE, TENNESSEE - MAY 21: Brian Johnson of AC/DC pe… [+3910 chars]",
09f4969635424ec6c8d6e1fcfe5dbeb3,2025-11-06T14:30:42Z,'deluge',economictimes.indiatimes.com,en,1.0,"Meta is earning a fortune on a deluge of fraudulent ads, internal documents show","Internal Meta documents reveal the company projected earning billions from scam ads, failing for years to stop fraudulent schemes targeting users. Despite internal warnings and a high volume of ""higher risk"" ads daily, Meta only bans advertisers with 95% cert…",https://economictimes.indiatimes.com/tech/technology/meta-is-earning-a-fortune-on-a-deluge-of-fraudulent-ads-internal-documents-show/articleshow/125136744.cms,"https://img.etimg.com/thumb/width-1200,height-900,imgsize-56192,resizemode-75,msid-125136744/tech/technology/meta-is-earning-a-fortune-on-a-deluge-of-fraudulent-ads-internal-documents-show.jpg",,"Meta internally projected late last year that it would earn about 10% of its overall annual revenue - or $16 billion - from running advertising for scams and banned goods, internal company documents … [+18143 chars]",
cc32e281023cd3cc5fbfac5532a27f62,2025-11-06T15:00:00Z,'deluge',www.st.ryukoku.ac.jp,en,1.0,"(ョ, 11/7)蚊⒢ 膠潟帥2024綛眼綛顔紕俄蕭1蚊160 ...","(ョ, 11/7)蚊⒢ 膠潟帥2024綛眼綛顔紕俄蕭1蚊160膣500鐚罨冴プ莢❾２胼②❼筝③綺パ羝 d罩ｅ膣.5蚊篋罔礬 ゃパ⒢⒢ e㏍＜─罕 Meta is earning a fortune on a deluge of fraudulent ads, documents show (Reuters, 11/6)トeepL 荐 筝③茵コ＜ソ腓障茘激ケｃ違腴❼茵若ア」潟ーぞ源罩≪⒤激ケ源罨冴茵с絨パ95鐚札筝篋羝紮礙禪⒢ c ス",http://www.st.ryukoku.ac.jp/~kjm/security/memo/2025/11.html#20251107__meta,,,"Last modified: Fri Nov 7 12:35:15 2025
 +0900 (JST)
Security Watch 
Security Watch 
 UNIXWindowsMac OS (priority ) 
1 
 1 
[ ]
:
2024 |
2023 |
2022 |
2021 |
2020 |
2019 |
2018 |
2017 … [+2860 chars]",
82bdc41dd501bda2a0f6367aa61c9e8f,2025-11-06T16:11:20Z,'flooding',www.aljazeera.com,en,1.0,Philippines reeling from deadly floods triggered by Typhoon Kalmaegi,"Heavy flooding in Talisay City, Cebu has destroyed homes after Typhoon Kalmaegi dumped a month’s worth of rain.",https://www.aljazeera.com/video/newsfeed/2025/11/6/philippines-reeling-from-deadly-floods-triggered-by-typhoon-kalmaegi,https://www.aljazeera.com/wp-content/uploads/2025/11/image-1762445467.jpg?resize=1620%2C1080&quality=80,,"NewsFeed
Heavy flooding in Talisay City, Cebu has destroyed homes after Typhoon Kalmaegi dumped a months worth of rain. One person died in a low-income area that evacuated early, while dozens may be… [+95 chars]",
2181c8f436e867d95f69007a22a0c6ee,2025-11-06T20:53:04Z,'deluge',www.vox.com,en,0.1,Welcome to the age of viral police body cam footage,"If you’re arrested in America for a minor charge — say, for speeding or loitering — the punishment from the legal system might end up being the least of your worries. You might wake up a few months later and see your arrest, filmed through a police body camer…",https://www.vox.com/the-highlight/466006/bodycam-youtube-viral-content-police-transparency-policy,https://platform.vox.com/wp-content/uploads/sites/2/2025/10/BodyCams_Highlight_Vox.png?quality=90&strip=all&crop=0%2C10.732984293194%2C100%2C78.534031413613&w=1200,http://web.archive.org/web/20251107151610/https://www.vox.com/the-highlight/466006/bodycam-youtube-viral-content-police-transparency-policy,"If you’re arrested in America for a minor charge — say, for speeding or loitering — the punishment from the legal system might end up being the least of your worries. You might wake up a few months l… [+17346 chars]",
94647f31b4b0a0ea14fff16aed374147,2025-11-07T04:00:25Z,'deluge',www.haaretz.com,en,1.0,Israel's beleaguered AG is the dam holding back Netanyahu's anti-democratic deluge,"After a week of foot-dragging, the attorney general did the right thing and handed over the lead tole in the Sde Teiman leak investigation ■ It's possible to understand why Naftali Bennett refused to speak at the rally marking the 30th anniversary of the assa…",https://www.haaretz.com/israel-news/2025-11-07/ty-article/.premium/israels-beleaguered-ag-is-the-dam-holding-back-netanyahus-anti-democratic-deluge/0000019a-5ab1-d22e-a39b-7ef92cb00000,"https://img.haarets.co.il/bs/0000019a-5ab1-d22e-a39b-7ef92cb00000/bb/f9/2733edc446679a47a4413c462343/649907.jpg?precrop=2400,1395,x0,y155&width=1200&height=630&cmsprod",,"After a week of foot-dragging, the attorney general did the right thing and handed over the lead tole in the Sde Teiman leak investigation It's possible to understand why Naftali Bennett refused to s… [+165 chars]",
00e10ba6df79d5babb9fa69c4198339c,2025-11-07T04:20:25Z,'flooding climate change',www.spacewar.com,en,1.0,AI-generated disinformation tactics spotted ahead of COP30,"Washington (AFP) Nov 6, 2025

 A clip said to show massive flooding in the Amazonian city hosting the UN climate summit is just one widely-shared example of how disinformation, cheaply created by artificial intelligence and circulating on social media, is inf…",https://www.spacewar.com/reports/AI-generated_disinformation_tactics_spotted_ahead_of_COP30_999.html,https://www.spxdaily.com/images-hg/book-burning-climate-textbooks-marker-hg.jpg,,"AI-generated disinformation tactics spotted ahead of COP30by AFP Staff WritersWashington (AFP) Nov 6, 2025
A clip said to show massive flooding in the Amazonian city hosting the UN climate summit is… [+2726 chars]",
6622475adc054b377b5a1c95597eb1be,2025-11-07T05:33:44Z,'flooding damage',abcnews.go.com,en,0.1,Typhoon Kalmaegi kills 5 people in Vietnam as the Philippines prepares for a new storm,"Typhoon Kalmaegi has brought fierce winds and torrential rains to Vietnam, and left at least five people dead and thousands of homes damaged before weakening into a tropical storm",https://abcnews.go.com/Business/wireStory/typhoon-kalmaegi-kills-5-people-vietnam-philippines-prepares-127285098,https://s.abcnews.com/images/US/abc_news_default_2000x2000_update_16x9_992.jpg,http://web.archive.org/web/20251108043748/https://abcnews.go.com/Business/wireStory/typhoon-kalmaegi-kills-5-people-vietnam-philippines-prepares-127285098,"DAK LAK, Vietnam -- DAK LAK, Vietnam (AP) Typhoon Kalmaegi brought fierce winds and torrential rains to Vietnam on Friday, killing at least five people and leaving widespread damage across the countr… [+3508 chars]",
9438b36fb018aedc4fcaab569e83a473,2025-11-07T05:41:35Z,'flooding',abcnews.go.com,en,1.0,Crews are working to fix Alaska Native villages devastated by flooding. But will residents return?,Crews are working to repair remote Alaska Native villages that were devastated by the remnants of a typhoon last month,https://abcnews.go.com/US/wireStory/crews-working-fix-alaska-native-villages-devastated-flooding-127284637,https://i.abcnewsfe.com/a/05cc47fa-a117-43b8-a4fc-564048857ee8/wirestory_b741508b131c3a4944a814b0ca45ac6e_16x9.jpg?w=1600,,"KWIGILLINGOK, Alaska -- Darrel John watched the final evacuees depart his village on the western coast of Alaska in helicopters and small planes and walked home, avoiding the debris piled on the boar… [+7545 chars]",
2ecee9ba034ef1897de9b015cdf3fd6a,2025-11-07T05:52:00Z,'flooding damage',www.seattlepi.com,en,0.1,Typhoon Kalmaegi kills 5 people in Vietnam as the Philippines prepares for a new storm,"Typhoon Kalmaegi has brought fierce winds and torrential rains to Vietnam, and left at least five people dead and thousands of homes damaged before weakening into a tropical storm. The storm moved into Cambodia on Friday. Authorities also say three people are…",https://www.seattlepi.com/news/world/article/typhoon-kalmaegi-kills-5-people-in-vietnam-as-the-21144887.php,https://s.hdnux.com/photos/01/55/03/44/28588301/3/rawImage.jpg,,"A man walks past an uprooted tree in Dak Lak, Vietnam, on Friday, Nov. 7, 2025 after Typhoon Kalmaegi lashed the country with fierce winds and torrential rains. (Tuong Quan/VNA via AP)
Tuong Quan/AP… [+4438 chars]",
b9a3b009a85e50f961160abddbba77bc,2025-11-07T05:52:03Z,'flooding damage',www.hurriyetdailynews.com,en,0.1,"Deadly Typhoon Kalmaegi ravages Vietnam, Philippines","Typhoon Kalmaegi churned across Vietnam early Friday, claiming five more lives after its devastating passage through the Philippines where the death toll rose to 188.",https://www.hurriyetdailynews.com/deadly-typhoon-kalmaegi-ravages-vietnam-philippines-215468,https://image.hurimg.com/i/hurriyet/75/200x200/690d88fbe26df636fe3dea3c.jpg,,"GIA LAI, Vietnam
A man picks up debris in Quy Nhon in Gia Lai province, central Vietnam on Nov. 7, 2025.
TyphoonKalmaegi churned across Vietnam early Friday, claiming five more lives after its deva… [+3274 chars]",
f9e8080685fca6867bf8926a3e8bcbaa,2025-11-07T05:52:55Z,'flooding damage',www.aljazeera.com,en,0.1,At least 5 killed as Typhoon Kalmaegi slams into Vietnam,Vietnamese state media report extensive damage in central provinces and power outages for 1.2 million people.,https://www.aljazeera.com/news/2025/11/7/at-least-5-killed-as-typhoon-kalmaegi-slams-into-vietnam,https://www.aljazeera.com/wp-content/uploads/2025/11/AFP__20251107__83C62YR__v2__HighRes__TopshotVietnamPhilippinesTyphoonFloodEnvironmen-1762491061.jpg?resize=1920%2C1440,,"Typhoon Kalmaegi has killed at least five people in Vietnam after slamming into its central and highland provinces, according to Vietnamese state media.
Kalmaegi made landfall in central Vietnam on … [+1759 chars]",
2d1d39a61b098d9aab6c5894f879f807,2025-11-07T06:00:00Z,'tidal surge',www.naturalnews.com,en,0.1,"Tech layoffs surge to 33,281 in October as AI and economic fears trigger historic job cuts","U.S. employers announced 153,074 job cuts in October, the highest for that month in more than two decades. The technology sector is experiencing a brutal correction, with more than 33,000 layoffs in October. Corporate cost-cutting, AI adoption, and softening …",https://www.naturalnews.com/2025-11-07-tech-layoffs-surge-ai-historic-job-cuts.html,https://www.naturalnews.com/wp-content/uploads/sites/91/2025/11/Business-Call-Center-Office-Computers-Meeting.jpg,,"<ul><li>U.S. employers announced 153,074 job cuts in October, the highest for that month in more than two decades.</li><li>The technology sector is experiencing a brutal correction, with more than 33… [+5673 chars]",
b26a53ba17c5a69b1cf8f3ea0f47dadb,2025-11-07T07:44:41Z,'flooding damage',www.globalsecurity.org,en,0.1,Battlefields to wastelands: UN warns conflicts are destroying ecosystems worldwide,"From Gaza to Ukraine and beyond, conflict has caused widespread death and destruction, but it has also devastated natural resources such as water systems, farmland and forests.",https://www.globalsecurity.org/military/library/news/2025/11/mil-251106-unnews01.htm,,,"6 November 2025 - From Gaza to Ukraine and beyond, conflict has caused widespread death and destruction, but it has also devastated natural resources such as water systems, farmland and forests. 
Th… [+4717 chars]",
bdabb2756cf986a84ed011584ab0b78c,2025-11-07T09:00:00Z,'flooding storm',www.yahoo.com,en,1.0,Scientists issue dire warning as iconic American city sinks into the sea: 'Human intervention has made it worse',New Orleans was already vulnerable to flooding and storm surges.,https://www.yahoo.com/news/scientists-issue-dire-warning-iconic-121531478.html,https://s.yimg.com/ny/api/res/1.2/UU2lvFRErej9JJSK1jDERg--/YXBwaWQ9aGlnaGxhbmRlcjt3PTEyMDA7aD02NzY7Y2Y9d2VicA--/https://media.zenfs.com/en/the_cool_down_737/a9f2221df445661ee54ab50171bd62cf,,"One of the country's most unique cities, known for its cuisine and colorful culture, is not only sinking, but it is also being engulfed by rising seas.
What's happening?
New Orleans rightfully boas… [+3128 chars]",
11de05a06a745a40869a348dc51dd9b8,2025-11-07T09:30:00Z,'flooding damage',grist.org,en,0.1,"After Hurricane Melissa, Jamaica’s climate resilience plan faces its biggest test yet","Jamaica's $150 million “catastrophe bond” will help hurricane recovery, but experts hope financial markets will invest more in adaptation.",https://grist.org/extreme-weather/jamaica-catastrophe-bond-hurricane-melissa/,https://grist.org/wp-content/uploads/2025/11/Hurricane-Melissa-Black-River.jpg?quality=75&strip=all,,"Trelawney Parish sits in a rural, agricultural region of Western Jamaica that borders the countrys largest contiguous rainforest. Under normal circumstances, the parish is relentlessly green covered … [+8147 chars]",
38cd6ca2f8910128047cf91adfa99752,2025-11-07T09:52:58Z,'flooding damage',www.cbc.ca,en,0.1,Typhoon Kalmaegi brings rain and destruction to Vietnam as death toll nears 190 in Philippines,"At least five people died in Vietnam after Typhoon Kalmaegi pummelled coastal regions with destructive winds and heavy rain, officials said on Friday, following the storm's deadly passage through the Philippines where it killed at least 188 people.",https://www.cbc.ca/news/world/typhoon-kalmegai-friday-9.6970507,"https://i.cbc.ca/ais/2a612588-68c6-4cda-b610-68b1654f201c,1762513039611/full/max/0/default.jpg?im=Crop%2Crect%3D%280%2C92%2C1600%2C900%29%3BResize%3D620",,"At least five people died in Vietnam after Typhoon Kalmaegi pummelled coastal regions with destructive winds and heavy rain, officials said on Friday, following the storm's deadly passage through the… [+2745 chars]",
7c3561ff1ca1dd9624104aebdb16d19e,2025-11-07T11:52:26Z,'flooding insurance',www.ibtimes.com,en,1.0,A$AP Rocky Sued for $1M After Leak From His New York Condo Causes Major Damage,A$AP Rocky is being sued for $1 million after a leak from his Manhattan condo allegedly caused major flooding and forced his downstairs neighbor out of their home.,https://www.ibtimes.com/ap-rocky-sued-1m-after-leak-his-new-york-condo-causes-major-damage-3789866,https://d.ibtimes.com/en/full/4633385/ap-rockys-friend-testifies-that-hollywood-shooting-involved-fake-gun.jpg,,"A$AP Rocky is facing a $1 million lawsuit from his downstairs neighbor, who claims a massive water leak from the rapper's Manhattan condo caused ""catastrophic"" damage and forced them out of their hom… [+2402 chars]",
b60248f531570a9ac15f7df653532081,2025-11-07T12:01:08Z,'flooding damage',www.ibtimes.com,en,0.1,Super Typhoon Philippines Uwan Landfall: Citizens Asked To Brace - Could This Be The Strongest Storm Of The Year?,"Typhoon Uwan rapidly strengthens as it approaches the Philippines, prompting warnings of destructive winds, heavy rainfall, and possible life-threatening conditions.",https://www.ibtimes.com/super-typhoon-philippines-uwan-landfall-citizens-asked-brace-could-this-strongest-storm-3789853,https://d.ibtimes.com/en/full/4615877/waves-generated-typhoon-podul-break-along-coast-taiwans-taitung-county.jpg,,"A powerful weather system is bearing down on the Philippines, with forecasters warning that Typhoon Uwan could become one of the most destructive storms of the year.
The storm, currently named Fung-… [+3902 chars]",
0e482d24246acd51b534e4bcdc7a5049,2025-11-07T14:30:00Z,'flooding damage',www.theatlantic.com,en,0.1,"Photos of the Week: Dinosaur Sweater, Miniature Park, Hippo Calf","The aftermath of Typhoon Kalmaegi in the Philippines, Day of the Dead celebrations in Mexico, a penny-farthing race in Prague, a mayoral election in New York City, and much more",https://www.theatlantic.com/photography/2025/11/photos-of-the-week/684834/,https://cdn.theatlantic.com/thumbor/3lhlTbsBNQ2WOvpFqi6KaSrlVms=/1x334:7440x4209/1200x625/media/img/mt/2025/11/a01_G_2245355778/original.jpg,http://web.archive.org/web/20251107180259/https://www.theatlantic.com/photography/2025/11/photos-of-the-week/684834/,"Andrew Harnik / Getty
President Donald Trump stands by as attendees help a guest after he collapsed during an event on lowering drug prices in the Oval Office, at the White House, in Washington, D.C… [+4970 chars]",
fe0c9dead15862a0c1caa779971919fa,2025-11-07T15:30:00Z,'flooding military',www.salon.com,en,0.1,Cori Bush on midterms: “Woke isn’t dead — woke is fighting”,"The former Missouri congresswoman, seeking to return to Washington, argues progressives are built for this moment",https://www.salon.com/2025/11/07/cori-bush-on-midterms-woke-isnt-dead-woke-is-fighting/,https://www.salon.com/app/uploads/2025/11/cori-bush-GettyImages-2165078079.jpg,,"Former Rep. Cori Bush, D-Mo., announced a bid to return to Congress last month after special interests ousted her last year in one of the most expensive primary elections ever. In the 2026 campaign, … [+6628 chars]",
a9126e237fb605b637a694cb0e3ef9c1,2025-11-07T16:04:09Z,'flooding',www.androidauthority.com,en,0.9,"After devastating typhoon, one phone survived flooding and three days in the mud","After being lucky to escape, one user in the Philippines found their phone had also survived Typhoon Kalmaegi’s devastating impact.",https://www.androidauthority.com/phone-survived-typhoon-3613975/,https://www.androidauthority.com/wp-content/uploads/2025/11/iPhone-17-Pro-Max-After-Flood-Feature-scaled.jpg,,<ul><li>A Philippines resident says their phone survived floodwaters and three days buried in mud after Typhoon Kalmaegi destroyed their home.</li><li>The iPhone 17 Pro Max worked fine after charging… [+2410 chars],
44d64d1e9148d823044b9dcc4ea734d0,2025-11-07T18:00:00Z,'flooding damage',matadornetwork.com,en,0.1,There’s Nothing Like Fall in the Smokies. Here’s Where to Start.,"From changing leaves to orchards, nothing beats the Great Smoky Mountains in the fall. Haywood County, NC, is your gateway.",https://matadornetwork.com/read/great-smoky-mountains-fall/,https://cdn1.matadornetwork.com/blogs/1/2025/11/shutterstock_1858046053-social.jpg,,"I was fortunate to visit Haywood County in early October when fall’s first whispers were starting to tinge treetops, and notes of crimson were beginning to light up the Blue Ridge Parkway. One year p… [+10665 chars]",
1053d831d18e9c34bb9f007b997e8e24,2025-11-07T18:37:27Z,'flooding',www.bostonherald.com,en,1.0,Crews are working to fix Alaska Native villages devastated by flooding. But will residents return?,A few communities imperiled by human-caused global warming have taken steps to relocate.,https://www.bostonherald.com/2025/11/07/alaska-typhoon-aftermath/,https://www.bostonherald.com/wp-content/uploads/2025/11/Alaska_Typhoon_Aftermath_88273-1.jpg?w=1024&h=682,,"By MARK THIESSEN, GENE JOHNSON and BECKY BOHRER
KWIGILLINGOK, Alaska (AP) Darrel John watched the final evacuees depart his village on the western coast of Alaska in helicopters and small planes and… [+8711 chars]",
4008d9fd3cbeddc04254008a5b9964be,2025-11-07T19:01:05Z,'flooding damage',www.bostonherald.com,en,0.1,Typhoon Kalmaegi rampages across Vietnam as the Philippines prepares for a new storm,The storm moved into Cambodia later on Friday.,https://www.bostonherald.com/2025/11/07/typhoon-kalmaegi-vietnam-deaths/,https://www.bostonherald.com/wp-content/uploads/2025/11/Vietnam-Typhoon_Extreme_Weather_12819-1-1.jpg?w=1024&h=683,,"By ANIRUDDHA GHOSAL and JIM GOMEZ, Associated Press
DAK LAK, Vietnam (AP) Typhoon Kalmaegi brought fierce winds and torrential rains to Vietnam on Friday, killing at least five people, flattening ho… [+5039 chars]",
3de52985de20f457b354cddd2aa5196e,2025-11-07T19:18:02Z,'flooding damage',reason.com,en,0.1,Short Circuit: An inexhaustive weekly compendium of rulings from the federal courts of appeal,"Non-condensing furnaces, drag shows, and master accounts.",https://reason.com/volokh/2025/11/07/short-circuit-an-inexhaustive-weekly-compendium-of-rulings-from-the-federal-courts-of-appeal-33/,https://d2eehagpk5cl65.cloudfront.net/img/q60/uploads/2021/11/reason-logo-featured-placeholder.jpg.webp,,"Please enjoy the latest edition of Short Circuit, a weekly feature written by a bunch of people at the Institute for Justice.
Friends, Indiana law requires prosecutors to produce detailed reports doc… [+10733 chars]",
243b0459fad5a4fb50966f84d4b4bf03,2025-11-07T20:04:54Z,'flooding damage',www.abc.net.au,en,0.1,More storms for Queensland's south amid unsettled weather across state,"Storms are expected across a large part of inland Queensland, with the Darling Downs region set to cop another weekend of severe weather.",https://www.abc.net.au/news/2025-11-08/storms-severe-weather-expected-inland-queensland/105984372,https://live-production.wcms.abc-cdn.net.au/5c875561c109cf0911806dcdd7c47dc6?impolicy=wcms_watermark_news&cropH=528&cropW=939&xPos=22&yPos=0&width=862&height=485&imformat=generic,,"Storms are expected across a large part of inland Queensland today, with the Darling Downs region set to cop another weekend of severe weather.
The Bureau of Meteorology (BOM) said unsettled weather… [+2035 chars]",
30cb6dcd0d4c6f26ac5762d0dc6b9787,2025-11-07T20:30:03Z,'deluge',sneakernews.com,en,1.0,AVAVAV’s Subversive Streak Shines On adidas Holiday 2025 Capsule,"It may not make an end-of-year list, but hopefully the AVAVAV x adidas partnership sticks around in fans’ memories of 2025. Amid a true deluge...

© Sneaker News, 2025. |
Permalink
|
No comment
|
Add todel.icio.us


The post AVAVAV's Subversive Streak Shines …",https://sneakernews.com/2025/11/07/avavav-adidas-holiday-2025/,https://sneakernews.com/wp-content/uploads/2025/11/avavav-adidas-holiday-2025.jpg,,"It may not make an end-of-year list, but hopefully the AVAVAV x adidas partnership sticks around in fans’ memories of 2025. Amid a true deluge of colorways for the adidas Superstar as the Three Strip… [+1515 chars]",
8c26699fafe31b59b54dc19c61618aad,2025-11-07T21:58:22Z,'deluge',www.psychologytoday.com,en,1.0,A Way to Mutually Learn What Is Between Us,"The deluge of wanting to share feelings needs forums and encouragement to actualize our interdependence without competition, projections, defensiveness, or assumptions.",https://www.psychologytoday.com/us/blog/a-wider-lens/202511/a-way-to-mutually-learn-what-is-between-us,https://cdn2.psychologytoday.com/assets/styles/manual_crop_1_91_1_1528x800/public/field_blog_entry_images/2025-11/pexels-ketut-subiyanto-4746779%20%281%29.jpg?itok=x9HJXLL1,,"I am interested in a kind of mutually alert care and attention to the wellbeing of all people and ecological systems. This kind of leadership cannot be found in individuals; rather, it is found betwe… [+5818 chars]",
65a16b3cc69fa0188749f8fee79bfe73,2025-11-07T22:52:09Z,'flooding damage',apnews.com,en,0.1,Typhoon Kalmaegi leaves 5 dead in Vietnam after killing 188 in the Philippines,"Typhoon Kalmaegi has brought fierce winds and torrential rains to Vietnam, and left at least five people dead and thousands of homes damaged before weakening into a tropical storm. The storm moved into Cambodia later on Friday. Authorities also say three peop…",https://apnews.com/article/typhoon-kalmaegi-vietnam-philippines-da322fbd6cbb3f4bb2328ec046ffe2b7,https://dims.apnews.com/dims4/default/60909b9/2147483647/strip/true/crop/1600x900+0+104/resize/1440x810!/quality/90/?url=https%3A%2F%2Fassets.apnews.com%2Ff5%2F42%2F8f1be4a5f2fcf878b7c43e96cfe9%2Fa9b249a3d7d54af4b560a55618087773,,"DAK LAK, Vietnam (AP) Typhoon Kalmaegi brought fierce winds and torrential rains to Vietnam on Friday, killing at least five people, flattening homes, blowing off roofs and uprooting trees. In the Ph… [+5093 chars]",
