index,url,valid,domain,title,description,image,published,archive,content,quote,language,keyword
https://www.yahoo.com/news/flooding-chantals-remnants-forces-dozens-132631424.html,https://www.yahoo.com/news/flooding-chantals-remnants-forces-dozens-132631424.html,0,www.yahoo.com,Flooding from Chantal's remnants forces dozens to flee homes in North Carolina,"Heavy rain and flooding from the remnants of Tropical Storm Chantal forced dozens of people to flee their homes in central North Carolina, officials said...",https://s.yimg.com/ny/api/res/1.2/p2tKcVV5NG65p7wz1.MRxA--/YXBwaWQ9aGlnaGxhbmRlcjt3PTEyMDA7aD04Njc7Y2Y9d2VicA--/https://media.zenfs.com/en/ap.org/eb6ec421f088b3a9a68cf28ab9519399,2025-07-07T13:26:31Z,,"CHAPEL HILL, N.C. (AP) Heavy rain and flooding from the remnants of Tropical Storm Chantal forced dozens of people to flee their homes in central North Carolina, officials said Monday.
The Chapel Hi… [+2576 chars]",,en,'flooding'
https://www.nakedcapitalism.com/2025/07/hurricane-helene-set-up-future-disasters-from-landslides-to-flooding-cascading-hazards-like-these-are-now-upending-risk-models.html,https://www.nakedcapitalism.com/2025/07/hurricane-helene-set-up-future-disasters-from-landslides-to-flooding-cascading-hazards-like-these-are-now-upending-risk-models.html,0,www.nakedcapitalism.com,"Hurricane Helene Set Up Future Disasters, From Landslides to Flooding ‚Äì Cascading Hazards Like These Are Now Upending Risk Models",Cascading hazards occur when one natural event alters the landscape in ways that lead to future hazards‚Äîand they are increasing.,https://www.nakedcapitalism.com/wp-content/uploads/2025/07/Screenshot-2025-07-06-at-9.27.53‚ÄØPM-1024x692.png,2025-07-07T13:55:27Z,,"Conor here: Seems timely with Tropical Storm Chantal hitting North Carolina this weekend.
By Brian J. Yanites, Associate Professor of Earth and Atmospheric Science and Professor of Surficial and Sed‚Ä¶ [+5801 chars]",,en,'flooding disaster'
https://www.yahoo.com/news/camp-mystic-confirms-27-children-150423124.html,https://www.yahoo.com/news/camp-mystic-confirms-27-children-150423124.html,0,www.yahoo.com,Camp Mystic confirms 27 children and counselors were killed in Texas flash floods,Camp Mystic confirmed that 27 people died after catastrophic flash floods slammed central Texas. CBS News correspondent Jason Allen has the latest updates on...,https://s.yimg.com/ny/api/res/1.2/8umeEZZVT03RJpfiu3ouLw--/YXBwaWQ9aGlnaGxhbmRlcjt3PTEyMDA7aD02NzU7Y2Y9d2VicA--/https://media.zenfs.com/en/video.cbsnewsvideos.com/e2edd8a22ee47571c08ac78d68fed8c7,2025-07-07T15:04:23Z,,"Camp Mystic confirmed that 27 people died after catastrophic flash floods slammed central Texas. CBS News correspondent Jason Allen has the latest updates on the children and counselors killed, while… [+78 chars]",,en,'floods'
https://www.npr.org/2025/07/07/nx-s1-5459761/texas-flooding-deaths-rescues-camp-mystic,https://www.npr.org/2025/07/07/nx-s1-5459761/texas-flooding-deaths-rescues-camp-mystic,0,www.npr.org,4 things to know about the deadly Texas floods and ongoing search efforts,"Search efforts continue for the dozens of people still missing after Friday's floods, as questions swirl over what went wrong. Here's what we know so far.",https://npr.brightspotcdn.com/dims3/default/strip/false/crop/4000x2250+0+0/resize/1400/quality/100/format/jpeg/?url=http%3A%2F%2Fnpr-brightspot.s3.amazonaws.com%2F89%2F28%2F6d99b11548ff873446bb9190a750%2Fgettyimages-2223267007.jpg,2025-07-07T15:25:56Z,,"After a weekend of catastrophic flooding in central Texas, search operations continue as questions swirl about whether officials could have done more to warn people before the river's rapid rise.
Th… [+6283 chars]",,en,'floods'
https://phys.org/news/2025-07-texas-hill-country-deadliest.html,https://phys.org/news/2025-07-texas-hill-country-deadliest.html,0,phys.org,Why Texas Hill Country is one of the deadliest places in the US for flash flooding,"Texas Hill Country is known for its landscapes, where shallow rivers wind among hills and through rugged valleys. That geography also makes it one of the deadliest places in the U.S. for flash flooding.",https://scx2.b-cdn.net/gfx/news/2025/why-texas-hill-country.jpg,2025-07-07T15:58:04Z,,"Texas Hill Country is known for its landscapes, where shallow rivers wind among hills and through rugged valleys. That geography also makes it one of the deadliest places in the U.S. for flash floodi… [+5390 chars]",,en,'flooding'
https://www.scientificamerican.com/article/why-did-texas-flash-flood-waters-rise-so-quickly/,https://www.scientificamerican.com/article/why-did-texas-flash-flood-waters-rise-so-quickly/,0,www.scientificamerican.com,Why Did Texas Flash Flood Waters Rise So Quickly?,"Flash floods happen when heavy rains unleash more water than the ground can absorb, causing that water to pile up and flow to low-lying areas",https://static.scientificamerican.com/dam/m/6d86c99262f5c88b/original/texas_guadalupe_river_flooded.jpg?m=1751907470.44&w=1200,2025-07-07T16:00:00Z,,"In the wee hours last Friday morning, the Guadalupe River in Texas Hill Country rose 26 feet in just 45 minutes in Hunt, Texas. Like all flash floods, this record-breaking water swell resulted from a… [+2737 chars]",,en,'floods'
https://www.techdirt.com/2025/07/07/doge-cuts-turned-a-predicted-disaster-into-a-deadly-reality-in-texas/,https://www.techdirt.com/2025/07/07/doge-cuts-turned-a-predicted-disaster-into-a-deadly-reality-in-texas/,0,www.techdirt.com,DOGE Cuts Turned A Predicted Disaster Into A Deadly Reality In Texas,"On Thursday, literally the day before flash flooding devastated Texas, the Texas Observer published an article warning that “Trump’s DOGE Cuts Are a Texas-Sized Disaster,” explaining how cuts to both the Federal Emergency Management Agency (FEMA) and the Nati…",https://www.techdirt.com/wp-content/themes/techdirt/assets/images/td-rect-logo-white.png,2025-07-07T16:19:01Z,,"from the the-thoughts-and-prayers-aren't-working dept
On Thursday, literally the day before flash flooding devastated Texas, the Texas Observer published an article warning that “Trump’s DOGE Cuts A… [+8757 chars]",,en,'flooding'
http://www.thecut.com/article/how-to-help-victims-texas-floods.html,http://www.thecut.com/article/how-to-help-victims-texas-floods.html,0,www.thecut.com,How to Help Victims of the Texas Floods,At least 81 people have died and dozens are missing after rapidly rising flood waters devastated areas of Central Texas. Here’s how you can help.,https://pyxis.nymag.com/v1/imgs/b0e/42a/edd837cce08d0ac09d77576d0131b629e6-texas-floods.1x.rsocial.w1200.jpg,2025-07-07T16:25:52Z,,"In the early hours of July 4, a flash flood devastated Central Texas as the Guadalupe River rose to more than 26 feet in less than an hour, per state officials. In the days since, the death toll has … [+2771 chars]",,en,'floods'
https://wattsupwiththat.com/2025/07/07/the-texas-flooding-tragedy-could-it-have-been-avoided/,https://wattsupwiththat.com/2025/07/07/the-texas-flooding-tragedy-could-it-have-been-avoided/,0,wattsupwiththat.com,The Texas Flooding Tragedy: Could It Have Been Avoided?,"Any media or other organization suggesting that the National Weather Service was not on top of this event is not only not telling the truth, but doing a deep disservice to the highly professional and skillful folks in that organization.",https://i0.wp.com/wattsupwiththat.com/wp-content/uploads/2025/07/Screenshot-2025-07-06-at-12.18.17-PM-topaz.webp?fit=1024%2C512&ssl=1,2025-07-07T17:00:00Z,,"From the Cliff Mass Weather Blog
On Friday morning, heavy rains led to catastrophic flooding along the Guadalupe River in central Texas.  
Tragically, it appears that at least fifty people lost the… [+3453 chars]",,en,'flooding evacuation'
https://www.theatlantic.com/photography/archive/2025/07/photos-texas-floods/683442/,https://www.theatlantic.com/photography/archive/2025/07/photos-texas-floods/683442/,0,www.theatlantic.com,Photos: Deadly Flooding in Texas,"Early Friday morning, heavy rainfall in central Texas set off flash floods, causing the Guadalupe River to rise 26 feet in less than an hour and reportedly killing at least 89 people—including many girls at a summer camp. Rescue workers and volunteers have be…",https://cdn.theatlantic.com/thumbor/3EVWfZSSmJ2b4gU3A2ARH6pf0Yk=/0x284:3996x2365/1200x625/media/img/mt/2025/07/a01_G_2223201720/original.jpg,2025-07-07T17:02:44Z,,"Jim Vondruska / Getty
Search-and-rescue workers dig through debris looking for any survivors or remains of people swept up in the flash flooding on July 6, 2025, in Hunt, Texas. Heavy rainfall cause… [+3706 chars]",,en,'flooding area'
https://abcnews.go.com/GMA/News/victims-deadly-texas-floods/story?id=123531546,https://abcnews.go.com/GMA/News/victims-deadly-texas-floods/story?id=123531546,0,abcnews.go.com,How to help victims of deadly Texas floods,Organizations and local brands have jumped into action to help victims of the deadly Texas floods that began in Hill Country on Friday.,https://i.abcnewsfe.com/a/f1f01942-dc15-4e13-bc1a-3a9d89d487dc/texas-flood-4-gty-gmh-250707_1751890660784_hpMain_16x9.jpg?w=1600,2025-07-07T17:17:08Z,,"Disaster relief efforts are underway to help those affected by the catastrophic flash flooding in Texas Hill Country that killed at least 80 people, with more still missing.
On Sunday morning, Presi… [+3514 chars]",,en,'flooding relief'
https://truthout.org/articles/trump-dodges-questions-on-texas-floods-national-weather-service-cuts/,https://truthout.org/articles/trump-dodges-questions-on-texas-floods-national-weather-service-cuts/,0,truthout.org,"Trump Dodges Questions on Texas Floods, National Weather Service Cuts",Several National Weather Service offices in Texas are considerably understaffed.,https://truthout.org/app/uploads/2025/07/2025_0707-texas-floods-trump.jpg,2025-07-07T17:27:20Z,,"Truthout is a vital news source and a living history of political struggle. If you think our work is valuable, support us with a donation of any size.
Over the weekend, President Donald Trump appear… [+3546 chars]",,en,'flooding donation'
https://www.npr.org/2025/07/07/nx-s1-5459755/texas-floods-climate-change,https://www.npr.org/2025/07/07/nx-s1-5459755/texas-floods-climate-change,0,www.npr.org,"Floods are getting more dangerous around the country, not just in Texas",The deadly floods in Central Texas were caused by extremely heavy rain. Climate change is causing even more rain to fall during the heaviest storms.,https://npr.brightspotcdn.com/dims3/default/strip/false/crop/6785x3817+0+354/resize/1400/quality/100/format/jpeg/?url=http%3A%2F%2Fnpr-brightspot.s3.amazonaws.com%2F01%2F6f%2Fafb22f0a4a69b9ea7dfe9dad9804%2Fap25187650196637.jpg,2025-07-07T17:30:06Z,,"The catastrophic flash floods in Texas
 over the weekend were caused by extremely heavy rain. Up to 12 inches of rain fell in South Central Texas in the early hours of July 4th, according to Nationa… [+4477 chars]",,en,'floods'
https://gizmodo.com/warning-fatigue-might-have-made-texas-floods-deadlier-2000625092,https://gizmodo.com/warning-fatigue-might-have-made-texas-floods-deadlier-2000625092,0,gizmodo.com,‘Warning Fatigue’ Might Have Made Texas Floods Deadlier,"The National Weather Service issued multiple alerts ahead of the deadly floods that devastated central Texas, but whether people actually responded to them is an important question.",https://gizmodo.com/app/uploads/2025/07/Guadalupe-river-flash-flood-1200x675.jpg,2025-07-07T17:30:49Z,,"A deluge of rain triggered deadly flash floods in Texas Hill Country over the weekend, causing widespread damage and killing more than 80 people. As the death toll climbs, some experts say flood warn… [+5480 chars]",,en,'floods'
https://consent.yahoo.com/v2/collectConsent?sessionId=1_cc-session_4e965bb4-3432-4c48-a42f-304a126de56f,https://consent.yahoo.com/v2/collectConsent?sessionId=1_cc-session_4e965bb4-3432-4c48-a42f-304a126de56f,0,consent.yahoo.com,"After flash flooding Sunday night, NWS says wet weather in Springfield area will continue",,,2025-07-07T18:20:58Z,,"If you click 'Accept all', we and our partners, including 236 who are part of the IAB Transparency &amp; Consent Framework, will also store and/or access information on a device (in other words, use … [+714 chars]",,en,'flooding area'
https://www.jezebel.com/kristi-noem-accidentally-low-key-suggested-that-trump-might-be-to-blame-for-deadly-texas-flooding,https://www.jezebel.com/kristi-noem-accidentally-low-key-suggested-that-trump-might-be-to-blame-for-deadly-texas-flooding,0,www.jezebel.com,Kristi Noem Accidentally Low-Key Suggested That Trump Might Be to Blame for Deadly Texas Flooding,"While insisting this wasn't Trump’s fault, Noem blamed previous administrations for failing to update NOAA’s “ancient” systems—which would include Trump’s first term, no?",https://img.pastemagazine.com/wp-content/juploads/2025/07/noemsfsd.jpg,2025-07-07T18:52:28Z,,"As of Monday evening, at least 100 people in Texas have been confirmed dead following the early-morning flash flooding on July 4including 27 children and counselors from Camp Mystic, an all-girls sum… [+3922 chars]",,en,'flooding residents'
https://www.vox.com/climate/419017/central-texas-floods-early-warning-flash-flood-alley,https://www.vox.com/climate/419017/central-texas-floods-early-warning-flash-flood-alley,0,www.vox.com,Why were the central Texas floods so deadly?,"At least 90 people have died in central Texas in extraordinary floods, the deadliest in the Lone Star State since Hurricane Harvey killed 89 people. A torrential downpour started off the July 4 weekend with several months’ worth of rain falling in a few hours…",https://platform.vox.com/wp-content/uploads/sites/2/2025/07/GettyImages-2222872780.jpg?quality=90&strip=all&crop=0%2C10.732984293194%2C100%2C78.534031413613&w=1200,2025-07-07T19:39:30Z,,"Kerrville resident Leighton Sterling watches flood waters along the Guadalupe River on July 4, 2025. | Eric Vryn/Getty Images


At least 90 people have died in central Texas in extraordinary floods,… [+6995 chars]",,en,'floods'
https://www.snopes.com//news/2025/07/07/flooding-texas-george-strait/,https://www.snopes.com//news/2025/07/07/flooding-texas-george-strait/,0,www.snopes.com,Investigating claim George Strait donated $3.5M to Texas flooding victims,Social media posts claimed the country music legend made a massive donation to support those affected by the July 2025 flooding.,https://mediaproxy.snopes.com/width/1200/https://media.snopes.com/2025/07/george_strait_texas_floods.png,2025-07-07T19:42:00Z,,Why is there not a rating on this post? There's not enough verified evidence for us to definitively confirm or debunk this rumor. Contact us if you have credible information to share. We'll update th… [+2886 chars],,en,'flooding relief'
https://reason.com/2025/07/07/the-texas-floods-were-a-natural-disaster-not-a-policy-disaster/,https://reason.com/2025/07/07/the-texas-floods-were-a-natural-disaster-not-a-policy-disaster/,0,reason.com,"The Texas Floods Were a Natural Disaster, Not a Policy Disaster",There's no evidence that cuts to the National Weather Service impacted the response to the weekend's tragic flash floods.,https://d2eehagpk5cl65.cloudfront.net/img/q60/uploads/2025/07/reason-hurricane-1024x986.jpg,2025-07-07T21:08:44Z,,"It's a news cycle as old as the weather.
A terrible natural disaster results in the loss of life and property.
The chattering classes immediately begin to heap blame on their political enemies for br… [+7608 chars]",,en,'floods'
https://www.insurancejournal.com/news/southcentral/2025/07/07/830621.htm,https://www.insurancejournal.com/news/southcentral/2025/07/07/830621.htm,0,www.insurancejournal.com,"Deadly Texas Flash Floods Cause $18-22 Billion in Damage, AccuWeather Says","The deadly flash floods in Texas that killed more than 100 people over the Fourth of July holiday weekend will cause an estimated $18 billion to $22 billion in total damage and economic loss, AccuWeather said. The weather forecasting service …",https://www.insurancejournal.com/app/uploads/2025/07/Texas-Flood-Damage-AccuWeather-Estimates-scaled.jpg,2025-07-07T22:46:35Z,,"The deadly flash floods in Texas that killed more than 100 people over the Fourth of July holiday weekend will cause an estimated $18 billion to $22 billion in total damage and economic loss, AccuWea… [+2261 chars]",,en,'floods'
https://abcnews.go.com/US/video/coast-guard-rescue-swimmer-saved-165-camp-mystic-123547838,https://abcnews.go.com/US/video/coast-guard-rescue-swimmer-saved-165-camp-mystic-123547838,0,abcnews.go.com,WATCH: Coast Guard rescue swimmer who saved 165 from Camp Mystic speaks out,Scott Ruskin joined “GMA” to detail his rescue operation amid deadly flooding in Texas.,https://i.abcnewsfe.com/a/2b7ab915-5a01-4f58-a849-ebf3450a1b0d/250707_abc_social_coast_rescue_hpMain_9x16.jpg?w=992,2025-07-07T22:54:54Z,,"<ul><li>Death toll tops 100 in Texas floods
</li><li>New questions about warning system in flood zone
</li><li>Rain relief for Texas as new storms target I-95
</li><li>Philadelphia union to meet w… [+4354 chars]",,en,'flooding'
https://consent.yahoo.com/v2/collectConsent?sessionId=1_cc-session_d6d59c18-b3a3-468f-9191-9f796ec3a143,https://consent.yahoo.com/v2/collectConsent?sessionId=1_cc-session_d6d59c18-b3a3-468f-9191-9f796ec3a143,0,consent.yahoo.com,"Heavy rain, flooding in North Carolina due to tropical depression Chantal",,,2025-07-08T02:03:46Z,,"If you click 'Accept all', we and our partners, including 236 who are part of the IAB Transparency &amp; Consent Framework, will also store and/or access information on a device (in other words, use … [+714 chars]",,en,'flooding rain'
https://www.fox7austin.com/news/texas-flooding-leander-neighborhood-isolated-due-broken-bridge,https://www.fox7austin.com/news/texas-flooding-leander-neighborhood-isolated-due-broken-bridge,0,www.fox7austin.com,Texas flooding: Leander neighborhood isolated due to broken bridge,A Leander neighborhood is feeling isolated after a main bridge broke due to severe flooding.,https://s.yimg.com/ny/api/res/1.2/BZWEpGQmg0WmdkPfU927Cw--/YXBwaWQ9aGlnaGxhbmRlcjt3PTEyMDA7aD02NzU7Y2Y9d2VicA--/https://media.zenfs.com/en/ktbc_fox_local_articles_950/81296d1230e437476fe5c75af2993130,2025-07-08T03:02:39Z,,"The Brief
<ul><li>A Leander neighborhood is feeling isolated due to a broken bridge
</li><li>The bridge near Cow Creek and FM 1431 was broken due to severe flooding this past weekend
</li><li>It s… [+2755 chars]",,en,'flooding'
https://abcnews.go.com/US/wireStory/volunteers-flock-search-efforts-after-texas-floods-officials-123557223,https://abcnews.go.com/US/wireStory/volunteers-flock-search-efforts-after-texas-floods-officials-123557223,0,abcnews.go.com,Volunteers flock to help search efforts after Texas floods even as officials warn them away,Flash flooding in Texas Hill Country has triggered one of the largest rescue operations in the state’s history,https://i.abcnewsfe.com/a/60d977dc-ce19-429a-a3ae-64cd1add5e48/wirestory_9a65c7d6a9108ad77f5fb95ab4582481_16x9.jpg?w=1600,2025-07-08T04:22:21Z,,"CENTER POINT, Texas -- Justin Rubio awoke in the wee hours to an alert on his phone, thunder, sirens and the thud of helicopter blades the beginning of one of the largest rescue operations in Texas h… [+3699 chars]",,en,'floods'
https://www.naturalnews.com/2025-07-08-historic-flooding-central-texas-brings-shameful-political-exploitation.html,https://www.naturalnews.com/2025-07-08-historic-flooding-central-texas-brings-shameful-political-exploitation.html,0,www.naturalnews.com,Historic flooding in central Texas brings SHAMEFUL political exploitation,"Flooding is not unprecedented historically, contradicting claims it’s climate “catastrophe.” Texas A&M and federal data show no long-term trends linking floods to rising CO2 levels. Politicians misuse tragedy to scapegoat federal budget cuts, ignoring the fac…",https://www.naturalnews.com/wp-content/uploads/sites/91/2025/07/Flood-Aerial-Disaster-View-Damage-Homes-House.jpg,2025-07-08T06:00:00Z,,"<ul><li>Flooding is not unprecedented historically, contradicting claims its climate ""catastrophe.""</li><li>Texas A&amp;M and federal data show no long-term trends linking floods to rising CO2 levels… [+5022 chars]",,en,'floods'
https://abcnews.go.com/US/flood-prone-local-texas-officials-spent-years-discussing/story?id=123550294,https://abcnews.go.com/US/flood-prone-local-texas-officials-spent-years-discussing/story?id=123550294,0,abcnews.go.com,Local Texas officials spent years discussing potential flood warning system,"Flooding has been at the top of Texans’ minds this week, but this is not the first time that the need for flood-related measures has come up among local officials.",https://i.abcnewsfe.com/a/11a13bbd-6fb1-4d20-b555-21e99f6d1253/texas-flood-damage-ap-jt-250705_1751738372600_hpMain_16x9.jpg?w=1600,2025-07-08T06:03:05Z,,"Flooding has been at the top of Kerr County residents' minds following the deadly floods of the last week, but an analysis by ABC News and ABC Owned Television Stations of public meeting records show… [+3815 chars]",,en,'flooding health'
https://newrepublic.com/article/197662/democrats-should-say-who-really-blame-flooding-texas,https://newrepublic.com/article/197662/democrats-should-say-who-really-blame-flooding-texas,0,newrepublic.com,Democrats Should​ Say Who’s Really to Blame for the ​Flooding in Texas,"In just 45 minutes early Friday morning, intense rain caused sections of the Guadalupe River in Central Texas to rise by nearly 26 feet. Four months worth of rain dropped within hours. More than 100 people had been confirmed dead as of late Monday afternoon, …",https://images.newrepublic.com/0c59d8041ca0eccc6e432a365af3f901addb670f.jpeg?w=1200&h=630&crop=faces&fit=crop&fm=jpg,2025-07-08T10:00:00Z,,"In just 45 minutes early Friday morning, intense rain caused sections of the Guadalupe River in Central Texas to rise by nearly 26 feet. Four months worth of rain dropped within hours. More than 100 … [+2963 chars]",,en,'flooding rain'
https://www.npr.org/2025/07/08/g-s1-76507/up-first-newsletter-texas-flooding-tariffs-robert-kennedy-lawsuit,https://www.npr.org/2025/07/08/g-s1-76507/up-first-newsletter-texas-flooding-tariffs-robert-kennedy-lawsuit,0,www.npr.org,"How to help Texas flood survivors. And, health organizations sue RFK Jr.",Search efforts are still ongoing after the deadly Texas floods. Here's how you can help survivors. And RFK Jr.'s vaccine policy has sparked a lawsuit.,https://npr.brightspotcdn.com/dims3/default/strip/false/crop/4000x2250+0+209/resize/1400/quality/100/format/jpeg/?url=http%3A%2F%2Fnpr-brightspot.s3.amazonaws.com%2F52%2Fe6%2F7ffcc0e649558e989bea87fcbafa%2Fgettyimages-2223201846.jpg,2025-07-08T10:56:58Z,,"Good morning. You're reading the Up First newsletter. Subscribe here to get it delivered to your inbox, and listen to the Up First podcast for all the news you need to start your day.
Today's top st… [+6698 chars]",,en,'floods'
https://www.nationalobserver.com/2025/07/08/news/why-canada-unprepared-new-reality-flash-flooding-severe-storms,https://www.nationalobserver.com/2025/07/08/news/why-canada-unprepared-new-reality-flash-flooding-severe-storms,0,www.nationalobserver.com,Why Canada is unprepared for 'new reality' of flash flooding and severe storms,"Ryan Ness of the Canadian Climate Institute says he's been following the ""terrible tragedy"" of deadly flash flooding unfolding in Texas, where more than 100 people have died.",https://www.nationalobserver.com/sites/default/files/img/2025/07/08/3e0359f169df0bd9b380e6bda1707f641561c95a4d6768f014dd938e23ec468f.jpg,2025-07-08T12:03:33Z,,"Ryan Ness of the Canadian Climate Institute says he's been following the ""terrible tragedy"" of deadly flash flooding unfolding in Texas, where more than 100 people have died.
But he's also worried C‚Ä¶ [+3778 chars]",,en,'flooding storm'
https://www.cbsnews.com/news/texas-flooding-search-volunteers-shunned-come-anyway/,https://www.cbsnews.com/news/texas-flooding-search-volunteers-shunned-come-anyway/,0,www.cbsnews.com,People keep volunteering at Texas flooding site despite being told not to,"Even as authorities in Kerr County, Texas have repeatedly discouraged civilian volunteers from showing up to help in the search for victims of the region's historic flooding, many are, anyway.",https://assets3.cbsnewsstatic.com/hub/i/r/2025/07/08/933b3725-7440-4f40-91c9-b760c02053ad/thumbnail/1200x630/d0d2395947dfdf93246fb7cbd76ab064/gettyimages-2223449263.jpg,2025-07-08T12:10:24Z,,"Justin Rubio awoke in the wee hours to an alert on his phone, thunder, sirens and the thud of helicopter blades - the beginning of one of the largest rescue operations in Texas history. Rubio was det… [+3846 chars]",,en,'flooding solidarity'
https://www.yahoo.com/news/texas-flooding-hundreds-petition-kerr-122047756.html,https://www.yahoo.com/news/texas-flooding-hundreds-petition-kerr-122047756.html,0,www.yahoo.com,Texas flooding: Hundreds petition for Kerr County warning system | Morning in America,"Nicole Wilson, a San Antonio mother and Army veteran, started an online petition Saturday calling for Kerr County to install flood warning sirens. Wilson...",https://s.yimg.com/ny/api/res/1.2/XHF.ure0OBcQUa9Uzid.1w--/YXBwaWQ9aGlnaGxhbmRlcjt3PTEyMDA7aD02NzU7Y2Y9d2VicA--/https://media.zenfs.com/en/newsnation_videos_816/868b56109e325d32f777d8ff055ba670,2025-07-08T12:20:47Z,,"Nicole Wilson, a San Antonio mother and Army veteran, started an online petition Saturday calling for Kerr County to install flood warning sirens. Wilson tells Morning in America that one of the reas… [+143 chars]",,en,'flooding'
