index,url,valid,domain,title,description,image,published,archive,content,quote,language,keyword
https://m.economictimes.com/news/newsblogs/india-news-live-updates-monsoon-himachal-pradesh-flood-red-alert-pm-modi-africa-brazil-visit-bihar-polls-donald-trump-us-senate-big-beautiful-bill-jaishankar-3-day-us-quad-visit-kolkata-campus-rape-israel-iran-war-1-july-2025/liveblog/122170753.cms,https://m.economictimes.com/news/newsblogs/india-news-live-updates-monsoon-himachal-pradesh-flood-red-alert-pm-modi-africa-brazil-visit-bihar-polls-donald-trump-us-senate-big-beautiful-bill-jaishankar-3-day-us-quad-visit-kolkata-campus-rape-israel-iran-war-1-july-2025/liveblog/122170753.cms,0,m.economictimes.com,Breaking News Live Updates: Red alert in Himachal Pradesh as monsoon rains spark severe flood warning,"Breaking News Live Updates: Relentless rain in Himachal Pradesh has unleashed flooding, landslides and road blockages across the state. The Beas River is swelling dangerously while Mandi, Sirmaur and Kullu battle severe disruptions to roads, power lines and w…","https://economictimes.indiatimes.com/thumb/msid-122170753,width-600,resizemode-4,imglength-14498/news/newsblogs/india-news-live-updates-monsoon-himachal-pradesh-flood-red-alert-pm-modi-africa-brazil-visit-bihar-polls-donald-trump-us-senate-big-beautiful-bill-jaishankar-3-day-us-quad-visit-kolkata-campus-rape-israel-iran-war-1-july-2025.jpg",2025-07-01T00:56:06Z,,"Breaking News Live Updates: Heavy rain has pushed the Beas River into severe flooding. Himachal Pradesh woke up to blocked roads, power cuts and broken pipelines as the monsoon tightened its grip.The… [+2288 chars]",,en,'flooding landslide'
https://economictimes.indiatimes.com/news/india/himachal-pradesh-rains-flash-flood-threat-looms-as-monsoon-triggers-red-alert-schools-shut-roads-blocked-power-cut/articleshow/122170961.cms,https://economictimes.indiatimes.com/news/india/himachal-pradesh-rains-flash-flood-threat-looms-as-monsoon-triggers-red-alert-schools-shut-roads-blocked-power-cut/articleshow/122170961.cms,0,economictimes.indiatimes.com,"Himachal Pradesh Rains: Flash flood threat looms as monsoon triggers red alert; schools shut, roads blocked, power cut","Relentless rain in Himachal Pradesh has unleashed flooding, landslides and road blockages across the state. The Beas River is swelling dangerously while Mandi, Sirmaur and Kullu battle severe disruptions to roads, power lines and water supply. The India Meteo…","https://img.etimg.com/thumb/msid-122171011,width-1200,height-630,imgsize-300044,overlay-economictimes/articleshow.jpg",2025-07-01T01:53:37Z,,"Heavy rain has pushed the Beas River into severe flooding. Himachal Pradesh woke up to blocked roads, power cuts and broken pipelines as the monsoon tightened its grip.The India Meteorological Depart… [+3687 chars]",,en,'flooding'
https://www.stltoday.com/sports/professional/mlb/cardinals/article_0101a54d-a29c-4d35-a5b2-480cdca82fc4.html,https://www.stltoday.com/sports/professional/mlb/cardinals/article_0101a54d-a29c-4d35-a5b2-480cdca82fc4.html,0,www.stltoday.com,"Rolling Pirates capsize Cardinals, swamp starter Erick Fedde with 6-run deluge in 5th inning","Andrew Heaney takes a no-hitter into the sixth against the Cardinals, who fail to get an at-bat with a runner in scoring position during the 7-0 loss at PNC Park.",https://bloximages.newyork1.vip.townnews.com/stltoday.com/content/tncms/assets/v3/editorial/0/10/0101a54d-a29c-4d35-a5b2-480cdca82fc4/68634338331d0.preview.jpg?crop=1763%2C926%2C0%2C124&resize=1200%2C630&order=crop%2Cresize,2025-07-01T02:05:00Z,,"PITTSBURGH  While the Cardinals were still struggling to produce their first hit of the evening, the Pittsburgh Pirates produced a bounty of them in one sustained burst against Cardinals struggling s… [+5744 chars]",,en,'deluge'
https://lancasteronline.com/news/local/lancaster-braces-for-another-round-of-rain-after-major-flooding-tuesday-update/article_33038a9d-c486-4c9e-afa8-791420aac65c.html,https://lancasteronline.com/news/local/lancaster-braces-for-another-round-of-rain-after-major-flooding-tuesday-update/article_33038a9d-c486-4c9e-afa8-791420aac65c.html,0,lancasteronline.com,Lancaster braces for another round of rain after major flooding Tuesday [update],Residents in Manheim Borough wandered the muddy streets Tuesday morning after receiving what some said was the worst flooding they have ever seen in the area.,https://bloximages.newyork1.vip.townnews.com/lancasteronline.com/content/tncms/assets/v3/editorial/a/5d/a5d0a07d-c284-4e92-b282-afef92440504/68640a572a196.image.jpg?crop=1828%2C960%2C0%2C86&resize=1200%2C630&order=crop%2Cresize,2025-07-01T09:35:00Z,,"Residents in Manheim Borough wandered the muddy streets Tuesday morning after receiving what some said was the worst flooding they have ever seen in the area.
The flooded Chiques Creek, which runs t… [+5512 chars]",,en,'flooding residents'
https://lancasteronline.com/news/local/overnight-flooding-impacts-thousands-in-lancaster-county/article_33038a9d-c486-4c9e-afa8-791420aac65c.html,https://lancasteronline.com/news/local/overnight-flooding-impacts-thousands-in-lancaster-county/article_33038a9d-c486-4c9e-afa8-791420aac65c.html,0,lancasteronline.com,Overnight flooding impacts thousands in Lancaster County,"More than 1,000 residents are without power, roads are closed, and emergency services have been working nonstop overnight as major flooding hit Lancaster County Monday evening into early Tuesday morning.",https://bloximages.newyork1.vip.townnews.com/lancasteronline.com/content/tncms/assets/v3/editorial/9/c7/9c7a58c7-cdc5-4fa1-99b3-c3f27a3d3f24/68636d6f6158d.image.jpg?crop=1763%2C926%2C0%2C124&resize=1200%2C630&order=crop%2Cresize,2025-07-01T09:35:00Z,,"More than 1,000 residents are without power, roads are closed, and emergency services have been working nonstop overnight as major flooding hit Lancaster County Monday evening into early Tuesday morn… [+1750 chars]",,en,'flooding residents'
https://www.nbcnews.com/world/china/record-rainfall-central-china-leads-flooding-evacuations-rcna216154,https://www.nbcnews.com/world/china/record-rainfall-central-china-leads-flooding-evacuations-rcna216154,0,www.nbcnews.com,Record rainfall in central China leads to flooding and evacuations,"More than a month’s worth of rain in just 12 hours on the Chinese city of Xianfeng prompted authorities to move 18,000 people to safety and shut schools.","https://media-cldnry.s-nbcnews.com/image/upload/t_nbcnews-fp-1200-630,f_auto,q_auto:best/rockcms/2025-07/250701-guizho-rs-991eaa.jpg",2025-07-01T09:37:57Z,,"A record summer downpour in Chinas central province of Hubei dumped more than a months worth of rain in just 12 hours on the city of Xianfeng, prompting authorities on Tuesday to move 18,000 people t… [+1262 chars]",,en,'flooding evacuation'
https://www.cbsnews.com/news/climate-change-impact-flooding-drought-majority-world-heritage-sites/,https://www.cbsnews.com/news/climate-change-impact-flooding-drought-majority-world-heritage-sites/,0,www.cbsnews.com,"Either flooding or drought threaten most world heritage sites, U.N. says","From Yellowstone to the Garden of Eden, almost 75% of the world's heritage sites at risk of drought or flooding, U.N. warns.",https://assets2.cbsnewsstatic.com/hub/i/r/2023/07/19/2346e815-5b78-48c3-ac49-efb4e223d135/thumbnail/1200x630/3547cba5ca4b48ad444fc5230857c38a/gettyimages-1539370667.jpg,2025-07-01T10:17:05Z,,"Paris — Almost three quarters of the globe's cultural and natural heritage sites are threatened by too little or too much water, the UN's cultural agency said on Tuesday. As a result of rising temper… [+3399 chars]",,en,'flooding climate change'
https://www.abc27.com/local-news/lancaster/floods-drowns-out-lancaster-county-roadways-in-aftermath-of-mondays-storms/,https://www.abc27.com/local-news/lancaster/floods-drowns-out-lancaster-county-roadways-in-aftermath-of-mondays-storms/,0,www.abc27.com,Floods drown out Lancaster County roadways in aftermath of Monday’s storms,"LANCASTER COUNTY, Pa. (WHTM)– Many parts of the Midstate are still dealing with the aftermath of Monday’s storms, especially in Lancaster County. Manheim...",https://media.zenfs.com/en/whtm_articles_902/bbc07cb3e7aea3e81daa6507ab4c9265,2025-07-01T10:29:53Z,,"LANCASTER COUNTY, Pa. (WHTM) Many parts of the Midstate are still dealing with the aftermath of Mondays storms, especially in Lancaster County.
Manheim Borough was severely impacted by Mondays storm… [+2093 chars]",,en,'floods'
https://nypost.com/2025/07/01/world-news/hurricane-flossie-forms-in-eastern-pacific/,https://nypost.com/2025/07/01/world-news/hurricane-flossie-forms-in-eastern-pacific/,0,nypost.com,"Hurricane Flossie forms in Eastern Pacific as Mexico faces threats of flooding rain, mudslides","Hurricane Flossie formed off the southwestern coast of Mexico late Monday night, and local officials are asking residents to prepare for possible flooding and life-threatening mudslides as the storm continues on its journey across the Eastern Pacific Ocean.",https://nypost.com/wp-content/uploads/sites/2/2025/07/107458001.jpg?quality=75&strip=all&w=1024,2025-07-01T15:04:37Z,,"Hurricane Flossie formed off the southwestern coast of Mexico late Monday night, and local officials are asking residents to prepare for possible flooding and life-threatening mudslides as the storm … [+1869 chars]",,en,'flooding mudslide'
https://www.yahoo.com/news/severe-storms-flash-flooding-bring-154445060.html,https://www.yahoo.com/news/severe-storms-flash-flooding-bring-154445060.html,0,www.yahoo.com,"Severe storms, flash flooding to bring July Fourth holiday travel hassles","Locally severe thunderstorms and flash flooding are set to disrupt travel and holiday plans across the East, central U.S., and parts of the Southwest in the ...",https://media.zenfs.com/en/accuweather_articles_339/3c0bc4f800f8888da871cc48989c4cd5,2025-07-01T15:44:45Z,,"It's already been a busy year for severe weather, and there will be no let-up with severe thunderstorms and localized flash flooding that can bring dangers and travel disruptions in the days leading … [+4304 chars]",,en,'flooding storm'
https://www.pbs.org/newshour/world/hurricane-flossie-strengthens-to-category-2-off-mexicos-pacific-coast,https://www.pbs.org/newshour/world/hurricane-flossie-strengthens-to-category-2-off-mexicos-pacific-coast,0,www.pbs.org,Hurricane Flossie strengthens to Category 2 off Mexico’s Pacific coast,"Heavy rainfall of up to 6 inches is expected in several Mexican states, potentially causing flooding and mudslides.",https://d3i6fh83elv35t.cloudfront.net/static/2025/07/2025-06-30T002732Z_693301729_RC2GCFAE07QI_RTRMADP_3_STORM-FLOSSIE-MEXICO-1024x671.jpg,2025-07-01T16:44:26Z,,"MIAMI (AP) Hurricane Flossie strengthened to a Category 2 cyclone Tuesday morning off the Pacific coast of Mexico, forecasters said.
READ MORE: Tropical Storm Andrea, first of Atlantic hurricane sea… [+779 chars]",,en,'flooding rain'
https://www.newsweek.com/dangerous-flash-floods-washington-dc-2093127,https://www.newsweek.com/dangerous-flash-floods-washington-dc-2093127,0,www.newsweek.com,Dangerous Flash Flooding Could Hit US Capital: What to Know,"As much as 5 inches of rain could fall in parts of the Washington, D.C., area on Tuesday, posing a risk for flash floods.",https://d.newsweek.com/en/full/2674806/flash-flooding-washington-dc.jpg,2025-07-01T17:32:07Z,,"A Tuesday forecast issued by the National Weather Service (NWS) predicts excessive rainfall in Washington, D.C., on Tuesday, which could potentially develop into flash flooding.
Up to 3 inches of ra… [+3258 chars]",,en,'floods'
https://biztoc.com/x/91b731cdde1d5097,https://biztoc.com/x/91b731cdde1d5097,0,biztoc.com,Dangerous Flash Flooding Could Hit US Capital: What to Know,"As much as 5 inches of rain could fall in parts of the Washington, D.C., area on Tuesday, posing a risk for flash floods.",https://biztoc.com/cdn/950/og.png,2025-07-01T17:42:25Z,,"As much as 5 inches of rain could fall in parts of the Washington, D.C., area on Tuesday, posing a risk for flash floods.
This story appeared on newsweek.com, 2025-07-01 17:32:07.",,en,'floods'
https://rollingout.com/2025/07/01/emergency-flash-flood-threaten-allegheny/,https://rollingout.com/2025/07/01/emergency-flash-flood-threaten-allegheny/,0,rollingout.com,Emergency flash floods threaten Allegheny residents,"Allegheny County residents found themselves under an urgent flash flood warning as dangerous weather conditions swept through the region, creating potentially life-threatening situations for thousands of families across western Pennsylvania. The emergency ale…",https://rollingout.com/wp-content/uploads/2025/07/shutterstock_2467206491-scaled.jpg,2025-07-01T18:23:06Z,,"Allegheny County residents found themselves under an urgent flash flood warning as dangerous weather conditions swept through the region, creating potentially life-threatening situations for thousand… [+11459 chars]",,en,'floods'
https://www.dw.com/en/fact-check-how-to-spot-ai-generated-newscasts/a-73053782,https://www.dw.com/en/fact-check-how-to-spot-ai-generated-newscasts/a-73053782,0,www.dw.com,Fact check: How to spot AI-generated newscasts,AI-generated newscasts are getting harder to spot — and they're flooding your feed. Here's how to avoid falling for the fakes.,https://static.dw.com/image/73060990_6.jpg,2025-07-02T15:24:00Z,,"On TikTok
, a reporter stands in front of a traditional red Royal Mail pillar box, with British flags fluttering in the background and a microphone in hand. He asks a female passerby who she plans t… [+7148 chars]",,en,'flooding'
https://www.thedailybeast.com/huge-setback-for-trump-with-alligator-alcatraz-already-flooding/,https://www.thedailybeast.com/huge-setback-for-trump-with-alligator-alcatraz-already-flooding/,0,www.thedailybeast.com,Huge Setback for Trump With Alligator Alcatraz Already Flooding,"Florida’s much-hyped ICE detention center cannot even keep the rain out. Videos from the so-called Alligator Alcatraz, which President Donald Trump visited...",https://s.yimg.com/ny/api/res/1.2/paqCgOhtYIr_3W8OynNfXA--/YXBwaWQ9aGlnaGxhbmRlcjt3PTEyMDA7aD02NzU7Y2Y9d2VicA--/https://media.zenfs.com/en/thedailybeast.com/9b1023d01a02ff231655da7629c2a991,2025-07-02T16:07:17Z,,"Floridas much-hyped ICE detention center cannot even keep the rain out.
Videos from the so-called Alligator Alcatraz, which President Donald Trump visited on Tuesday to mark its opening, show that t… [+2743 chars]",,en,'flooding'
https://www.newsweek.com/wildfire-arizona-new-mexico-flood-risk-heavy-rainfall-2093795,https://www.newsweek.com/wildfire-arizona-new-mexico-flood-risk-heavy-rainfall-2093795,0,www.newsweek.com,Heavy Rain Expected to Flood Two States After Wildfires,"Wildfires can damage local vegetation and change soil characteristics, making the area more vulnerable to flash floods.",https://d.newsweek.com/en/full/2675847/wildfire-burn-scars-flash-flooding.jpg,2025-07-02T18:07:50Z,,"Two states are at an increased risk of flash floods on Wednesday amid excessive rainfall, the National Weather Service (NWS) said in a Wednesday forecast.
Burn scars in Southeastern Arizona and Sout… [+2978 chars]",,en,'floods'
https://newrepublic.com/post/197552/trump-alligator-alcatraz-flood,https://newrepublic.com/post/197552/trump-alligator-alcatraz-flood,0,newrepublic.com,Trump’s “Alligator Alcatraz” Is Already Flooding,"The monstrous, recently constructed immigrant detention facility in the Florida Everglades, flippantly dubbed “Alligator Alcatraz,” literally took on water within a day of President Trump visiting the camp Tuesday to commemorate its planned Wednesday opening.…",https://images.newrepublic.com/69ad55e79c90dafb9e72843addc93a16bfb75592.jpeg?w=1200&h=630&crop=faces&fit=crop&fm=jpg,2025-07-02T18:52:23Z,,"After a video recirculated of Zohran Mamdani eating food with his hands, many MAGA figures revealed their inability to engage with New York Citys Democratic mayoral nominee without being sent into a … [+1810 chars]",,en,'flooding'
https://www.yahoo.com/news/chinas-north-west-alert-sweeping-012114004.html,https://www.yahoo.com/news/chinas-north-west-alert-sweeping-012114004.html,0,www.yahoo.com,China's north and west on alert after sweeping rains trigger deadly floods,BEIJING (Reuters) -China's north and west braced for flash floods and landslides on Thursday as annual 'Plum Rains' left a trail of destruction and prompted ...,https://s.yimg.com/cv/apiv2/social/images/yahoo_default_logo-1200x1200.png,2025-07-03T01:21:14Z,,BEIJING (Reuters) -China's north and west braced for flash floods and landslides on Thursday as annual 'Plum Rains' left a trail of destruction and prompted the mobilisation of thousands of rescue wo… [+1562 chars],,en,'floods'
https://www.channelnewsasia.com/east-asia/china-north-west-sweep-raina-trigger-deadly-floods-5217651,https://www.channelnewsasia.com/east-asia/china-north-west-sweep-raina-trigger-deadly-floods-5217651,0,www.channelnewsasia.com,China's north and west on alert after sweeping rains trigger deadly floods,BEIJING: China's north and west braced for flash floods and landslides on Thursday (Jul 3) as annual 'Plum Rains' left a trail of destruction and prompted the mobilisation of thousands of rescue workers to pull people from floodwaters. Red alerts were issued …,"https://dam.mediacorp.sg/image/upload/s--4FZajDyF--/fl_relative,g_south_east,l_mediacorp:cna:watermark:2024-04:reuters_1,w_0.1/f_auto,q_auto/c_fill,g_auto,h_676,w_1200/v1/mediacorp/cna/image/2025/07/03/2025-07-02t205608z_1_lop000r0ggs38_rtrmadp_baseimage-960x540_china-heavy-rain-rescue.jpg?itok=1_VDYAE0",2025-07-03T02:18:00Z,,BEIJING: China's north and west braced for flash floods and landslides on Thursday (Jul 3) as annual 'Plum Rains' left a trail of destruction and prompted the mobilisation of thousands of rescue work… [+1497 chars],,en,'floods'
https://www.aljazeera.com/news/2025/7/3/chinas-north-and-west-on-red-alert-for-heavy-rains-after-deadly-floods,https://www.aljazeera.com/news/2025/7/3/chinas-north-and-west-on-red-alert-for-heavy-rains-after-deadly-floods,0,www.aljazeera.com,China’s north and west on red alert for heavy rains after deadly floods,Weather warnings come as Vice Premier Zhang Guoqing urges officials in Hebei province to up their evacuation efforts.,https://www.aljazeera.com/wp-content/uploads/2025/07/afp_68661a7da489-1751521917.jpg?resize=1920%2C1440,2025-07-03T06:55:36Z,,"Northern and western China remain on high alert as torrential rain threatens to bring more flash flooding and landslides, following weather-related deaths in other parts of the country.
Red alerts w… [+1728 chars]",,en,'flooding rain'
https://abcnews.go.com/International/video/story-building-collapses-river-southern-china-123441066,https://abcnews.go.com/International/video/story-building-collapses-river-southern-china-123441066,0,abcnews.go.com,WATCH: Five-story building collapses into river in southern China,A building under construction collapsed into a nearby river as the ground beneath it suddenly gave way amid flash floods in the region.,https://i.abcnewsfe.com/a/f42f54de-3c49-4570-9ca9-eaec564ac1f3/250703_abc_soc_china_building_hpMain_9x16.jpg?w=992,2025-07-03T10:45:56Z,,"<ul><li>Diddy denied bail after jurys decision clears him of most serious charges
</li><li>Can Combs' career survive the graphic and disturbing testimony presented at trial?
</li><li>House races to… [+4441 chars]",,en,'floods'
https://iasbaba.com/2025/07/day-26-q-3-disaster-preparedness-is-the-first-step-in-any-disaster-management-process-explain-how-hazard-zonation-mapping-will-help-in-disaster-mitigation-in-the-case-of-floods-150-words-10-ma/,https://iasbaba.com/2025/07/day-26-q-3-disaster-preparedness-is-the-first-step-in-any-disaster-management-process-explain-how-hazard-zonation-mapping-will-help-in-disaster-mitigation-in-the-case-of-floods-150-words-10-ma/,0,iasbaba.com,"Day 26 – Q. 3. Disaster preparedness is the first step in any disaster management process. Explain how hazard zonation mapping will help in disaster mitigation in the case of floods. (150 words, 10 marks)","Q. 3. Disaster preparedness is the first step in any disaster management process. Explain how hazard zonation mapping will help in disaster mitigation in the case of floods. (150 words, 10 marks)  
The post Day 26 – Q. 3. Disaster preparedness is the first st…",,2025-07-03T15:04:38Z,,"Q. 3. Disaster preparedness is the first step in any disaster management process. Explain how hazard zonation mapping will help in disaster mitigation in the case of floods. (150 words, 10 marks)",,en,'floods'
https://phys.org/news/2025-07-women-disaster-stricken-communities.html,https://phys.org/news/2025-07-women-disaster-stricken-communities.html,0,phys.org,"How women step in, and step up, to support their disaster-stricken communities","When flooding strikes, our screens fill with scenes of devastated victims, and men performing heroic dinghy rescues in swollen rivers. But another story often goes untold: how women step in, and step up, to hold their stricken communities together.",https://scx2.b-cdn.net/gfx/news/hires/2025/woman-aid-worker.jpg,2025-07-03T15:14:04Z,,"When flooding strikes, our screens fill with scenes of devastated victims, and men performing heroic dinghy rescues in swollen rivers. But another story often goes untold: how women step in, and step… [+6377 chars]",,en,'floods'
https://insidethemagic.net/2025/07/epic-universe-entrance-flooding-emd1/,https://insidethemagic.net/2025/07/epic-universe-entrance-flooding-emd1/,0,insidethemagic.net,Flooding Leads To Closed Epic Universe Entrance for Thousands of Guests,"Torrential flooding has led to an Epic Universe entrance being blocked by water, leading to the entrance to the park being closed until further notice. But that’s not all as a potential tropical storm approaches Central Florida. Epic Universe Entrance Gone an…",https://insidethemagic.net/wp-content/uploads/2025/05/epic-universe-14.jpg,2025-07-03T22:16:17Z,,"Torrential flooding has led to an Epic Universe entrance being blocked by water, leading to the entrance to the park being closed until further notice. But that’s not all as a potential tropical stor… [+4886 chars]",,en,'flooding storm'
https://www.abc.net.au/news/2025-07-04/category-d-funding-approved-for-flood-affected-nsw-farmers/105473920,https://www.abc.net.au/news/2025-07-04/category-d-funding-approved-for-flood-affected-nsw-farmers/105473920,0,www.abc.net.au,"After two protest rallies, flood-affected farmers get $75,000 grants",The high-level funding comes after communities in Kempsey and Taree called on the state and federal governments to provide more support in the wake of May's record floods.,https://live-production.wcms.abc-cdn.net.au/5ba9fbcc719bdb027c997aae7454a6a9?impolicy=wcms_watermark_news&cropH=2813&cropW=5000&xPos=0&yPos=0&width=862&height=485&imformat=generic,2025-07-03T22:37:08Z,,"The New South Wales and federal governments are to make grants of up to $75,000 available to farmers affected by record floods that hit the Mid North Coast and Hunter regions in May.
The decision co… [+2831 chars]",,en,'floods'
https://economictimes.indiatimes.com/news/international/us/july-4th-travel-faces-massive-storm-disruptions-expert-tips-for-navigating-the-holiday-rush/articleshow/122238436.cms,https://economictimes.indiatimes.com/news/international/us/july-4th-travel-faces-massive-storm-disruptions-expert-tips-for-navigating-the-holiday-rush/articleshow/122238436.cms,0,economictimes.indiatimes.com,July 4th travel faces massive storm disruptions: Expert tips for navigating the holiday rush,Travel plans face disruption in the Northeast due to severe storms during the Fourth of July. Millions are travelling. Storms bring strong winds and possible flooding. Airports face delays and cancellations. Travellers should check flight status and prepare f…,"https://img.etimg.com/thumb/msid-122238448,width-1200,height-630,imgsize-213280,overlay-economictimes/articleshow.jpg",2025-07-04T01:32:07Z,,"(Catch all the US News, UK News, Canada News, International Breaking News Events, and Latest News Updates on The Economic Times.)
Download The Economic Times News App to get Daily International News… [+8 chars]",,en,'flooding'
https://www.indiatoday.in/business/personal-finance/story/gold-gathering-dust-in-locker-financial-advisor-explains-how-to-make-it-work-2750539-2025-07-04,https://www.indiatoday.in/business/personal-finance/story/gold-gathering-dust-in-locker-financial-advisor-explains-how-to-make-it-work-2750539-2025-07-04,0,www.indiatoday.in,Gold gathering dust in locker? Financial advisor explains how to make it work,A financial advisor has warned that family gold stored in lockers faces risk from rust floods and poor insurance He explains how a scheme can offer safety and steady returns instead,https://akm-img-a-in.tosshub.com/indiatoday/images/story/202507/gold-price-today-020631260-16x9.jpg?VersionId=.cBYcxa4rF3klIXnHnbpSuya_W5ol7Ft,2025-07-04T05:15:03Z,,"What happens when the gold meant to secure your future quietly begins to decay in a bank locker?
Financial advisor Lovish Anand recently shared the story of a close friend who discovered that her fa… [+3286 chars]",,en,'floods'
