index,published,keyword,domain,language,valid,title,description,url,image,archive,content,quote
f2fc40d889d7d7a2376676cd3c3d40ad,2025-11-01T03:52:35Z,'flooding relief',www.forbes.com,en,0.1,How Island Nations Can Build Back Stronger After Hurricane Melissa,"Hurricane Melissa exposed the urgent need for island nations to rebuild stronger through resilient infrastructure, nature-based defenses, transparency, and smart finance.",https://www.forbes.com/sites/dianneplummer/2025/10/31/how-island-nations-can-build-back-stronger-after-hurricane-melissa/,https://imageio.forbes.com/specials-images/imageserve/6905827101bd8d2d5533fb0d/0x0.jpg?format=jpg&height=900&width=1600&fit=bounds,,"TOPSHOT - An aerial view seen October 29, 2025 shows the destroyed Black River Market and surrounding buildings following the passage the previous day of Hurricane Melissa in Black River, St. Elizabe… [+5583 chars]",
27178b454978090bc1f4dfb1f39830eb,2025-11-01T07:53:18Z,'floods',en.antaranews.com,en,1.0,"Jakarta told to brace for floods, landslides amid heavy rains",A regional lawmaker has urged the Jakarta government to take early measures against potential floods and landslides as the capital faces extreme ...,https://en.antaranews.com/news/389397/jakarta-told-to-brace-for-floods-landslides-amid-heavy-rains,https://cdn.antaranews.com/cache/1200x800/2025/11/01/IMG-20251101-WA0019.jpg,,Jakarta (ANTARA) - A regional lawmaker has urged the Jakarta government to take early measures against potential floods and landslides as the capital faces extreme weather.In a statement received on … [+1911 chars],
d8cc976cfe32d1f67f1e61fdf1697620,2025-11-01T13:29:19Z,'deluge',biztoc.com,en,0.0,"JD Vance Dresses As His Own Meme, Sparks Meme Avalanche",Halloween posts from the Vice President led to a deluge of memes across social media.,https://biztoc.com/x/3e630012b9b1d92e,https://biztoc.com/cdn/950/og.png,,"Halloween posts from the Vice President led to a deluge of memes across social media.
This story appeared on newsweek.com, 2025-11-01 13:26:12.",
5d3e78fb578262e31467e9cf64ce7dd2,2025-11-01T15:00:00Z,'deluge',me.pcmag.com,en,0.0,Don't Miss Out: 8 Big Video Game Releases You'll Want to Play in November,"Call of Duty: Black Ops 7, Hyrule Warriors: Age of Imprisonment, and Kirby Air Riders are just three of the hottest video games launching this month.
The video game deluge continues into November, bringing a fresh batch of must-play titles across all major pl…",https://me.pcmag.com/en/games/33226/dont-miss-out-8-big-video-game-releases-youll-want-to-play-in-november,https://sm.pcmag.com/t/pcmag_me/news/d/dont-miss-/dont-miss-out-8-big-video-game-releases-youll-want-to-play-i_4ypw.1200.jpg,,"The video game deluge continues into November, bringing a fresh batch of must-play titles across all major platforms: the shiny new Nintendo Switch 2, PC, PlayStation 5, and Xbox Series X/S. Sate you… [+4766 chars]",
316f3c1aedc95a1f8685c6608d2e27f3,2025-11-01T15:00:00Z,'deluge',uk.pcmag.com,en,0.0,Don't Miss Out: 8 Big Video Game Releases You'll Want to Play in November,"Call of Duty: Black Ops 7, Hyrule Warriors: Age of Imprisonment, and Kirby Air Riders are just three of the hottest video games launching this month.
The video game deluge continues into November, bringing a fresh batch of must-play titles across all major pl…",https://uk.pcmag.com/games/161040/dont-miss-out-8-big-video-game-releases-youll-want-to-play-in-november,https://sm.pcmag.com/t/pcmag_uk/news/d/dont-miss-/dont-miss-out-8-big-video-game-releases-youll-want-to-play-i_5zau.1200.jpg,,"The video game deluge continues into November, bringing a fresh batch of must-play titles across all major platforms: the shiny new Nintendo Switch 2, PC, PlayStation 5, and Xbox Series X/S. Sate you… [+4766 chars]",
ffb16be71e2c5c3780cd5bb6d479e6f8,2025-11-01T15:12:22Z,'tidal surge',theintercept.com,en,0.1,Inside the World of Leftist Gun Nuts,"Graham Platner’s firearms trainings are only the most public example of the left’s efforts to arm themselves.
The post Inside the World of Leftist Gun Nuts appeared first on The Intercept.",https://theintercept.com/2025/11/01/left-gun-ownership/,https://theintercept.com/wp-content/uploads/2025/10/GettyImages-2151693373-e1761945637557.jpg?fit=6720%2C3360&w=1200&h=800,,"Tom Nguyen, left, the founder of LA Progressive Shooters, instructs Daniel Villalpando, 16, right, during a firearms education course at Burro Canyon Shooting Park in Azusa, Calif., on Oct. 29, 2023.… [+11535 chars]",
42b2a85013dbe9e2bf8f04db2ae933b7,2025-11-01T16:53:00Z,'flooding',gothamist.com,en,0.0,Victims of NYC storm were handymen who helped around their buildings,"The basement apartment where Aaron Akaberi died during heavy rain.
 

Juan Carlos Montoya Hernandez died attempting to perform electrical repairs during the storm. Aaron Akaberi died trying to rescue his pit bull from a flooding apartment. [ more › ]",https://gothamist.com/news/victims-of-nyc-storm-were-handymen-who-helped-around-their-buildings,https://api-prod.gothamist.com/images/353928/fill-1200x650|format-webp|webpquality-85/,,"The two men who died in flooded basements as intense rain pounded New York City on Thursday were handymen in their respective buildings familiar faces who could be called on to help out in a pinch, r… [+5047 chars]",
017cb41c870b43200c2b23a947fed374,2025-11-01T20:53:17Z,'flooding mudslide',www.bbc.com,en,0.1,Kenyan landslide kills 21 after heavy rainfall,Kenya's government says 30 other people are missing following downpours in the west of the country.,https://www.bbc.com/news/articles/c20eeqn2qlyo,https://ichef.bbci.co.uk/news/1024/branded_news/99e2/live/c6eda100-b764-11f0-b8ce-31e36e4a3dbe.jpg,http://web.archive.org/web/20251102214217/https://www.bbc.com/news/articles/c20eeqn2qlyo,"The Kenyan government has confirmed that 21 people have died following a landslide in the western part of the country after heavy rainfall. 
Interior Minister Kipchumba Murkomen said the bodies had … [+1674 chars]",
8df2c362ce5895d2aa53838195b5d593,2025-11-02T01:20:27Z,'flooding relief',www.cbsnews.com,en,0.1,Jamaica relief efforts continue in aftermath of Hurricane Melissa,Rescuers and aid workers fanned out across Jamaica on Saturday to distribute food and water and reach communities still isolated four days after Hurricane Melissa hit the island.,https://www.cbsnews.com/news/jamaica-relief-efforts-continue-aftermath-of-hurricane-melissa/,https://assets2.cbsnewsstatic.com/hub/i/r/2025/11/02/569fa185-8006-45ba-bd58-6ebc038fbb9d/thumbnail/1200x630/fb089cc99caa410500ec16303f55a4dc/gettyimages-2243939755.jpg,,"Rescuers and aid workers fanned out across Jamaica on Saturday to distribute food and water and reach communities still isolated four days after Hurricane Melissa hit the island.
One of the stronges… [+6821 chars]",
4d7e3572de306b0eb590278daaa18ae0,2025-11-02T02:38:49Z,'flooding',www.aljazeera.com,en,1.0,"Landslides in Kenya’s Rift Valley leave 21 dead, 30 others missing",Aerial footage from Elgeyo-Marakwet County shows massive mudslides and flash flooding stretching over vast distances.,https://www.aljazeera.com/news/2025/11/2/landslides-in-kenyas-rift-valley-leave-21-dead-30-others-missing,https://www.aljazeera.com/wp-content/uploads/2025/11/2025-11-01T110505Z_2107970014_RC2MNHA8C37L_RTRMADP_3_KENYA-LANDSLIDE-1762049827.jpg?resize=1200%2C675,,"Heavy rains have triggered landslides in Kenyas western Rift Valley region, killing at least 21 people and destroying more than 1,000 homes, according to officials.
Kenyan Cabinet Secretary for the … [+1818 chars]",
6fb69d41f2e1eb6adb98328aecdd8341,2025-11-02T04:17:20Z,'flooding',www.digitaljournal.com,en,0.0,Vietnam flood death toll rises to 35: disaster agency,"Record heavy rains and flooding in central Vietnam this week have killed 35 people, disaster management officials said Sunday, with five more still missing in the deluge. Heavy rain has pummelled Vietnam’s coastal provinces since last weekend, with a record o…",https://www.digitaljournal.com/world/vietnam-flood-death-toll-rises-to-35-disaster-agency/article,https://www.digitaljournal.com/wp-content/uploads/2025/11/de8711673529da2d34bbbca0ce226764fc1256c2.jpg,,"Floodwaters inundating streets and buildings following heavy rains in Hoi An on October 30, 2025 - Copyright AFP NHAC NGUYEN
Record heavy rains and flooding in central Vietnam this week have killed … [+854 chars]",
0504cd10d0e369190ddd1aa461a218c7,2025-11-02T10:51:00Z,'flooding mudslide',www.thestar.com.my,en,0.1,Kenya landslide death toll rises to 22,"(Reuters) -The death toll from a landslide in western Kenya's Rift Valley has risen to 22, a government spokesperson said on Sunday, following heavy rains on Saturday. Read full story",https://www.thestar.com.my/news/world/2025/11/02/kenya-landslide-death-toll-rises-to-22,https://cdn.thestar.com.my/Themes/img/newTsol_logo_socmedia.png,,"(Reuters) -The death toll from a landslide in western Kenya's Rift Valley has risen to 22, a government spokesperson said on Sunday, following heavy rains on Saturday.
Twenty-nine people were still … [+775 chars]",
be2ce04dcb8088f64805883ae4cc182e,2025-11-02T17:25:00Z,'flooding mudslide',news.sky.com,en,1.0,At least 26 people dead after Kenya landslide,"Heavy rains are continuing across the country, with floods reported in several counties, and thousands of people displaced.",https://news.sky.com/story/at-least-26-people-dead-after-kenya-landslide-13462792,https://e3.365dm.com/25/11/1600x900/skynews-kenya-landslides_7069982.jpg?20251102173450,,"At least 26 people have died and 25 others are still missing after a landslide in western Kenya during heavy rains. 
The government has stepped up the search mission, with four military planes deplo… [+1863 chars]",
d78abf15b984e5afe85af92dfcd3cb47,2025-11-03T02:05:07Z,'deluge',timesofindia.indiatimes.com,en,0.0,"IPO deluge: Four new-age cos set to raise over 20,000 crore in November","India Business News: MUMBAI: It's a busy Nov for startups on Dalal Street. Lenskart, Groww, Pine Labs and PhysicsWallah, all of which are headed for listing on the bourses.",https://timesofindia.indiatimes.com/business/india-business/ipo-deluge-four-new-age-cos-set-to-raise-over-20000-crore-in-november/articleshow/125044816.cms,"https://static.toiimg.com/thumb/msid-125044847,width-1070,height-580,imgsize-988162,resizemode-75,overlay-toi_sw,pt-32,y_pad-40/photo.jpg",,EMI CalculatorDetermine the monthly installment amount for a loan,
4cad39d8b79b054e3ed1ecac9b8db2dc,2025-11-03T05:01:00Z,'deluge',digiday.com,en,0.1,"Target layoffs hit almost all corners of the business, from merchants to engineers",The move is expected to have a noticeable impact on the workloads and sentiment of those who remain with the company.,http://digiday.com/marketing/target-layoffs-hit-almost-all-corners-of-the-business-from-merchants-to-engineers/,https://digiday.com/wp-content/uploads/sites/3/2023/11/industry-layoffs-digiday.jpg,,"Targets widespread corporate layoffs this week trimmed down teams throughout the company, leaving some who remain picking up responsibilities from those affected.The layoffs included employees spanni… [+9131 chars]",
6563f8343893edcf4f0f634c52890889,2025-11-03T09:00:55Z,'deluge',www.pymnts.com,en,0.0,CE 100 Index Sinks 2.5% Despite Big Tech’s Earnings Bump,"Earnings season was the dominant force this past week, and Big Tech dominated the deluge of quarterly reports. By and large, the performance of the majority of pillars in the CE 100 Index was to the downside, as the overall index slipped 2.5%. The Live pillar…",https://www.pymnts.com/connectedeconomy/2025/ce-100-index-sinks-2-5-despite-big-techs-earnings-bump/,https://www.pymnts.com/wp-content/uploads/2025/11/CE-100-Index-1103.jpg,,"Earnings season was the dominant force this past week, and Big Tech dominated the deluge of quarterly reports.By and large, the performance of the majority of pillars in the CE 100 Index was to the d… [+5279 chars]",
f9960c51d7c6b70656e4cadab4a7be28,2025-11-03T09:05:00Z,'floods',www.dw.com,en,1.0,Spain regional chief resigns over Valencia flood response,The regional president of Spain's Valencia region has stepped down amid public outrage over his handling of the 2024 disaster. The floods killed more than 200 people and caused billions of euros in damage.,https://www.dw.com/en/spain-regional-chief-resigns-over-valencia-flood-response/a-74593791,https://static.dw.com/image/70684155_6.jpg,,"Valencia's regional leader, Carlos Mazon, on Monday announced his resignation after intense criticism of his administration's response to the catastrophic floods that struck a year ago.
The torrenti… [+1360 chars]",
df2ba5991c902d64bcd37c5b7a34f04f,2025-11-03T09:30:00Z,'flooding relief',grist.org,en,0.1,Native Alaska villages were already on the frontlines of climate change. Then a typhoon hit.,"As Typhoon Halong swept through western Alaska, it laid bare how centuries-old policies made Native villages particularly vulnerable to climate change.",https://grist.org/indigenous/native-alaska-villages-were-already-on-the-frontlines-of-climate-change-then-a-typhoon-hit/,https://grist.org/wp-content/uploads/2025/10/AP25286797276397-e1761946526322.jpg?quality=75&strip=all,http://web.archive.org/web/20251103203629/https://grist.org/indigenous/native-alaska-villages-were-already-on-the-frontlines-of-climate-change-then-a-typhoon-hit/,"A week after Typhoon Halong passed through Japan in early October, its remnants crossed the Pacific and struck western Alaska. Nearly 50 Alaska Native communities across the Yukon-Kuskokwim Delta nea… [+5683 chars]",
038fe52518329422ce459110ec02cc4d,2025-11-03T09:51:36Z,'deluge',biztoc.com,en,0.0,CE 100 Index Sinks 2.5% Despite Big Tech’s Earnings Bump,"Earnings season was the dominant force this past week, and Big Tech dominated the deluge of quarterly reports.
 
 
 
 
By and large, the performance of the majority of pillars in the CE 100 Index was to the downside, as the overall index slipped 2.5%.
The Liv…",https://biztoc.com/x/5090a15f4d313d25,https://biztoc.com/cdn/950/og.png,,"Earnings season was the dominant force this past week, and Big Tech dominated the deluge of quarterly reports.
By and large, the performance of the majority of pillars in the CE 100 Index was to the… [+131 chars]",
04f0474477db93593ae7a472dfefe033,2025-11-03T10:00:10Z,'floods',www.yahoo.com,en,0.0,Vietnam flood death toll rises to 37 as a new typhoon threatens to worsen devastation,"Rescuers and aid workers in central Vietnam raced to reach isolated area that were battered by floods and landslides, killing at least 37 people, as another ...",https://www.yahoo.com/news/articles/vietnam-flood-death-toll-rises-100010228.html,https://s.yimg.com/ny/api/res/1.2/qQEJqmOK3g1KMOk7vNq8nw--/YXBwaWQ9aGlnaGxhbmRlcjt3PTEyMDA7aD04MTE7Y2Y9d2VicA--/https://media.zenfs.com/en/ap.org/adf6d9a56c1e1ba89c07b3d64fc0a401,,"HANOI, Vietnam (AP) Rescuers and aid workers in central Vietnam raced to reach isolated area that were battered by floods and landslides, killing at least 37 people, as another typhoon was on track t… [+2502 chars]",
82e9119b5123811cd9bb0f0c02b58231,2025-11-03T10:21:41Z,'flooding death',abcnews.go.com,en,0.0,Vietnam flood death toll rises to 37 as a new typhoon threatens to worsen devastation,Rescuers and aid workers in central Vietnam are racing to reach isolated areas hit by floods and landslides,https://abcnews.go.com/International/wireStory/vietnam-flood-death-toll-rises-37-new-typhoon-127124725,https://i.abcnewsfe.com/a/41aa2681-f82a-468c-b37c-619a73a4db02/wirestory_1d0f0ed7931f6e06a3d5b63375d25eaa_16x9.jpg?w=1600,,"HANOI, Vietnam -- Rescuers and aid workers in central Vietnam raced to reach isolated area that were battered by floods and landslides, killing at least 37 people, as another typhoon was on track to … [+2504 chars]",
5af935b848d64e5a0c31261afd064a8b,2025-11-03T10:50:46Z,'floods',www.abc.net.au,en,0.0,Leader of Spain's Valencia region resigns over handling of 2024's deadly floods,"The flash floods hit Spain's south-eastern regions on October 29, 2024, killing 229 people.",https://www.abc.net.au/news/2025-11-03/valencia-leader-resigns-carlos-mazon-floods/105967614,https://live-production.wcms.abc-cdn.net.au/c59b7455dcc2a948206c0bb26e588df8?impolicy=wcms_watermark_news&cropH=2813&cropW=5000&xPos=0&yPos=260&width=862&height=485&imformat=generic,,"The leader of Spain's Valencia region, Carlos Mazon, is resigning over his administration's handling of last year's catastrophic floods. 
The flash floods hit Spain's south-eastern regions on Octobe… [+2675 chars]",
b563a68d6c4af53a886ff2d60d0310d2,2025-11-03T13:36:36Z,'flooding area',www.euractiv.com,en,1.0,"Spain regional leader resigns, a year after deadly floods","""I know I made mistakes. I acknowledge them and I will live with them all my life,"" the leader said",https://www.euractiv.com/news/spain-regional-leader-resigns-a-year-after-deadly-floods/,https://www.euractiv.com/content/uploads/sites/2/2025/11/GettyImages-2244748865-1.jpg,,"The heavily criticised leader of Spain’s Valencia region said on Monday he was stepping down, a year after the area was hit by floods that were the country’s deadliest natural disaster in a generatio… [+2482 chars]",
1bc5c67af26d4254598d7e0b7d4fd50d,2025-11-03T18:33:22Z,'deluge',asteriskmag.com,en,0.1,Is the Internet Making Culture Worse?,The decline of criticism might explain the sense that our culture is stagnating. How can we bring it back?,https://asteriskmag.com/issues/12-books/is-the-internet-making-culture-worse,https://asteriskmag.com/media/pages/issues/12-books/is-the-internet-making-culture-worse/68186439f7-1761945233/copy-of-copy-of-copy-of-copy-of-copy-of-copy-of-copy-of-copy-of-copy-of-copy-of-copy-of-happy-independence-day-1200x630-crop.png,,"I dont remember reading any great novels in the 90s. Or listening to any good albums, either. Its not the decades fault, its mine: I was born in 1993. By the time I could read books and choose my own… [+34229 chars]",
2d8424db2e720bc0a5c1e6fff41bfe03,2025-11-03T18:59:00Z,'flooding relief',www.snopes.com,en,0.1,Did Steven Tyler send helicopters loaded with aid to Jamaica?,"The story claimed that within just 24 hours, Tyler organized a fleet of helicopters filled with generators, food, clean water and medical supplies.",https://www.snopes.com//fact-check/jamiaca-aid-steven-tyler/,https://mediaproxy.snopes.com/width/1200/https://media.snopes.com/2025/11/rock_revival_60s-90s.png,,"Claim:
In November 2025, rock singer Steven Tyler sent helicopters loaded with aid to Jamaica.
In early November 2025, social media users began sharing a claim that rock singer Steven Tyler was hel… [+6608 chars]",
78fdaedd3631cda561da9f4600c94720,2025-11-04T01:00:00Z,'flooding relief',www.theblaze.com,en,0.1,‘HORRIFIC’: Jamaica UNRECOGNIZABLE a week after Hurricane Melissa,"On October 28, Hurricane Melissa, the strongest storm ever to strike Jamaica as a Category 5, made landfall near Montego Bay, unleashing catastrophic damage across the island as winds peaked at 185 mph. The storm demolished thousands of homes, left entire com…",https://www.theblaze.com/shows/the-glenn-beck-program/horrific-jamaica-unrecognizable-a-week-after-hurricane-melissa,https://www.theblaze.com/media-library/image.jpg?id=62039161&width=1200&height=600&coordinates=0%2C0%2C0%2C120,,"On October 28, Hurricane Melissa, the strongest storm ever to strike Jamaica as a Category 5, made landfall near Montego Bay, unleashing catastrophic damage across the island as winds peaked at 185 m… [+3832 chars]",
45aaca10ebbfc7c7417057c4a2142149,2025-11-04T03:27:17Z,'flooding storm',www.yahoo.com,en,1.0,Floods strand people on roofs as typhoon pounds Philippines,"Residents sought refuge on rooftops and cars floated through flooded streets on Tuesday as Typhoon Kalmaegi battered the central Philippines, leaving at...",https://www.yahoo.com/news/articles/floods-strand-people-roofs-typhoon-032717383.html,https://media.zenfs.com/en/afp.com/b8ccff144ad43a94462e2f8fac8a91cb,http://web.archive.org/web/20251108205620/https://www.yahoo.com/news/articles/floods-strand-people-roofs-typhoon-032717383.html,"Residents sought refuge on rooftops and cars floated through flooded streets on Tuesday as Typhoon Kalmaegi battered the central Philippines, leaving at least two people dead.
Hundreds of thousands … [+3121 chars]",
f376661ff56b5f1c513907ec82e3e3e1,2025-11-04T03:32:20Z,'floods',www.digitaljournal.com,en,1.0,Floods strand people on roofs as typhoon pounds Philippines,"Residents sought refuge on rooftops and cars floated through flooded streets on Tuesday as Typhoon Kalmaegi battered the central Philippines, leaving at least two people dead. Hundreds of thousands have been displaced by the powerful storm, which made landfal…",https://www.digitaljournal.com/world/floods-strand-people-on-roofs-as-typhoon-pounds-philippines/article,https://www.digitaljournal.com/wp-content/uploads/2025/11/d40c4b5ced3363c7ac44338bd42be021ea32a49f.jpg,,"A motorist drives past a fallen electric post and trees on a highway in the aftermath of Typhoon Kalmaegi in Mayorga, Leyte province - Copyright AFP -
Residents sought refuge on rooftops and cars fl… [+3259 chars]",
1f24b0aa016730e51e03505669035593,2025-11-04T04:36:59Z,'flooding',www.yahoo.com,en,1.0,"Typhoon Kalmaegi leaves at least 26 dead in Philippines, with survivors trapped on roofs and in cars","Typhoon Kalmaegi has left at least 26 people dead in the Philippines, mostly in flooding set off by the storm, which barreled across the central part of the ...",https://www.yahoo.com/news/articles/typhoon-kalmaegi-leaves-26-dead-043659818.html,https://s.yimg.com/ny/api/res/1.2/oFVeg3x2ULg3UYwNOR2wyA--/YXBwaWQ9aGlnaGxhbmRlcjt3PTEyMDA7aD04MDA7Y2Y9d2VicA--/https://media.zenfs.com/en/ap_finance_articles_694/ef31038ce5287f2cc501d17774f5ff8e,,"MANILA, Philippines (AP) Typhoon Kalmaegi has left at least 26 people dead in the Philippines, mostly in flooding set off by the storm, which barreled across the central part of the country on Tuesda… [+4010 chars]",
b82278e63d9168b0c4c03a10c5e14079,2025-11-04T06:07:42Z,'floods',www.bbc.com,en,1.0,Wildfires and floods cost emergency services £11m,Calls are being made by London Fire Brigade for more investment in climate change resilience.,https://www.bbc.com/news/articles/cdrzzjmy73eo,https://ichef.bbci.co.uk/news/1024/branded_news/bb2e/live/de10e480-b685-11f0-b027-61021c9d4006.jpg,,"Kumail JafferLocal Democracy Reporting Service, City Hall
Firefighters are having to tackle large fires like this at Beam Park, Dagenham 
London's emergency services have spent more than £11m respo… [+2422 chars]",
b946f39de3e2a4211822ae0e05d25f95,2025-11-04T06:23:37Z,'flooding',www.aljazeera.com,en,1.0,Two dead as Typhoon Kalmaegi brings massive flooding in central Philippines,"Residents seek refuge on rooftops, and cars float through flooded streets on the island of Cebu.",https://www.aljazeera.com/news/2025/11/4/two-dead-as-typhoon-kalmaegi-brings-massive-flooding-in-central,https://www.aljazeera.com/wp-content/uploads/2025/11/AFP__20251104__82WQ2YJ__v2__MidRes__PhilippinesWeatherTyphoon-1762230819.jpg?resize=1200%2C630,,"Rain-soaked residents sought refuge on rooftops, and cars floated through flooded streets as Typhoon Kalmaegi battered central Philippines, killing at least two people, according to the national disa… [+3038 chars]",
a97f3678147cb07cf9dc79a99986af10,2025-11-04T06:57:55Z,'deluge',www.channelnewsasia.com,en,1.0,Vietnam flood death toll hits 40 as Typhoon Kalmaegi looms,"HANOI: The death toll from a week of flooding and record rains in central Vietnam rose to 40 on Tuesday (Nov 4), authorities said, as another powerful storm bore down on the battered region.Vietnam's central belt has been deluged by torrential rains, turning …",https://www.channelnewsasia.com/asia/typhoon-kalmaegi-loom-vietnam-flood-death-toll-5444126,"https://dam.mediacorp.sg/image/upload/s--J-DjDfMb--/c_crop,h_1840,w_3272,x_0,y_72/c_fill,g_auto,h_676,w_1200/fl_relative,g_south_east,l_one-cms:core:watermark:ap_data-1,w_0.1/f_auto,q_auto/v1/mediacorp/cna/image/2025/11/04/ap25303282741204.jpg?itok=A1FBi0NL",,"HANOI: The death toll from a week of flooding and record rains in central Vietnam rose to 40 on Tuesday (Nov 4), authorities said, as another powerful storm bore down on the battered region.
Vietnam… [+959 chars]",
56f75f4ef342bdf0f8e52ed1e7895b1a,2025-11-04T07:03:21Z,'flooding brigade',en.protothema.gr,en,0.1,"Weather: Deterioration today with heavy rains and thunderstorms – The 8 areas that will be most affected, strong phenomena in Attica","Instructions of Civil Protection - ""No unprecedented bad weather is expected"", says Kallianos - Near zero minimum temperature yesterday morning
The post Weather: Deterioration today with heavy rains and thunderstorms – The 8 areas that will be most affected, …",https://en.protothema.gr/2025/11/04/weather-deterioration-today-with-heavy-rains-and-thunderstorms-the-8-areas-that-will-be-most-affected-strong-phenomena-in-attica/,https://en.protothema.gr/wp-content/uploads/2025/11/df.png,,"The National Weather Service (EMY) is warning of worsening weather today, with the peak of the weather in the afternoon hours. The strong storms, which will mainly affect Attica and the Aegean island… [+12805 chars]",
