index,published,keyword,domain,language,valid,title,description,url,image,archive,content,quote,de,en,la,added
41c58029e11ded4af3fddf5d0862ffd9,2025-11-04T12:34:24Z,'flooding victims',www.bostonherald.com,en,0.7,"Typhoon Kalmaegi leaves 26 dead in Philippines, people trapped on roofs and cars submerged",Officials said Tuesday that most of the victims were killed in flooding.,https://www.bostonherald.com/2025/11/04/typhoon-kalmaegi-philippines-aftermath/,https://www.bostonherald.com/wp-content/uploads/2025/11/Philippines_Extreme_Weather_Asia_Typhoon_42076-1-1.jpg?w=1024&h=576,http://web.archive.org/web/20251106070412/https://www.bostonherald.com/2025/11/04/typhoon-kalmaegi-philippines-aftermath/,"By JIM GOMEZ, Associated Press
MANILA, Philippines (AP) Typhoon Kalmaegi has left at least 26 people dead in the Philippines, mostly in flooding set off by the storm, which barreled across the centr… [+4180 chars]",,"Der Taifun Kalmaegi fordert auf den Philippinen 26 Tote, Menschen sind auf Dächern eingeschlossen und Autos stehen unter Wasser. Beamte sagten am Dienstag, dass die meisten Opfer bei Überschwemmungen ums Leben kamen.","Typhoon Kalmaegi leaves 26 dead in Philippines, people trapped on roofs and cars submerged. Officials said Tuesday that most of the victims were killed in flooding.","Typhoon Kalmaegi relinquit 26 in Philippinis mortuus, homines in tectis capti et carros demerguntur. Magistratus dixerunt Martis maximam partem victimarum in inundatione occisae.",2025-10-21 18:42:08+00:00
fcb5194ec582925323c5424bb531b60c,2025-11-04T13:31:52Z,'flooding',www.rte.ie,en,0.7,Typhoon flooding kills 26 in central Philippines,At least 26 people have been killed and hundreds of thousands displaced as rains driven by Typhoon Kalmaegi flooded swathes of the central Philippines.,https://www.rte.ie/news/world/2025/1104/1542119-typhoon-kalmaegi-philippines/,https://www.rte.ie/images/00236ca3-1600.jpg,,"The death toll from Typhoon Kalmaegi that hit the central Philippines has risen to 39 on the island of Cebu, a local government official has said.
The deaths were as a result of drowning and people … [+3367 chars]",,"Bei einer Taifun-Überschwemmung kommen im Zentrum der Philippinen 26 Menschen ums Leben. Mindestens 26 Menschen wurden getötet und Hunderttausende vertrieben, als vom Taifun Kalmaegi verursachte Regenfälle weite Teile der zentralen Philippinen überschwemmten.",Typhoon flooding kills 26 in central Philippines. At least 26 people have been killed and hundreds of thousands displaced as rains driven by Typhoon Kalmaegi flooded swathes of the central Philippines.,Typhon inundatio 26 in media Philippinis necat. Saltem XXVI homines interfecti sunt et centena milia luxatis sicut pluviae a Typhoon Kalmaegi inundatae fasciculis centralium Philippinarum acti sunt.,2025-10-21 18:42:08+00:00
9cb68d2f343e828172741d0812d05b79,2025-11-04T19:26:14Z,'flooding disaster',nypost.com,en,0.7,Typhoon Kalmaegi leaves at least 26 dead in Philippines after floods ravage central region,"Typhoon Kalmaegi has left at least 26 people dead in the Philippines, mostly in flooding set off by the storm, which barreled across the central part of the country, disaster response officials said.",https://nypost.com/2025/11/04/world-news/typhoon-kalmaegi-leaves-at-least-26-dead-in-the-philippines/,https://nypost.com/wp-content/uploads/sites/2/2025/11/newspress-collage-augbw06is-1762283239244.jpg?quality=75&strip=all&1762265349&w=1200,http://web.archive.org/web/20251106070054/https://nypost.com/2025/11/04/world-news/typhoon-kalmaegi-leaves-at-least-26-dead-in-the-philippines/,"MANILA, Philippines Typhoon Kalmaegi has left at least 26 people dead in the Philippines, mostly in flooding set off by the storm, which barreled across the central part of the country on Tuesday, di… [+4663 chars]",,"Taifun Kalmaegi fordert auf den Philippinen mindestens 26 Tote, nachdem Überschwemmungen die zentrale Region verwüstet haben. Der Taifun Kalmaegi hat auf den Philippinen mindestens 26 Menschen das Leben gekostet, vor allem bei den Überschwemmungen, die durch den Sturm ausgelöst wurden, der über den zentralen Teil des Landes fegte, sagten Katastrophenschutzbeamte.","Typhoon Kalmaegi leaves at least 26 dead in Philippines after floods ravage central region. Typhoon Kalmaegi has left at least 26 people dead in the Philippines, mostly in flooding set off by the storm, which barreled across the central part of the country, disaster response officials said.","Typhoon Kalmaegi relinquit saltem 26 mortuus in Philippinis postquam inundationes regionem centralem devastant. Typhoon Kalmaegi reliquit saltem XXVI homines in Philippinis mortuos, maxime in inundatione, tempestate profecti, quae per mediam partem patriae dolioli, responsum calamitatis ministri dixerunt.",2025-10-21 18:42:08+00:00
e53d0aaf0b3b38c5923d4d2a8a7916ff,2025-11-04T19:54:53Z,'flooding rain',www.abc.net.au,en,0.7,Typhoon Kalamaegi leaves dozens dead in flooding rain in Philippines,"More than 40 people are dead and hundreds of thousands displaced after rains from Typhoon Kalmaegi flooded the central Philippines, sweeping away trucks and shipping containers.",https://www.abc.net.au/news/2025-11-05/typhoon-kalamaegi-leaves-dozens-dead-in-floods-and-winds/105972498,https://live-production.wcms.abc-cdn.net.au/bc2b75df788db35b59ba50449e4207aa?impolicy=wcms_watermark_news&cropH=900&cropW=1600&xPos=0&yPos=0&width=862&height=485&imformat=generic,,"More than 40 people have died and hundreds of thousands are displaced after rains driven by Typhoon Kalmaegi flooded swathes of the central Philippines.
Entire towns on the island of Cebu were inund… [+4896 chars]",,"Taifun Kalamaegi fordert bei überschwemmtem Regen auf den Philippinen Dutzende Tote. Mehr als 40 Menschen sind ums Leben gekommen und Hunderttausende wurden vertrieben, nachdem Regenfälle des Taifuns Kalmaegi die Zentralphilippinen überschwemmt und Lastwagen und Schiffscontainer hinweggefegt haben.","Typhoon Kalamaegi leaves dozens dead in flooding rain in Philippines. More than 40 people are dead and hundreds of thousands displaced after rains from Typhoon Kalmaegi flooded the central Philippines, sweeping away trucks and shipping containers.","Typhoon Kalamaegi relinquit justo mortuos in pluvia inundatione in Philippines. Plus quam quadraginta homines mortui sunt et centena milia ex imbribus ex Typhoone Kalmaegi luxatis centralibus Philippinis inundaverunt, aliquet et vasis naviculariis rapientes.",2025-10-21 18:42:08+00:00
4d7e3572de306b0eb590278daaa18ae0,2025-11-02T02:38:49Z,'flooding',www.aljazeera.com,en,0.8,"Landslides in Kenya’s Rift Valley leave 21 dead, 30 others missing",Aerial footage from Elgeyo-Marakwet County shows massive mudslides and flash flooding stretching over vast distances.,https://www.aljazeera.com/news/2025/11/2/landslides-in-kenyas-rift-valley-leave-21-dead-30-others-missing,https://www.aljazeera.com/wp-content/uploads/2025/11/2025-11-01T110505Z_2107970014_RC2MNHA8C37L_RTRMADP_3_KENYA-LANDSLIDE-1762049827.jpg?resize=1200%2C675,,"Heavy rains have triggered landslides in Kenyas western Rift Valley region, killing at least 21 people and destroying more than 1,000 homes, according to officials.
Kenyan Cabinet Secretary for the … [+1818 chars]",,"Bei Erdrutschen im Rift Valley in Kenia sind 21 Menschen ums Leben gekommen, 30 weitere werden vermisst. Luftaufnahmen aus dem Landkreis Elgeyo-Marakwet zeigen massive Schlammlawinen und Sturzfluten, die sich über weite Strecken erstrecken.","Landslides in Kenya’s Rift Valley leave 21 dead, 30 others missing. Aerial footage from Elgeyo-Marakwet County shows massive mudslides and flash flooding stretching over vast distances.","Landslides in Kenya Rift Valley decedunt 21 mortui, 30 alii desunt. Aeria footage ab Elgeyo-Marakwet Comitatus ostendit turbationes ingentes et inundationes per immensas distantias tendens.",2025-10-21 18:42:08+00:00
be2ce04dcb8088f64805883ae4cc182e,2025-11-02T17:25:00Z,'flooding mudslide',news.sky.com,en,0.8,At least 26 people dead after Kenya landslide,"Heavy rains are continuing across the country, with floods reported in several counties, and thousands of people displaced.",https://news.sky.com/story/at-least-26-people-dead-after-kenya-landslide-13462792,https://e3.365dm.com/25/11/1600x900/skynews-kenya-landslides_7069982.jpg?20251102173450,,"At least 26 people have died and 25 others are still missing after a landslide in western Kenya during heavy rains. 
The government has stepped up the search mission, with four military planes deplo… [+1863 chars]",,"Mindestens 26 Menschen sind nach Erdrutsch in Kenia gestorben. Im ganzen Land kommt es weiterhin zu heftigen Regenfällen, in mehreren Landkreisen wurden Überschwemmungen gemeldet und Tausende Menschen wurden vertrieben.","At least 26 people dead after Kenya landslide. Heavy rains are continuing across the country, with floods reported in several counties, and thousands of people displaced.","Saltem XXVI homines mortui post Keniam LAPSUS. Imbres graves per patriam continuant, cum inundationes in compluribus comitatibus relata sunt et milia hominum luxata.",2025-10-21 18:42:08+00:00
f376661ff56b5f1c513907ec82e3e3e1,2025-11-04T03:32:20Z,'floods',www.digitaljournal.com,en,0.8,Floods strand people on roofs as typhoon pounds Philippines,"Residents sought refuge on rooftops and cars floated through flooded streets on Tuesday as Typhoon Kalmaegi battered the central Philippines, leaving at least two people dead. Hundreds of thousands have been displaced by the powerful storm, which made landfal…",https://www.digitaljournal.com/world/floods-strand-people-on-roofs-as-typhoon-pounds-philippines/article,https://www.digitaljournal.com/wp-content/uploads/2025/11/d40c4b5ced3363c7ac44338bd42be021ea32a49f.jpg,,"A motorist drives past a fallen electric post and trees on a highway in the aftermath of Typhoon Kalmaegi in Mayorga, Leyte province - Copyright AFP -
Residents sought refuge on rooftops and cars fl… [+3259 chars]",,"Überschwemmungen stranden Menschen auf Dächern, während der Taifun über die Philippinen fegt. Anwohner suchten am Dienstag Zuflucht auf Dächern und Autos schwebten durch überflutete Straßen, als der Taifun Kalmaegi die Zentralphilippinen verwüstete und mindestens zwei Menschen das Leben kostete. Hunderttausende wurden durch den starken Sturm vertrieben, der das Festland zerstörte …","Floods strand people on roofs as typhoon pounds Philippines. Residents sought refuge on rooftops and cars floated through flooded streets on Tuesday as Typhoon Kalmaegi battered the central Philippines, leaving at least two people dead. Hundreds of thousands have been displaced by the powerful storm, which made landfal…","Flumina acia populo in tectis habent, ut typhon librae Philippinae. Residentes perfugium tectorum et carros per vias inundatas die Martis nataverunt ut Typhoon Kalmaegi medias Philippinas quassavit, relinquens saltem duos homines mortuos. Centum milium valida tempestate commota est, quae facta est landfal.",2025-10-21 18:42:08+00:00
1f24b0aa016730e51e03505669035593,2025-11-04T04:36:59Z,'flooding',www.yahoo.com,en,0.8,"Typhoon Kalmaegi leaves at least 26 dead in Philippines, with survivors trapped on roofs and in cars","Typhoon Kalmaegi has left at least 26 people dead in the Philippines, mostly in flooding set off by the storm, which barreled across the central part of the ...",https://www.yahoo.com/news/articles/typhoon-kalmaegi-leaves-26-dead-043659818.html,https://s.yimg.com/ny/api/res/1.2/oFVeg3x2ULg3UYwNOR2wyA--/YXBwaWQ9aGlnaGxhbmRlcjt3PTEyMDA7aD04MDA7Y2Y9d2VicA--/https://media.zenfs.com/en/ap_finance_articles_694/ef31038ce5287f2cc501d17774f5ff8e,,"MANILA, Philippines (AP) Typhoon Kalmaegi has left at least 26 people dead in the Philippines, mostly in flooding set off by the storm, which barreled across the central part of the country on Tuesda… [+4010 chars]",,"Der Taifun Kalmaegi fordert auf den Philippinen mindestens 26 Todesopfer, Überlebende sind auf Dächern und in Autos gefangen. Der Taifun Kalmaegi hat auf den Philippinen mindestens 26 Menschen das Leben gekostet, vor allem bei Überschwemmungen, die durch den Sturm ausgelöst wurden, der über den zentralen Teil der Philippinen fegte ...","Typhoon Kalmaegi leaves at least 26 dead in Philippines, with survivors trapped on roofs and in cars. Typhoon Kalmaegi has left at least 26 people dead in the Philippines, mostly in flooding set off by the storm, which barreled across the central part of the ...","Typhoon Kalmaegi folia saltem 26 mortua in Philippinis, cum superstitibus in tectis et in carro capti. Typhoon Kalmaegi saltem 26 homines mortuos in Philippinis reliquit, maxime in inundatione tempestatis, quae trans mediam partem cadi .. .",2025-10-21 18:42:08+00:00
fc48cb1ac1ad244ddfe88f14014d8a69,2025-11-04T10:03:37Z,'flooding death',timesofindia.indiatimes.com,en,0.8,Vietnam flood death toll hits 40 as Typhoon Kalmaegi looms,"The death toll from a week of flooding and record rains in central Vietnam rose to 40 on Tuesday, authorities said, as another powerful storm threatened the battered region. On Tuesday, the region was reeling from the past week's extreme weather, with some re…",https://timesofindia.indiatimes.com/world/rest-of-world/vietnam-flood-death-toll-hits-40-as-typhoon-kalmaegi-looms/articleshow/125083853.cms,"https://static.toiimg.com/thumb/msid-125084212,width-1070,height-580,imgsize-1962875,resizemode-75,overlay-toi_sw,pt-32,y_pad-40/photo.jpg",,"The death toll from a week of flooding and record rains in central Vietnam rose to 40 on Tuesday, authorities said, as another powerful storm threatened the battered region. On Tuesday, the region wa… [+2089 chars]",,"Die Zahl der Todesopfer bei Überschwemmungen in Vietnam steigt auf 40, während der Taifun Kalmaegi droht. Die Zahl der Todesopfer nach einer Woche Überschwemmungen und Rekordregenfällen in Zentralvietnam stieg am Dienstag nach Angaben der Behörden auf 40, da ein weiterer starker Sturm die gebeutelte Region bedrohte. Am Dienstag litt die Region unter den extremen Wetterbedingungen der vergangenen Woche, und es gab einige …","Vietnam flood death toll hits 40 as Typhoon Kalmaegi looms. The death toll from a week of flooding and record rains in central Vietnam rose to 40 on Tuesday, authorities said, as another powerful storm threatened the battered region. On Tuesday, the region was reeling from the past week's extreme weather, with some re…","Vietnam inundatio mortuorum 40 as Typhon Kalmaegi imminet. Mortuum vectigal ex hebdomade inundationis et pluviae recordationis in Vietnamia media ad XL die Martis surrexit, auctores dixerunt, ut alia tempestas valida regioni quassatae immineret. Die Martis, regio fluctuabat ex hebdomade extrema, cum aliqua re...",2025-10-21 18:42:08+00:00
26506e952d05118ac6e74242a0819588,2025-11-04T14:36:26Z,'flooding storm',www.cbc.ca,en,0.8,"Risk of coastal flooding, big waves as storm heads for parts of N.L.",CBC meteorologist Ashley Brauweiler is warning of a storm surge between St. Mary’s Bay and Placentia Bay that could bring waves as high as 12 metres breaking along the shore.,https://www.cbc.ca/news/canada/newfoundland-labrador/nl-storm-surge-9.6965836,"https://i.cbc.ca/ais/faa2ce34-7944-46e4-a210-f3df11643b24,1762263544423/full/max/0/default.jpg?im=Crop%2Crect%3D%280%2C96%2C1024%2C576%29%3BResize%3D620",,"A fierce storm is headed toward Newfoundland and Labrador on Tuesday, bringing with it rain, strong winds and the risk of coastal flooding along the eastern Burin Peninsula to the southern Avalon Pen… [+1907 chars]",,"Es besteht die Gefahr von Küstenüberschwemmungen und großen Wellen, da der Sturm Teile von N.L. erreicht. CBC-Meteorologe Ashley Brauweiler warnt vor einer Sturmflut zwischen St. Mary’s Bay und Placentia Bay, die Wellen von bis zu 12 Metern Höhe entlang der Küste brechen könnte.","Risk of coastal flooding, big waves as storm heads for parts of N.L.. CBC meteorologist Ashley Brauweiler is warning of a storm surge between St. Mary’s Bay and Placentia Bay that could bring waves as high as 12 metres breaking along the shore.","Periculum inundationis maritimae, magnae fluctuum sicut procellae capita partium N.L.. CBC astrologus asley Brauweiler monet de fluctu tempestatis inter S. Mariae Bay et Placentiam Bay qui fluctus tam altos quam 12 metra per litus frangere potuit.",2025-10-21 18:42:08+00:00
9907bc7e87be73abce6ec6b7465df58a,2025-11-06T09:33:42Z,'flooding',en.antaranews.com,en,0.8,Jakarta prepares disaster response for potential coastal flooding,"The Jakarta Regional Disaster Mitigation Agency (BPBD) has prepared anticipatory measures to face potential tidal flooding in the city.

&ldquo;BPBD Jakarta ...",https://en.antaranews.com/news/390261/jakarta-prepares-disaster-response-for-potential-coastal-flooding,https://cdn.antaranews.com/cache/1200x800/2025/11/01/IMG-20251101-WA0019.jpg,,Jakarta (ANTARA) - The Jakarta Regional Disaster Mitigation Agency (BPBD) has prepared anticipatory measures to face potential tidal flooding in the city.“BPBD Jakarta has activated the standard disa… [+1871 chars],,"Jakarta bereitet Katastrophenhilfe für mögliche Überschwemmungen an der Küste vor. Die Jakarta Regional Disaster Mitigation Agency (BPBD) hat vorbeugende Maßnahmen vorbereitet, um potenziellen Flutüberschwemmungen in der Stadt zu begegnen.

„BPBD Jakarta ...","Jakarta prepares disaster response for potential coastal flooding. The Jakarta Regional Disaster Mitigation Agency (BPBD) has prepared anticipatory measures to face potential tidal flooding in the city.

&ldquo;BPBD Jakarta ...","Batavia calamitatem responsionem praeparat ad inundationem maritimam potentialem. Calamitas Regionalis Batavia Mitigationis Agency (BPBD) mensuras anticipatorias paravit ad inundationem potentialis in urbe.

&ldquo;BPBD Batavia ...",2025-10-21 18:42:08+00:00
bdabb2756cf986a84ed011584ab0b78c,2025-11-07T09:00:00Z,'flooding storm',www.yahoo.com,en,0.8,Scientists issue dire warning as iconic American city sinks into the sea: 'Human intervention has made it worse',New Orleans was already vulnerable to flooding and storm surges.,https://www.yahoo.com/news/scientists-issue-dire-warning-iconic-121531478.html,https://s.yimg.com/ny/api/res/1.2/UU2lvFRErej9JJSK1jDERg--/YXBwaWQ9aGlnaGxhbmRlcjt3PTEyMDA7aD02NzY7Y2Y9d2VicA--/https://media.zenfs.com/en/the_cool_down_737/a9f2221df445661ee54ab50171bd62cf,,"One of the country's most unique cities, known for its cuisine and colorful culture, is not only sinking, but it is also being engulfed by rising seas.
What's happening?
New Orleans rightfully boas… [+3128 chars]",,"Wissenschaftler warnen eindringlich, als die berühmte amerikanische Stadt im Meer versinkt: „Menschliches Eingreifen hat es noch schlimmer gemacht.“ New Orleans war bereits anfällig für Überschwemmungen und Sturmfluten.",Scientists issue dire warning as iconic American city sinks into the sea: 'Human intervention has made it worse'. New Orleans was already vulnerable to flooding and storm surges.,Scientistae diram admonitionem procedunt sicut urbs Iconica Americana in mare demittit: 'Humanus interventus peius fecit'. Nova Orleans iam vulnerari erat ad inundationes et procellas.,2025-10-21 18:42:08+00:00
752c0a5b2680b395d8731fd1f6bd48b3,2025-11-03T19:34:15Z,'flooding atmospheric river',www.registerguard.com,en,0.9,"Atmospheric river headed to Oregon, wind, flooding possible","Monday, Nov. 3 to Saturday, Nov. 8, wind is in forecast.",https://www.registerguard.com/story/weather/severe/2025/11/03/downed-trees-flooding-oregon-coast-forecast/87066122007/,https://s.yimg.com/ny/api/res/1.2/FgrVjN.q_d5Ve9m8aWE91g--/YXBwaWQ9aGlnaGxhbmRlcjt3PTEyMDA7aD04NDA7Y2Y9d2VicA--/https://media.zenfs.com/en/the-register-guard/518686dcd3d74ee2f47abd8c0db3319e,,"Another atmospheric river could hit northwest Oregon this week, bringing ""moderate to heavy rainfall,"" along with wind, the National Weather Service predicted.
NWS said northwest Oregon will see win… [+2496 chars]",,"Atmosphärischer Fluss in Richtung Oregon, Wind, Überschwemmung möglich. Von Montag, 3. November bis Samstag, 8. November ist Wind vorhergesagt.","Atmospheric river headed to Oregon, wind, flooding possible. Monday, Nov. 3 to Saturday, Nov. 8, wind is in forecast.","Flumen atmosphaericum ad Oregon petiere, vento inundatione fieri. Lunae, 3 novembris usque ad diem Sabbati, 8 novembris, ventus est in praesagio.",2025-10-21 18:42:08+00:00
053e099d21500fde126d89928ef2e5f0,2025-11-05T01:48:25Z,'flooding',www.tmonews.com,en,0.9,T-Mobile Waives All Philippines Charges for Customers Following Deadly Typhoon Kalmaegi,"T-Mobile is stepping up to help customers stay in touch with family and friends in the Philippines after Typhoon Kalmaegi, locally called Typhoon Tino, made landfall with catastrophic results. The storm has caused widespread flooding, power outages, and displ…",https://www.tmonews.com/2025/11/t-mobile-waives-all-philippines-charges-for-customers-following-deadly-typhoon-kalmaegi/,https://www.tmonews.com/wp-content/uploads/2021/08/t-mobile-for-business-affected-by-hack-too-210x131.png,,"T-Mobile is stepping up to help customers stay in touch with family and friends in the Philippines after Typhoon Kalmaegi, locally called Typhoon Tino, made landfall with catastrophic results. The st… [+934 chars]",,"T-Mobile erlässt Kunden auf den Philippinen nach dem tödlichen Taifun Kalmaegi alle Gebühren. T-Mobile unterstützt Kunden dabei, mit Familie und Freunden auf den Philippinen in Kontakt zu bleiben, nachdem der Taifun Kalmaegi, vor Ort Taifun Tino genannt, mit katastrophalen Folgen auf Land traf. Der Sturm hat zu großflächigen Überschwemmungen, Stromausfällen und Wasserverschmutzung geführt.","T-Mobile Waives All Philippines Charges for Customers Following Deadly Typhoon Kalmaegi. T-Mobile is stepping up to help customers stay in touch with family and friends in the Philippines after Typhoon Kalmaegi, locally called Typhoon Tino, made landfall with catastrophic results. The storm has caused widespread flooding, power outages, and displ…","T-Mobile Waives Omnes Philippines felis ac pro Customers Mortuus Typhoon Kalmaegi. T-Mobile ingrediens auxilium clientium manere in tactu cum familiaribus et amicis in Philippinis post Typhoon Kalmaegi, loco Typhonis Tino vocato, cum eventibus calamitosis lapsus factus est. Tempestas late inundationem, potestatem outages ac displ…",2025-10-21 18:42:08+00:00
f5d18c025c50f3c81b138bed91ffd3c0,2025-11-05T05:34:59Z,'flooding death',www.rte.ie,en,0.9,Typhoon death toll climbs to 66 in the Philippines,The death toll from Typhoon Kalmaegi in the Philippines climbed to 66 as residents of hardest-hit Cebu province began picking through homes and businesses devastated by the worst flooding in recent memory.,https://www.rte.ie/news/world/2025/1105/1542229-typhoon-kalmaegi-philippines/,https://www.rte.ie/images/00236d84-1600.jpg,,The death toll from Typhoon Kalmaegi in the Philippines climbed to 66 as residents of hardest-hit Cebu province began picking through homes and businesses devastated by the worst flooding in recent m… [+3379 chars],,"Die Zahl der Taifun-Todesopfer auf den Philippinen steigt auf 66. Die Zahl der Todesopfer durch den Taifun Kalmaegi auf den Philippinen stieg auf 66, als Bewohner der am stärksten betroffenen Provinz Cebu damit begannen, Häuser und Geschäfte zu durchsuchen, die von der schlimmsten Überschwemmung der letzten Zeit zerstört worden waren.",Typhoon death toll climbs to 66 in the Philippines. The death toll from Typhoon Kalmaegi in the Philippines climbed to 66 as residents of hardest-hit Cebu province began picking through homes and businesses devastated by the worst flooding in recent memory.,Typhonis vectigal ascendit 66 in Philippinis. Mortuus vectigal a Typhoon Kalmaegi in Philippinis ascendit ad 66 sicut incolas provinciae Cebu durissimae legere coepit per domos et negotiationes pessima inundatione recentis memoriae vastatae.,2025-10-21 18:42:08+00:00
577011f34e0de18c049ba40900da56ae,2025-11-05T11:00:07Z,'flooding',www.ibtimes.com,en,0.9,Early New Typhoon Heading Toward Philippines After Kalmaegi Devastates the Nation,"At least 40 people have died and hundreds of thousands have been displaced as Typhoon Kalmaegi devastates the Philippines, flooding Cebu and surrounding islands, while a new tropical system threatens to follow.",https://www.ibtimes.com/early-new-typhoon-heading-toward-philippines-after-kalmaegi-devastates-nation-3789659,https://d.ibtimes.com/en/full/4633070/typhoon-kalmaegi-ravages-philippines.png,,"When dawn broke over the central Philippines, communities woke to scenes of heartache and ruin.
Typhoon Kalmaegi, one of the strongest storms to strike the region this year, has unleashed devastatio… [+4003 chars]",,"Früher neuer Taifun auf dem Weg zu den Philippinen, nachdem Kalmaegi die Nation verwüstet hat. Mindestens 40 Menschen starben und Hunderttausende wurden vertrieben, als der Taifun Kalmaegi die Philippinen verwüstete und Cebu und die umliegenden Inseln überschwemmte, während ein neues tropisches System droht.","Early New Typhoon Heading Toward Philippines After Kalmaegi Devastates the Nation. At least 40 people have died and hundreds of thousands have been displaced as Typhoon Kalmaegi devastates the Philippines, flooding Cebu and surrounding islands, while a new tropical system threatens to follow.","Early New Typhoon Heading Toward Post Philippines Post Kalmaegi Nationem vastat. Saltem XL homines mortui sunt et centena milia ita proiecta sunt, ut Typhon Kalmaegi Philippinas vastat, Cebu inundationem et insulas circumiacentes, cum nova ratio tropica sequi minatur.",2025-10-21 18:42:08+00:00
