index,url,valid,domain,title,description,image,published,archive,content,quote,language,keyword
https://www.news-journalonline.com/story/weather/2025/07/10/could-texas-style-flash-floods-happen-on-floridas-st-johns-river/84519620007/,https://www.news-journalonline.com/story/weather/2025/07/10/could-texas-style-flash-floods-happen-on-floridas-st-johns-river/84519620007/,0,www.news-journalonline.com,Could Texas flash floods happen on St. Johns River in Florida? What the experts say,"Factors such as elevation and soil consistency are vastly different in Florida than in Texas, according to meteorologists.",https://s.yimg.com/ny/api/res/1.2/s762SIPVf4Ut5WAtM90q.w--/YXBwaWQ9aGlnaGxhbmRlcjt3PTEyMDA7aD04NTE7Y2Y9d2VicA--/https://media.zenfs.com/en/daytona-beach-news-journal/64fd5b6018183da4448f1a29ee2991d2,2025-07-10T09:04:14Z,,"After flash floods in Texas killed at least 119 people and left dozens unaccounted for when the Guadalupe River surged following torrential rain on Fourth of July, its worth wondering if the same cat… [+5913 chars]",,en,'floods'
https://www.npr.org/2025/07/10/nx-s1-5461091/texas-flooding-warning-system-fema,https://www.npr.org/2025/07/10/nx-s1-5461091/texas-flooding-warning-system-fema,0,www.npr.org,"Kerr County struggled to fund flood warnings. Under Trump, it's getting even harder","Kerr County applied for federal grants to build a warning system to protect residents from flash floods. Under the Trump Administration, that kind of funding is drying up.",https://npr.brightspotcdn.com/dims3/default/strip/false/crop/1024x576+0+107/resize/1400/quality/100/format/jpeg/?url=http%3A%2F%2Fnpr-brightspot.s3.amazonaws.com%2F64%2Ffd%2F72fea98f4961b082484f8c6c4453%2Fgettyimages-2223449515.jpg,2025-07-10T09:54:01Z,,"Years before the flooding took more than 90 lives in Kerr County, Texas, local officials knew residents faced threats from rapidly rising water. They started planning a flood warning system, one that… [+9407 chars]",,en,'flooding area'
https://newrepublic.com/article/197754/climate-disasters-cynical-republicans,https://newrepublic.com/article/197754/climate-disasters-cynical-republicans,0,newrepublic.com,Climate Disasters Are Catnip for Cynical Republicans,Days after flooding in the Texas Hill Country killed 27 campers and counselors at Camp Mystic—just a portion of the more than 100 already confirmed dead in Central Texas—Immigration and Customs Enforcement shut down a children’s summer camp in Los Angeles’s M…,https://images.newrepublic.com/946006c4b39d305b7b6d64107bd1d2f3ea115a68.jpeg?w=1200&h=630&crop=faces&fit=crop&fm=jpg,2025-07-10T10:00:00Z,,Days after flooding in the Texas Hill Country killed 27 campers and counselors at Camp Mysticjust a portion of the more than 100 already confirmed dead in Central TexasImmigration and Customs Enforce… [+3287 chars],,en,'flooding'
https://www.salon.com/2025/07/10/femas-acting-director-is-mia-and-the-media-hasnt-even-noticed/,https://www.salon.com/2025/07/10/femas-acting-director-is-mia-and-the-media-hasnt-even-noticed/,0,www.salon.com,FEMA’s acting director is MIA — and the media hasn’t even noticed,"After the deadly Texas floods, few seem to be questioning Kristi Noem’s apparent takeover of the agency",https://www.salon.com/app/uploads/2025/07/Kristi-Noem-2220405950.jpg,2025-07-10T10:45:22Z,,"Nearly one week after flash floods devastated the Texas Hill Country and killed at least 119 people, it appears the acting administrator of the Federal Emergency Management Agency isnt acting much at… [+10065 chars]",,en,'floods'
https://nypost.com/2025/07/10/us-news/ny-papers-vile-political-cartoon-draws-outrage-for-appearing-to-mock-trump-voting-texas-flood-victims/,https://nypost.com/2025/07/10/us-news/ny-papers-vile-political-cartoon-draws-outrage-for-appearing-to-mock-trump-voting-texas-flood-victims/,0,nypost.com,NY paper’s ‘vile’ political cartoon appears to mock Trump-voting Texas flood victims,Buffalo News cartoonist Adam Zyglis appeared to blame President Trump and DOGE spending cuts for the deadly floods.,https://nypost.com/wp-content/uploads/sites/2/2025/07/107934921.jpg?quality=75&strip=all&w=1024,2025-07-10T11:44:30Z,,"A political cartoonist for Buffalo News spurred outrage for appearing to mock victims of the devastating flash floods in Texas on Monday with a cartoon depicting a drowning Trump supporter.
“Histori… [+3239 chars]",,en,'flooding area'
https://www.foxnews.com/us/samaritans-purse-volunteers-bring-faith-supplies-texans-need,https://www.foxnews.com/us/samaritans-purse-volunteers-bring-faith-supplies-texans-need,0,www.foxnews.com,Samaritan's Purse volunteers bring faith and supplies to Texans in need,Samaritan's Purse volunteers are helping Texans clean up whose homes were destroyed in deadly floods while bringing them a message of faith in Jesus.,https://static.foxnews.com/foxnews.com/content/uploads/2025/07/samaritans-purse-volunteers.jpg,2025-07-10T11:56:31Z,,"Samaritans Purse volunteers have seen their share of disasters, and now theyre helping those in central Texas who were devastated by last weekends floods. These volunteers are aiding locals clean up … [+2739 chars]",,en,'floods'
https://abcnews.go.com/US/wireStory/new-mexico-village-rebuilds-after-record-breaking-flash-123633808,https://abcnews.go.com/US/wireStory/new-mexico-village-rebuilds-after-record-breaking-flash-123633808,0,abcnews.go.com,New Mexico village rebuilds all over again after record-breaking flash flood kills 3,The mountain village of Ruidoso has returned to the grim rituals of rebuilding from flash flooding,https://i.abcnewsfe.com/a/1f88f74a-444d-44a6-bb11-25a06a4e8edb/wirestory_350c1673cdc9c41796d1319e19914314_16x9.jpg?w=1600,2025-07-10T12:14:17Z,,"RUIDOSO, N.M. -- The mountain village of Ruidoso returned to the grim rituals of rebuilding after flash flooding and a deadly natural disaster, just one year after wildfire and intense flooding resha… [+5114 chars]",,en,'flooding'
https://www.bostonherald.com/2025/07/10/new-mexico-flooding-village-rebuilds/,https://www.bostonherald.com/2025/07/10/new-mexico-flooding-village-rebuilds/,0,www.bostonherald.com,New Mexico village rebuilds all over again after record-breaking flash flood kills 3,The mountain village of Ruidoso has returned to the grim rituals of rebuilding from flash flooding.,https://www.bostonherald.com/wp-content/uploads/2025/07/New_Mexico_Flooding_82022-1-1.jpg?w=1024&h=768,2025-07-10T12:25:23Z,,"By MORGAN LEE, SUSAN MONTOYA BRYAN and ROBERTO E. ROSALES, Associated Press
RUIDOSO, N.M. (AP) The mountain village of Ruidoso returned to the grim rituals of rebuilding after flash flooding and a d… [+5304 chars]",,en,'flooding'
https://www.wisn.com/article/kerrville-texas-flash-floods-vigil/65364670,https://www.wisn.com/article/kerrville-texas-flash-floods-vigil/65364670,0,www.wisn.com,Hundreds gather in Kerrville to mourn victims of Texas flash floods,"Over 120 people lost their lives in catastrophic flash floods in Kerr County, Texas, during the July Fourth holiday","https://kubrick.htvapps.com/htv-prod-media.s3.amazonaws.com/images/ap25191031516224-1-686facb5aee7c.jpg?crop=1.00xw:0.847xh;0,0.153xh&resize=1200:*",2025-07-10T12:26:14Z,,"KERRVILLE, Texas —Several hundred people gathered for a worship ceremony at a high school stadium in Texas on Wednesday evening to remember the at least 120 people who died in the catastrophic flash … [+4107 chars]",,en,'floods'
https://www.salon.com/2025/07/10/texas-floods-show-that-trumps-america-is-a-cold-hard-place/,https://www.salon.com/2025/07/10/texas-floods-show-that-trumps-america-is-a-cold-hard-place/,0,www.salon.com,"Texas floods show that Trump’s America is a cold, hard place",The president would rather intimidate and detain immigrants than help flood victims,https://www.salon.com/app/uploads/2025/07/Texas-Floods-2223449038.jpg,2025-07-10T13:00:21Z,,"Just one month ago, Donald Trump said he wanted to wean the United States off the Federal Emergency Management Agency after this years hurricane season.
We want to bring [FEMA] down to the state lev… [+10461 chars]",,en,'floods'
https://www.foxnews.com/opinion/david-marcus-wake-kerrville-flood-locals-ignore-blame-game,https://www.foxnews.com/opinion/david-marcus-wake-kerrville-flood-locals-ignore-blame-game,0,www.foxnews.com,"DAVID MARCUS: In wake of Kerrville flood, locals ignore blame game","Hill Country locals reject political blame games after deadly floods, viewing the disaster as an unstoppable act of nature while focusing on community support",https://static.foxnews.com/foxnews.com/content/uploads/2025/07/texas-camp-flooding-132.jpg,2025-07-10T13:31:42Z,,"KERRVILLE, Texas It didnt take long for Democrats to pounce on last weeks tragic floods here with false allegations that the Trump administration had cut the National Weather Service, leaving the com… [+4286 chars]",,en,'flooding area'
https://nypost.com/2025/07/10/us-news/texas-floods-cause-1-5m-of-damage-to-luxury-cars-in-auto-shop-footage-shows/,https://nypost.com/2025/07/10/us-news/texas-floods-cause-1-5m-of-damage-to-luxury-cars-in-auto-shop-footage-shows/,0,nypost.com,"Texas floods cause $1.5M of damage to luxury cars in auto shop, footage shows","CCTV has captured the moment Texas floods caused an estimated $1.5 million damage to a supercar auto shop - ruining eight Ferraris, a Jaguar and a Porsche.",https://nypost.com/wp-content/uploads/sites/2/2025/07/texas-exotic-automobile-dealership-left-107941429.jpg?quality=75&strip=all&w=1024,2025-07-10T14:07:06Z,,"CCTV has captured the moment Texas floods caused an estimated $1.5 million damage to a supercar auto shop — ruining eight Ferraris, a Jaguar and a Porsche.
The Liberty Hill business, NG Supercars, w… [+4127 chars]",,en,'floods'
https://www.theblaze.com/news/dana-bash-and-bill-nye-the-science-guy-ignore-history-to-pin-texas-tragedy-on-trump-and-oil,https://www.theblaze.com/news/dana-bash-and-bill-nye-the-science-guy-ignore-history-to-pin-texas-tragedy-on-trump-and-oil,0,www.theblaze.com,Dana Bash and Bill Nye 'the Science Guy' ignore history to pin Texas tragedy on Trump and oil,"The catastrophic floods in Central Texas have claimed the lives of at least 120 people, including 46 children. As officials and volunteers continue their search for the 173 still believed missing, liberals continue to spin the tragedy, exploiting Texans' loss…",https://www.theblaze.com/media-library/image.jpg?id=61189960&width=1200&height=600&coordinates=0%2C114%2C0%2C57,2025-07-10T14:25:19Z,,"The catastrophic floods in Central Texas have claimed the lives of at least 120 people, including 46 children. As officials and volunteers continue their search for the 173 still believed missing, li… [+4342 chars]",,en,'flooding climate change'
https://consent.yahoo.com/v2/collectConsent?sessionId=1_cc-session_15a6838c-cd4f-4304-af09-9f55e218bc42,https://consent.yahoo.com/v2/collectConsent?sessionId=1_cc-session_15a6838c-cd4f-4304-af09-9f55e218bc42,0,consent.yahoo.com,"Stunning images: Stranded drivers rescued, roads turned into rivers as flash flooding hits Mass.",,,2025-07-10T14:32:11Z,,"If you click 'Accept all', we and our partners, including 236 who are part of the IAB Transparency &amp; Consent Framework, will also store and/or access information on a device (in other words, use … [+714 chars]",,en,'flooding'
https://www.forbes.com/sites/maryroeloffs/2025/07/10/why-kristi-noem-is-under-fire-for-delayed-fema-response-to-texas-floods/,https://www.forbes.com/sites/maryroeloffs/2025/07/10/why-kristi-noem-is-under-fire-for-delayed-fema-response-to-texas-floods/,0,www.forbes.com,Why Kristi Noem Is Under Fire For Delayed FEMA Response To Texas Floods,Sources have said FEMA wasn’t authorized to launch search and rescue teams until 72 hours after flooding began.,"https://imageio.forbes.com/specials-images/imageserve/686fcfbfd5a514bf65ccd447/0x0.jpg?format=jpg&crop=2084,1171,x0,y106,safe&height=900&width=1600&fit=bounds",2025-07-10T14:51:08Z,,"Officials with the Federal Emergency Management Agency, tasked with responding to widespread disasters like the recent flash flooding in central Texas, have said the implementation of red tape by Hom… [+4595 chars]",,en,'floods'
https://www.snopes.com//fact-check/texas-flooding-vance-post-expensive-couch/,https://www.snopes.com//fact-check/texas-flooding-vance-post-expensive-couch/,0,www.snopes.com,Vance didn't post memorial to expensive couch lost in Texas floods,"A genuine X post from the account of U.S. Vice President JD Vance featured an image of a flooded apartment and the statement: “Of all the devastating images coming out of Texas, this is the one that gutted me. That is an $8,000 sectional imported from Italy. …",https://mediaproxy.snopes.com/width/1200/https://media.snopes.com/2025/07/vance.png,2025-07-10T16:23:00Z,,"Claim:
A genuine X post from the account of U.S. Vice President JD Vance featured an image of a flooded apartment and the statement: Of all the devastating images coming out of Texas, this is the on… [+3283 chars]",,en,'floods'
https://ca.news.yahoo.com/thousands-first-responders-search-texas-164650725.html,https://ca.news.yahoo.com/thousands-first-responders-search-texas-164650725.html,0,ca.news.yahoo.com,List of missing in Texas floods adds uncertainty to search for survivors,"KERRVILLE, Texas (Reuters) -Six days after flash floods swept through parts of Texas Hill Country and killed at least 120, authorities say there are still...",https://media.zenfs.com/en/reuters.com/efdb4f1e4c5a4f2aa1405599b4648dde,2025-07-10T16:46:50Z,,"By Jane Ross and Rich McKay
KERRVILLE, Texas (Reuters) -Six days after flash floods swept through parts of Texas Hill Country and killed at least 120, authorities say there are still more than 160 p… [+4817 chars]",,en,'floods'
https://nypost.com/2025/07/10/us-news/hundreds-gather-at-texas-high-school-stadium-to-honor-flood-victims/,https://nypost.com/2025/07/10/us-news/hundreds-gather-at-texas-high-school-stadium-to-honor-flood-victims/,0,nypost.com,Hundreds gather at Texas high school stadium to honor flood victims,"Several hundred people gathered for a worship ceremony at a high school stadium in Texas on Wednesday evening to remember the at least 120 people who died in the catastrophic flash floods over the July Fourth holiday, as well the many still missing.",https://nypost.com/wp-content/uploads/sites/2/2025/07/107945866.jpg?quality=75&strip=all&w=1024,2025-07-10T16:47:26Z,,Several hundred people gathered for a worship ceremony at a high school stadium in Texas on Wednesday evening to remember the at least 120 people who died in the catastrophic flash floods over the Ju… [+5352 chars],,en,'floods'
https://www.adweek.com/tvspy/scripps-raises-more-than-75k-for-victims-of-deadly-texas-floods/,https://www.adweek.com/tvspy/scripps-raises-more-than-75k-for-victims-of-deadly-texas-floods/,0,www.adweek.com,Scripps Raises More than 75K for Victims of Deadly Texas Floods,"The E.W. Scripps Company has also contributed $25,000 to bolster the relief efforts.",https://static-www.adweek.com/wp-content/uploads/2025/07/SHF-Texas-Flooding-Relief-FS-copy.png?w=600&h=315&crop=1,2025-07-10T17:31:49Z,,"The Scripps News Group and the Scripps Howard Fund have raised more than $75,000 to provide relief for those impacted by the devastating floods in Central Texas. But Scripps said with many families i… [+1694 chars]",,en,'flooding donation'
https://www.cbc.ca/news/science/what-on-earth-fishing-gear-1.7581496,https://www.cbc.ca/news/science/what-on-earth-fishing-gear-1.7581496,0,www.cbc.ca,Fishing gear waste is being turned into plant pots and swimwear,"In this issue of our environmental newsletter, we find out how abandoned fishing gear in the oceans is getting turned into new products, witness how the Texas floods changed the landscape and find out how spending a few hundred bucks can go a long way toward …",https://i.cbc.ca/1.7581518.1752148066!/fileImage/httpImage/image.jpg_gen/derivatives/16x9_1180/ocean-legacy-cleanup-crew.jpg?im=Resize%3D620,2025-07-10T18:00:00Z,,"Hello, Earthlings! This is our weekly newsletter on all things environmental, where we highlight trends and solutions that are moving us to a more sustainable world. Keep up with the latest news on o… [+12919 chars]",,en,'floods'
https://abcnews.go.com/US/video/kerr-county-officials-waited-90-minutes-send-emergency-123653580,https://abcnews.go.com/US/video/kerr-county-officials-waited-90-minutes-send-emergency-123653580,0,abcnews.go.com,"WATCH: Kerr County officials waited 90 minutes to send emergency alert, audio shows","Kerr County, Texas, officials waited 90 minutes to send an emergency alert advising residents about the flooding, according to audio obtained by ABC affiliate KSAT.",https://i.abcnewsfe.com/a/f8d74062-1068-47c1-94ee-2cf5313ce413/250710_abc_social_ault_hpMain_9x16.jpg?w=992,2025-07-10T18:31:01Z,,"<ul><li>Federal judge blocks Trumps EO on birthright citizenship after SCOTUS ruling
</li><li>First responders challenged by 'massive area' in Texas recovery efforts
</li><li>Palestinian children k… [+4423 chars]",,en,'flooding'
https://truthout.org/articles/dhs-head-noem-prioritized-instagram-pics-over-fema-requests-for-texas-floods/,https://truthout.org/articles/dhs-head-noem-prioritized-instagram-pics-over-fema-requests-for-texas-floods/,0,truthout.org,DHS Head Noem Prioritized Instagram Pics Over FEMA Requests for Texas Floods,"It took Noem four days to respond to requests from FEMA, delaying access to some search and rescue tools.",https://truthout.org/app/uploads/2025/07/2025_0710-texas-scaled.jpg,2025-07-10T18:37:05Z,,"Truthout is a vital news source and a living history of political struggle. If you think our work is valuable, support us with a donation of any size.
Officials within the Federal Emergency Manageme… [+3419 chars]",,en,'flooding donation'
https://www.npr.org/2025/07/10/nx-s1-5463523/flash-flood-safety-tips-what-to-know,https://www.npr.org/2025/07/10/nx-s1-5463523/flash-flood-safety-tips-what-to-know,0,www.npr.org,"What should you do in a flash flood? Expert safety tips for before, during and after","Flash floods can start suddenly and become dangerous quickly. But there are steps you can take to protect yourself, both in the moment and well in advance.",https://npr.brightspotcdn.com/dims3/default/strip/false/crop/4000x2250+0+210/resize/1400/quality/100/format/jpeg/?url=http%3A%2F%2Fnpr-brightspot.s3.amazonaws.com%2F5d%2Fed%2F334ac62c4e79af3d04b1b24251c1%2Fgettyimages-2223208053.jpg,2025-07-10T19:00:33Z,,"What should you do in the face of a flash flood?
The question is on the minds of many in the wake of catastrophic flooding in Texas, which has killed over 100 people and renewed scrutiny over state … [+7492 chars]",,en,'floods'
https://www.snopes.com//fact-check/texas-flood-donation-coco-gauff/,https://www.snopes.com//fact-check/texas-flood-donation-coco-gauff/,0,www.snopes.com,Did Coco Gauff donate $3M to support Texas flood search efforts?,"In July 2025, tennis star Coco Gauff donated $3 million for search-and-rescue efforts amid deadly Texas floods.",https://mediaproxy.snopes.com/width/1200/https://media.snopes.com/2025/07/allareblessed2_featured_image.png,2025-07-10T19:11:00Z,,"Claim:
In July 2025, tennis star Coco Gauff donated $3 million for search-and-rescue efforts amid deadly Texas floods.
In the aftermath of deadly flooding in Texas that claimed more than 100 lives … [+4764 chars]",,en,'flooding relief'
https://www.factcheck.org/2025/07/staffing-cuts-at-nws-and-the-tragic-flooding-in-texas/,https://www.factcheck.org/2025/07/staffing-cuts-at-nws-and-the-tragic-flooding-in-texas/,0,www.factcheck.org,Staffing Cuts at NWS and the Tragic Flooding in Texas,"Q: Is it true that if President Donald Trump hadn’t defunded the National Weather Service, the death toll in the Texas flooding would have been far lower or nonexistent?
A: The Trump administration did not defund the NWS but did reduce the staff by 600 people…",https://cdn.factcheck.org/UploadedFiles/Texas-Flooding-720-x-307.png,2025-07-10T19:56:32Z,,"Q: Is it true that if President Donald Trump hadn’t defunded the National Weather Service, the death toll in the Texas flooding would have been far lower or nonexistent?
A: The Trump administration … [+9582 chars]",,en,'flooding donation'
https://www.snopes.com//fact-check/texas-floods-rachel-maddow/,https://www.snopes.com//fact-check/texas-floods-rachel-maddow/,0,www.snopes.com,Slew of misleading claims surrounds Rachel Maddow in Texas floods aftermath,"MSNBC host Rachel Maddow donated millions of dollars to flood relief in Texas, hired two helicopters for rescues, offered her Texas home for relief work and/or was herself rescued during a report.",https://mediaproxy.snopes.com/width/1200/https://media.snopes.com/2025/07/rachel_maddow_texas_floods_ai_claims.png,2025-07-10T20:14:00Z,,"Claim:
MSNBC host Rachel Maddow donated millions of dollars to flood relief in Texas, hired two helicopters for rescues, offered her Texas home for relief work and/or was herself rescued during a re… [+7152 chars]",,en,'floods'
https://www.foxnews.com/politics/fundraiser-texas-ex-official-seeks-20k-donations-whites-only-comment-young-flood-victims,https://www.foxnews.com/politics/fundraiser-texas-ex-official-seeks-20k-donations-whites-only-comment-young-flood-victims,0,www.foxnews.com,Fundraiser for Texas ex-official seeks $20K in donations after 'Whites-only' comment about young flood victims,"Controversy erupted after a fundraiser for Sade Perkins, a former Houston official who made racial comments about the 27 girls who died in Camp Mystic floods.",https://static.foxnews.com/foxnews.com/content/uploads/2025/07/camp-mystic-texas-flooding_03.jpg,2025-07-10T21:06:50Z,,"A Democratic former mayoral appointee in Houston, Texas, is being slammed on a fundraising platform after a campaign was set up to help with ""legal support"" following her comments on social media abo… [+3816 chars]",,en,'flooding donation'
https://consent.yahoo.com/v2/collectConsent?sessionId=1_cc-session_b63b844a-6412-4b4b-9ba9-a4bb756fdff4,https://consent.yahoo.com/v2/collectConsent?sessionId=1_cc-session_b63b844a-6412-4b4b-9ba9-a4bb756fdff4,0,consent.yahoo.com,A small Texas community where everyone survived flooding has sirens that warned them,,,2025-07-10T21:10:00Z,,"If you click 'Accept all', we and our partners, including 236 who are part of the IAB Transparency &amp; Consent Framework, will also store and/or access information on a device (in other words, use … [+714 chars]",,en,'flooding'
https://www.ncspin.com/fiddling-while-rome-burns-and-floods,https://www.ncspin.com/fiddling-while-rome-burns-and-floods,0,www.ncspin.com,Fiddling while Rome burns (and floods),"The recent weather in our state was yet another wake-up call to the terrifying fact that we are in the midst of a global emergency that cries out for an urgent, all-hands-on-deck response.",https://www.ncspin.com/content/images/1200x628/5cb8b226bed27.jpg,2025-07-10T21:49:12Z,,"Ho hum…another hot summer day in North Carolina that ended in torrential rain and catastrophic flooding.
That was the cap to this past holiday weekend in central North Carolina. An early season trop… [+5376 chars]",,en,'flooding death'
https://www.texasmonthly.com/news-politics/texas-flood-firsthand-account/,https://www.texasmonthly.com/news-politics/texas-flood-firsthand-account/,0,www.texasmonthly.com,My Family and the Flood: A Firsthand Account,"The July 4 Texas flooding ripped our Kerr County home from its pillars, pulling us into the water and into the night. Then morning came.",https://img.texasmonthly.com/2025/07/guadalupe-flood-3b.jpg?auto=compress&crop=faces&fit=fit&fm=pjpg&ixlib=php-3.3.1&q=45,2025-07-10T22:56:25Z,,"Rosemary, the four-year-old, woke up first. She told my brother-in-law, Lance, that there was something on the roof.
Seven of us were at my family’s river house on the Guadalupe, between Ingram and … [+24048 chars]",,en,'flooding death'
https://www.theverge.com/science/704711/cloud-seeding-flash-flood-conspiracy-theory,https://www.theverge.com/science/704711/cloud-seeding-flash-flood-conspiracy-theory,0,www.theverge.com,Conspiracy theorists are blaming flash floods on cloud seeding — it has to stop,"As The Verge's resident disaster writer, I'm tired of this nonsense. So let's just get into it. What is cloud seeding? Cloud seeding is basically an attempt to make precipitation fall from clouds. It targets clouds that have water droplets that are essentiall…",https://platform.theverge.com/wp-content/uploads/sites/2/2025/07/STK479_CONSPIRACY_THEORIES_C.jpg?quality=90&strip=all&crop=0%2C10.732984293194%2C100%2C78.534031413613&w=1200,2025-07-11T00:04:12Z,,"Cloud seeding cant even make a cloud, and yet the blame game has devolved into death threats.
As The Verges resident disaster writer, Im tired of this nonsense. So lets just get into it. 
What is c… [+5610 chars]",,en,'floods'
https://slashdot.org/firehose.pl?op=view&amp;id=178330226,https://slashdot.org/firehose.pl?op=view&amp;id=178330226,0,slashdot.org,Why Texas Hill Country is one of the deadliest places for flash flooding - Reuters,Why Texas Hill Country is one of the deadliest places for flash floodingReuters Trump looks to quash criticism on natural disaster response during Texas visitCNN Texas County Flagged Need for Flood Alarm Months Before TragedyThe New York Times Live updates: T…,,2025-07-11T00:15:40Z,,"UNIX was not designed to stop you from doing stupid things, because that
would also stop you from doing clever things.
-- Doug Gwyn",,en,'flooding'
