index,published,keyword,domain,language,valid,title,description,url,image,archive,content,quote,de,en,la,added
9716d33a606912f346ead86b0ebf30db,2025-10-16T14:07:48Z,'flooding rain',brobible.com,en,0.0,Heavy Rains Wreak Havoc On Los Angeles As UCLA Flooding Leaves Practice Field In Shambles,The practice field at UCLA was completely flooded prior to college football practice earlier this week. Los Angeles is not prepared for rain. It was a hilarious visual even though there is an explanation for the drainage failure. Threat of severe weather crea…,https://brobible.com/sports/article/ucla-football-practice-field-los-angeles-rain-flood-weather/,https://brobible.com/wp-content/uploads/2025/10/los-angeles-rain-ucla-football-practice-field-flood.jpg,,"iStockphoto / © Brendan Mullin-Imagn Images
The practice field at UCLA was completely flooded prior to college football practice earlier this week. Los Angeles is not prepared for rain.
It was a hi… [+2374 chars]",,"Heftige Regenfälle richten in Los Angeles verheerende Schäden an, während die Überschwemmung an der UCLA das Übungsfeld in Trümmern hinterlässt. Das Übungsfeld der UCLA wurde Anfang dieser Woche vor dem College-Football-Training vollständig überflutet. Los Angeles ist nicht auf Regen vorbereitet. Es war ein urkomisches Bild, obwohl es eine Erklärung für das Versagen der Entwässerung gibt. Unwettergefahr droht …",Heavy Rains Wreak Havoc On Los Angeles As UCLA Flooding Leaves Practice Field In Shambles. The practice field at UCLA was completely flooded prior to college football practice earlier this week. Los Angeles is not prepared for rain. It was a hilarious visual even though there is an explanation for the drainage failure. Threat of severe weather crea…,"Pluviis graves in Los Angeles perdat, Ut UCLA Folia Inundatio Field Usu in macello. Praxis campi apud UCLA ante collegium eu praxis ante hac septimana omnino inundata erat. Los Angeles non est pluvia paratus. Visiva hilaris erat, quamvis explicatio pro INCILE defectum. Comminatio gravibus tempestatibus crea…",2025-10-22 02:46:51+00:00
5b5a93706aec376e15d1554e7465d427,2025-10-17T06:30:00Z,'floods',www.rigzone.com,en,0.0,"Santos Posts Lower Quarterly Production, Narrows 2025 Projection","The projection downgrade 'is primarily due to the slower-than-anticipated start-up of the BW Opal FPSO, and the impact of floods on Cooper Basin production with recovery efforts extending into the fourth quarter'.",https://www.rigzone.com/news/santos_posts_lower_quarterly_production_narrows_2025_projection-17-oct-2025-182102-article/,https://images.rigzone.com/images/news/articles/Santos-Posts-Lower-Quarterly-Production-Narrows-2025-Projection-182102-1200x628.png,,Santos Ltd on Thursday reported a four percent quarter-on-quarter decrease in output to 21.3 million barrels of oil equivalent (MMboe) as a decline in Western Australia offset increases across the re… [+4719 chars],,"Santos meldet niedrigere Quartalsproduktion und schmälert Prognose für 2025. Die Herabstufung der Prognose „ist in erster Linie auf die langsamer als erwartete Inbetriebnahme des BW Opal FPSO und die Auswirkungen von Überschwemmungen auf die Produktion im Cooper Basin zurückzuführen, wobei sich die Wiederherstellungsbemühungen bis ins vierte Quartal hinziehen“.","Santos Posts Lower Quarterly Production, Narrows 2025 Projection. The projection downgrade 'is primarily due to the slower-than-anticipated start-up of the BW Opal FPSO, and the impact of floods on Cooper Basin production with recovery efforts extending into the fourth quarter'.","Santos Posts Productio Inferior Quarterly, Narrows 2025 Proiectio. Gradus proiectio ""praesertim ob initium tardioris quam praeventus in BW Opal FPSO, et impetus diluvii in Cooper Basin productio cum conatibus in quartam partem convalescentibus"".",2025-10-22 02:46:51+00:00
bb72c2554cb5c103d5b5e25e0e9b3d91,2025-10-17T07:54:14Z,'floods',biztoc.com,en,0.0,Pakistan Finance Minister Says GDP Takes Hit From Deadly Floods,,https://biztoc.com/x/ffe5c3d567073c42,https://biztoc.com/cdn/ffe5c3d567073c42_s.webp,,"{ window.open(this.href, '_blank'); }, 200); return false;""&gt;Why did Nestlé announce major job cuts? { window.open(this.href, '_blank'); }, 200); return false;""&gt;How will Trump-Putin talks impact… [+706 chars]",,"Der pakistanische Finanzminister sagt, das BIP sei von tödlichen Überschwemmungen betroffen. Nan",Pakistan Finance Minister Says GDP Takes Hit From Deadly Floods. nan,Pakistan Finance Minister dicit GDP percussum ex inundationibus mortiferis. nan,2025-10-22 02:46:51+00:00
0526200c3da3d769f967e985db6ad915,2025-10-17T11:36:32Z,'flooding',crooksandliars.com,en,0.0,Trump's EPA Cancelled Flood Protection Grant In Alaska...,"The remote village of Kipnuk had planned to use the money from the EPA to protect itself from flooding, but that money was cancelled by the Trump administration. On Sunday, the entire village was underwater.
But this is what happens when you put irresponsible…",https://crooksandliars.com/2025/10/epa-cancels-flood-protection-grant-alaska,https://crooksandliars.com/files/embeds/2025/10/67590.jpg,,"The remote village of Kipnuk had planned to use the money from the EPA to protect itself from flooding, but that money was cancelled by the Trump administration. On Sunday, the entire village was und… [+2484 chars]",,"Trumps EPA hat den Hochwasserschutzzuschuss in Alaska gestrichen. Das abgelegene Dorf Kipnuk hatte geplant, das Geld der EPA zu verwenden, um sich vor Überschwemmungen zu schützen, aber dieses Geld wurde von der Trump-Regierung gestrichen. Am Sonntag stand das gesamte Dorf unter Wasser.
Aber genau das passiert, wenn man unverantwortlich handelt …","Trump's EPA Cancelled Flood Protection Grant In Alaska.... The remote village of Kipnuk had planned to use the money from the EPA to protect itself from flooding, but that money was cancelled by the Trump administration. On Sunday, the entire village was underwater.
But this is what happens when you put irresponsible…","Trump's EPA Diluvium Cancellatum Praesidium In Alaska.... remotus pagus Kipnuk cogitavit pecuniam ab EPA ab inundatione se tueri, sed pecuniam ab administratione Trump abolitam esse. Die dominico tota villa aquatica erat.
Sed hoc fit cum inofficiosum posuistis.",2025-10-22 02:46:51+00:00
a73bac6522de3f82ccd426976c0b9599,2025-10-17T13:00:00Z,'floods',soldiersystems.net,en,0.0,"SylvanSport Unveils GO. Rapid Response: The All-In-One Lightweight Tactical Hauler, Trailer and Shelter Engineered for First Responders, Military and Disaster Relief","Brevard, NC – [October 16, 2025] – In the wake of mounting disastrous events from hurricanes, fires, earthquakes, and floods and growing demand for fast-deploying field equipment, SylvanSport today announced the launch of its GO. Rapid Response tactical trail…",https://soldiersystems.net/2025/10/17/sylvansport-unveils-go-rapid-response-the-all-in-one-lightweight-tactical-hauler-trailer-and-shelter-engineered-for-first-responders-military-and-disaster-relief/,https://soldiersystems.net/wp-content/uploads/2025/10/IMG_7553-440x293.jpeg,,"Brevard, NC [October 16, 2025] In the wake of mounting disastrous events from hurricanes, fires, earthquakes, and floods and growing demand for fast-deploying field equipment, SylvanSport today annou… [+6227 chars]",,"SylvanSport stellt GO vor. Schnelle Reaktion: Der leichte taktische All-in-One-Transporter, Anhänger und Unterstand, entwickelt für Ersthelfer, Militär und Katastrophenhilfe. Brevard, NC – [16. Oktober 2025] – Angesichts zunehmender katastrophaler Ereignisse wie Hurrikane, Brände, Erdbeben und Überschwemmungen und der wachsenden Nachfrage nach schnell einsetzbarer Feldausrüstung gab SylvanSport heute die Einführung seines GO bekannt. Taktischer Rapid-Response-Trail…","SylvanSport Unveils GO. Rapid Response: The All-In-One Lightweight Tactical Hauler, Trailer and Shelter Engineered for First Responders, Military and Disaster Relief. Brevard, NC – [October 16, 2025] – In the wake of mounting disastrous events from hurricanes, fires, earthquakes, and floods and growing demand for fast-deploying field equipment, SylvanSport today announced the launch of its GO. Rapid Response tactical trail…","SylvanSport retegit GO. Celeri Responsio: Omnia In-unum leve Tactical Hauler, Trailer et tegimen machinatum pro Primo Responders, Militum et Malum Solamen. Brevard, NC - [Octobris 16, 2025] - In casum ascendendi calamitosos eventus ab turbinibus, incendiis, terrae motibus, inundationibus et increscentia exigendi apparatum campi rapidi explicandi, SylvanSport hodie denuntiavit GO deductionem eius. Celeri Responsio imperatoriae trahentium…",2025-10-22 02:46:51+00:00
a1a168c7c02f426f8f2cce397fe778e1,2025-10-17T13:32:50Z,'flooding',kotaku.com,en,0.0,Report: Nintendo Is Flooding The Market With Switch 2s And Shows No Signs Of Stopping,"The Mario maker will reportedly produce 25 million units in the first year
The post Report: Nintendo Is Flooding The Market With Switch 2s And Shows No Signs Of Stopping appeared first on Kotaku.",https://kotaku.com/nintendo-switch-2-sales-stock-holiday-price-tariff-2000636565,https://kotaku.com/app/uploads/2025/06/507b67ab9dda5250ecb14dea73398040-1200x675.jpg,,"Nintendo is making a lot of Switch 2s. Like, a lot a lot. According to Bloomberg, suppliers have been asked to ramp up production enough for the company to sell up to 25 million Switch 2s by the end … [+1723 chars]",,"Bericht: Nintendo überschwemmt den Markt mit Switch 2s und zeigt keine Anzeichen eines Stopps. Berichten zufolge wird der Mario-Hersteller im ersten Jahr 25 Millionen Einheiten produzieren
Der Beitrag „Bericht: Nintendo überschwemmt den Markt mit Switch 2s und zeigt keine Anzeichen eines Stopps“ erschien zuerst auf Kotaku.","Report: Nintendo Is Flooding The Market With Switch 2s And Shows No Signs Of Stopping. The Mario maker will reportedly produce 25 million units in the first year
The post Report: Nintendo Is Flooding The Market With Switch 2s And Shows No Signs Of Stopping appeared first on Kotaku.","Report: Nintendo inundat mercatum Cum switch 2s et nulla signa restitit. Mario factori parem XXV decies unitates in primo anno producere
Post Report: Nintendo inundat Market Cum Switch 2s et ostendit nulla signa reprimendi primum apparuit in Kotaku.",2025-10-22 02:46:51+00:00
5b98c76dfece9d2ad7997cd4ee38016c,2025-10-17T17:32:32Z,'floods',abcnews.go.com,en,0.0,"Communities destroyed, hundreds evacuated due to devastating floods in Alaska","On Thursday, 264 were evacuated by the Alaska National Guard.",https://abcnews.go.com/US/hundreds-evacuated-homes-destroyed-alaska-communities-reel-devastating/story?id=126612663,https://s.yimg.com/ny/api/res/1.2/uNPvO8GG.JSIDj.yHw5xKg--/YXBwaWQ9aGlnaGxhbmRlcjt3PTEyMDA7aD05MDA7Y2Y9d2VicA--/https://media.zenfs.com/en/us.abcnews.go.com/fb110c71566c93b2646c93ec9a542657,,"In the aftermath of a destructive typhoon, historic floodwaters have destroyed remote communities across western Alaska, causing hundreds of evacuations that could continue for days, officials said.… [+3912 chars]",,"Durch die verheerenden Überschwemmungen in Alaska wurden Gemeinden zerstört, Hunderte evakuiert. Am Donnerstag wurden 264 von der Alaska National Guard evakuiert.","Communities destroyed, hundreds evacuated due to devastating floods in Alaska. On Thursday, 264 were evacuated by the Alaska National Guard.","Communitates destructae, centenae ob inundationes in Alaska vastandas decesserunt. Feria quinta 264 ab Alaska Nationale Cohortis evacuata est.",2025-10-22 02:46:51+00:00
74b9eeeca3f20de90ea2064d12facea5,2025-10-19T03:56:13Z,'flooding',economictimes.indiatimes.com,en,0.0,Heavy rain batters Kerala; orange alert in six districts,"Kerala districts are experiencing heavy rainfall and flooding, with an orange alert issued for six districts and Lakshadweep. Idukki district is severely affected by flooding and mudslides, leading to residents being shifted to relief camps. Water levels have…",https://economictimes.indiatimes.com/news/india/heavy-rain-batters-kerala-orange-alert-in-six-districts/articleshow/124682074.cms,"https://img.etimg.com/thumb/msid-124682089,width-1200,height-630,imgsize-1950064,overlay-economictimes/articleshow.jpg",,Heavy rain continued to batter the high-range areas of several districts in Kerala on Sunday and many low-lying regions experienced flooding.The India Meteorological Department (IMD) has issued an or… [+1734 chars],,"Heftiger Regen erschüttert Kerala; Orange Alarm in sechs Bezirken. In den Bezirken von Kerala kommt es zu heftigen Regenfällen und Überschwemmungen. Für sechs Bezirke und Lakshadweep wurde eine orangefarbene Warnung ausgegeben. Der Bezirk Idukki ist stark von Überschwemmungen und Schlammlawinen betroffen, was dazu führt, dass die Bewohner in Hilfslager verlegt werden. Wasserstände haben…","Heavy rain batters Kerala; orange alert in six districts. Kerala districts are experiencing heavy rainfall and flooding, with an orange alert issued for six districts and Lakshadweep. Idukki district is severely affected by flooding and mudslides, leading to residents being shifted to relief camps. Water levels have…","Imber gravis quatit Kerala; aurantiaca erecta in sex pagis. Kerala regiones pluvias et inundationes graves experiuntur, cum intento aurantiaco sex regiones et Lakshadweep edita sunt. Idukki regio graviter inundationes et mudslides afficitur, ducens ad incolas ad castra subsidia transferenda. Aquae gradus habent…",2025-10-22 02:46:51+00:00
f340be123abacabc610426311bc28bc3,2025-10-19T07:40:23Z,'flooding storm',www.aljazeera.com,en,0.0,"Five dead, two missing as Tropical Storm Fengshen soaks Philippines","Heavy flooding reported in several central Philippine islands, including Samar and Panay, forcing thousands to evacuate.",https://www.aljazeera.com/news/2025/10/19/five-dead-two-missing-as-tropical-storm-fengshen-soaks-philippines,https://www.aljazeera.com/wp-content/uploads/2025/10/2025-10-04T133855Z_2120736150_RC2Q4HAG7HH2_RTRMADP_3_ASIA-WEATHER-PHILIPPINES-1760858122.jpg?resize=1920%2C1440,,"At least five people have been killed and two reported missing as Tropical Storm Fengshen sweeps through the Philippines, triggering heavy flooding on the main island of Luzon and a vast landslide on… [+2866 chars]",,"Fünf Tote, zwei Vermisste, als der Tropensturm Fengshen über die Philippinen hinwegfegt. Auf mehreren zentralen philippinischen Inseln, darunter Samar und Panay, wurden schwere Überschwemmungen gemeldet, die Tausende zur Evakuierung zwangen.","Five dead, two missing as Tropical Storm Fengshen soaks Philippines. Heavy flooding reported in several central Philippine islands, including Samar and Panay, forcing thousands to evacuate.","Quinque mortui, duo absentes ut Tropical Fengshen Tempestatem libat Philippines. Gravis inundatio nuntiavit in compluribus insulis Philippinis centralibus, incluso Samar et Panay, millia excedere cogente.",2025-10-22 02:46:51+00:00
30806db2cecdb43aa3a1306c953a4bac,2025-10-19T11:08:21Z,'flooding rain',www.bbc.com,en,0.0,Sandbags used to protect homes after flooding in County Down,"A yellow weather warning for rain in parts of counties Antrim, Armagh, and Down has been extended until 15:00 BST on Sunday.",https://www.bbc.com/news/articles/cx2pnvpglxvo,https://ichef.bbci.co.uk/news/1024/branded_news/5902/live/dddfae70-acd9-11f0-a019-353481c6a9f9.jpg,,"Flooding on the Tullybrannigan Road in Newcastle, County Down, this morning. Photos by Samuel Guist.
People living in Newcastle County Down have been using sandbags to protect their homes after floo… [+1608 chars]",,"Sandsäcke dienten zum Schutz von Häusern nach Überschwemmungen in der Grafschaft Down. Eine gelbe Wetterwarnung für Regen in Teilen der Landkreise Antrim, Armagh und Down wurde bis Sonntag, 15:00 Uhr BST verlängert.","Sandbags used to protect homes after flooding in County Down. A yellow weather warning for rain in parts of counties Antrim, Armagh, and Down has been extended until 15:00 BST on Sunday.","Sandbags domos tueri solebant post inundationem in Comitatu Down. Tempestas flavus admonitio pluviarum in partibus comitatuum Antrim, Armagh et Dunensis protenditur usque ad 15:00 BST die Dominico.",2025-10-22 02:46:51+00:00
e23bb6f498d855f094406c9f3df53b40,2025-10-20T04:13:05Z,'flooding disaster',www.yahoo.com,en,0.0,"Flood reckoning for Bali on overdevelopment, waste","Standing where her family home once was, Ruth Deidree Boelan closed her eyes and prayed for relatives missing in devastating flash floods that swept resort...",https://www.yahoo.com/news/articles/flood-reckoning-bali-overdevelopment-waste-041305801.html,https://media.zenfs.com/en/afp.com/6b12a175c5bf6825bc29146b0f7ee1d1,,"Standing where her family home once was, Ruth Deidree Boelan closed her eyes and prayed for relatives missing in devastating flash floods that swept resort island Bali this year.
The deluge that kil… [+4373 chars]",,"Überschwemmungsrechnungen für Bali aufgrund von Überbebauung und Verschwendung. Ruth Deidree Boelan stand dort, wo einst das Haus ihrer Familie stand, schloss die Augen und betete für die Angehörigen, die bei den verheerenden Sturzfluten, die das Resort überschwemmten, vermisst wurden …","Flood reckoning for Bali on overdevelopment, waste. Standing where her family home once was, Ruth Deidree Boelan closed her eyes and prayed for relatives missing in devastating flash floods that swept resort...","Diluvium supputatio Bali in overvelopment, waste. Ruth Deidree Boelan, stans ubi quondam familia eius erat, oculos clausit suos oravit pro propinquis absentibus in diluvia vastanda, quae rapitur, conveniunt...",2025-10-22 02:46:51+00:00
9fe3bf01687d18a39a831ee63d8db478,2025-10-20T04:18:17Z,'flooding buildings',www.ibtimes.com,en,0.0,"Flood Reckoning For Bali On Overdevelopment, Waste","Standing where her family home once was, Ruth Deidree Boelan closed her eyes and prayed for relatives missing in devastating flash floods that swept resort island Bali this year.",https://www.ibtimes.com/flood-reckoning-bali-overdevelopment-waste-3787583,https://d.ibtimes.com/en/full/4629671/ruth-deidree-boelan-prays-her-relatives-who-went-missing-recent-flooding-when-their-home.jpg,,"Standing where her family home once was, Ruth Deidree Boelan closed her eyes and prayed for relatives missing in devastating flash floods that swept resort island Bali this year.
The deluge that kil… [+4307 chars]",,"Hochwasserabrechnung für Bali: Überbebauung und Verschwendung. Ruth Deidree Boelan stand dort, wo einst das Haus ihrer Familie stand, schloss die Augen und betete für die Angehörigen, die bei den verheerenden Sturzfluten, die dieses Jahr die Ferieninsel Bali heimgesucht hatten, vermisst wurden.","Flood Reckoning For Bali On Overdevelopment, Waste. Standing where her family home once was, Ruth Deidree Boelan closed her eyes and prayed for relatives missing in devastating flash floods that swept resort island Bali this year.","Diluvium rationis Bali de Overdevelopment, Vastum. Cum domus eius familia olim staret, Ruth Deidree Boelan oculos clausit et oravit pro propinquis absentibus in diluvia vastanda quae hoc anno insulam Bali frequentarunt.",2025-10-22 02:46:51+00:00
039c72cf46f08f35eaf5b760ed1e49b9,2025-10-20T09:25:19Z,'flooding residents',www.bbc.com,en,0.0,Calls for 'permanent flooding solution' as major clean-up continues,Diggers and large lorries are clearing debris after flooding swept some residential streets in county Down after two days of heavy rainfall.,https://www.bbc.com/news/articles/c620e6n61zjo,https://ichef.bbci.co.uk/news/1024/branded_news/b1ed/live/5decaf90-ad8a-11f0-93d0-d5294e42252c.jpg,,"Rebekah WilsonBBC News NI
Diggers continue to clear up the debris and flood water on residential streets in Newcastle
Road workers and residents are continuing the clean-up after ""frightening"" floo… [+5046 chars]",,"Fordert eine „permanente Überschwemmungslösung“, während die großen Aufräumarbeiten fortgesetzt werden. Bagger und große Lastwagen räumen Trümmer weg, nachdem nach zwei Tagen heftiger Regenfälle einige Wohnstraßen im County Down überschwemmt wurden.",Calls for 'permanent flooding solution' as major clean-up continues. Diggers and large lorries are clearing debris after flooding swept some residential streets in county Down after two days of heavy rainfall.,Poscit solutionem inundationis permanentem sicut maior mundatio pergit. Fossores et magnae lorries purgant strages post inundationem scopis quibusdam viis residentialibus in comitatu Dunensi post duos dies pluviae gravis.,2025-10-22 02:46:51+00:00
5c4c6c65818e99be74a3b9844efee57d,2025-10-20T12:00:00Z,'flooding victims',www.washingtonpost.com,en,0.0,Hollywood’s Latest Drama Is All Of The Fake Props Flooding The Market,"“From Dorothy’s ruby slippers in The Wizard of Oz to Harry Potter wands, props from iconic films are earning big dollars at both auction and private sales — in some cases on par with rare wine, Swiss watches and fine art.” – Los Angeles Times (MSN)",https://www.washingtonpost.com/entertainment/2025/10/19/she-spurned-concertmasters-advance-now-shes-classical-musics-metoo-vigilante/,https://s.yimg.com/ny/api/res/1.2/pOstgi_m91SnQ95D4z4UfA--/YXBwaWQ9aGlnaGxhbmRlcjt3PTEyMDA7aD04MDA7Y2Y9d2VicA--/https://media.zenfs.com/en/washington_post_entertainment_articles_637/a046c2a918e10d2827f07ab82e853cc2,,"BALTIMORE Claire Pollock kept quiet for years about the sexual trauma that she says forced her to abandon a promising career in classical music.
I couldnt handle playing anymore, says the former bar… [+31768 chars]",,"Hollywoods neuestes Drama besteht aus gefälschten Requisiten, die den Markt überschwemmen. „Von Dorothys Rubinpantoffeln in „Der Zauberer von Oz“ bis hin zu Harry-Potter-Zauberstäben erzielen Requisiten aus legendären Filmen sowohl bei Auktionen als auch bei Privatverkäufen hohe Einnahmen – in einigen Fällen auf Augenhöhe mit seltenen Weinen, Schweizer Uhren und bildender Kunst.“ – Los Angeles Times (MSN)","Hollywood’s Latest Drama Is All Of The Fake Props Flooding The Market. “From Dorothy’s ruby slippers in The Wizard of Oz to Harry Potter wands, props from iconic films are earning big dollars at both auction and private sales — in some cases on par with rare wine, Swiss watches and fine art.” – Los Angeles Times (MSN)","Tardus Drama Hollywood est All Of The Fake Props Flooding Market. ""Ex Dorothy crepidis in Ruby in The Wizard of Oz ad Harrius Potter virgas, adminicula ex pellibus iconicis magnas dollaria tum auctionis tum privatis venditionibus merentur - in quibusdam par vino rari, vigiliae Helvetiae et arte subtilia."" – Los Angeles Times (MSN)",2025-10-22 02:46:51+00:00
499fa743cfbcbb611010d53da272a4f6,2025-10-20T13:29:21Z,'flooding evacuation',www.insurancejournal.com,en,0.0,Alaska Storm Damage So Bad Many Evacuees Won’t Go Home for at Least 18 Months,"Damage to remote Alaska villages hammered by flooding last weekend is so extreme that many of the more than 2,000 people displaced won’t be able to return to their homes for at least 18 months, Gov. Mike Dunleavy said in …",https://www.insurancejournal.com/news/west/2025/10/20/844446.htm,https://www.insurancejournal.com/img/social/opengraph/ij-social-default-1200x630.png,,"Damage to remote Alaska villages hammered by flooding last weekend is so extreme that many of the more than 2,000 people displaced won’t be able to return to their homes for at least 18 months, Gov. … [+4143 chars]",,"Sturmschäden in Alaska so schlimm, dass viele Evakuierte mindestens 18 Monate lang nicht nach Hause gehen können. Die Schäden an abgelegenen Dörfern in Alaska, die letztes Wochenende von Überschwemmungen heimgesucht wurden, sind so extrem, dass viele der mehr als 2.000 Vertriebenen mindestens 18 Monate lang nicht in ihre Häuser zurückkehren können, sagte Gouverneur Mike Dunleavy in …","Alaska Storm Damage So Bad Many Evacuees Won’t Go Home for at Least 18 Months. Damage to remote Alaska villages hammered by flooding last weekend is so extreme that many of the more than 2,000 people displaced won’t be able to return to their homes for at least 18 months, Gov. Mike Dunleavy said in …","Alaska Storm Damnum So Mali Multi Evacuees domum non ingrediuntur ad minimum 18 mensibus. Damnum ad remotissimas Alaska villas quae inundatione proximae auctoris tunduntur, tam extrema est ut multi plus quam 2,000 hominum destituti non possint ad domos suas redire per menses saltem XVIII, Gov. Mike Dunleavy dixit in …",2025-10-22 02:46:51+00:00
